,album_artist,album_mood,album_title,allmusic_href,lyrics,lyrics(normalized_no_stopwords),lyrics(normalized_with_stopwords),positive_score,negative_score,compound_score,sentiment_label,lyrics_href,track_genres,track_length,track_moods,track_title,track_url
68,Phil Spector,happy,A Christmas Gift for You?,/album/a-christmas-gift-for-you-from-phil-spector-mw0000193247,"Sleigh bells ring, are you listenin'
In the lane, snow is glistening
A beautiful sight, we're happy tonight
Walking in a winter wonderland

Gone away is the blue bird
Here to stay is the new bird
He's singing our song, as we go along
Walking in a winter wonderland

In the meadow we can build a snowman
Then pretend that he is Carson Brown
He'll say ""Are you married?"", We'll say ""No man,
But you can do the job when you're in town.""

Later on, we'll conspire
As we dream by the fire
To face unafraid, the plans that we made
Walking in a winter wonderland

In the meadow we can build a snowman
And pretend that he's a circus clown
We'll have lots of fun with Mr.Snowman
Until the other kiddies knock him down

When it snows, ain't it thrillin'
Though you know, kids are chillin'
We'll frolic and play, the Eskimo way
Walking in a winter wonderland (wo oh oh)
Walking in a winter wonderland (wo oh oh)
Walking in a winter wonderland (wo oh oh)
Walking in a winter wonderland (wo oh oh)
Walking in a winter wonderland (wo oh oh)
Walking in a winter wonderland",sleigh bell ring listenin lane snow glisten beautiful sight happy tonight walk winter wonderland go away blue bird stay new bird sing song go along walk winter wonderland meadow build snowman pretend carson brown say marry say no man job town later conspire dream fire face unafraid plan make walk winter wonderland meadow build snowman pretend circus clown lot fun mr snowman kiddy knock snow not thrillin though know kid chillin frolic play eskimo way walk winter wonderland wo oh oh walk winter wonderland wo oh oh walk winter wonderland wo oh oh walk winter wonderland wo oh oh walk winter wonderland wo oh oh walk winter wonderland,sleigh bell ring be you listenin in the lane snow be glisten a beautiful sight we be happy tonight walk in a winter wonderland go away be the blue bird here to stay be the new bird he be sing our song as we go along walk in a winter wonderland in the meadow we can build a snowman then pretend that he be carson brown he will say be you marry we will say no man but you can do the job when you be in town later on we will conspire as we dream by the fire to face unafraid the plan that we make walk in a winter wonderland in the meadow we can build a snowman and pretend that he be a circus clown we will have lot of fun with mr snowman until the other kiddy knock him down when it snow as not it thrillin though you know kid be chillin we will frolic and play the eskimo way walk in a winter wonderland wo oh oh walk in a winter wonderland wo oh oh walk in a winter wonderland wo oh oh walk in a winter wonderland wo oh oh walk in a winter wonderland wo oh oh walk in a winter wonderland,0.126,0.061,0.872,1,/lyric/24382579/Darlene+Love/Winter+Wonderland,"['Holiday', 'Pop/Rock']",2:28,"['happy', 'lush', 'amiable/good-natured', 'cheerful', 'exuberant', 'gentle', 'innocent', 'sweet']",Winter Wonderland,https://www.allmusic.com/song/winter-wonderland-mt0009344444
69,Phil Spector,happy,A Christmas Gift for You?,/album/a-christmas-gift-for-you-from-phil-spector-mw0000193247,"The toy shop door is locked up tight,
And everything is quiet for the night.
When suddenly,
The clock strikes twelve.
The fun's begun.

The dolls are in their best arrayed,
There's going to be a wonderful parade.
Hark to the drum,
Oh, here they come,
Cries everyone.

Hear them all cheering,
Now they are nearing,
There's the captain stiff as starch.
Bayonet's flashing,
Music is crashing,
As the wooden soldiers march
Sabers a-clinking
Soldiers a-winking
At each little pretty maid

Here they come, here they come
Here they come, here they come
Wooden soldiers on parade.

The toy shop door is locked up tight,
And everything is quiet for the night.
When suddenly,
The clock strikes twelve.
The fun's begun.

The dolls are in their best arrayed,
There's going to be a wonderful parade.
Hark to the drum,
Oh, here they come,
Cries everyone.

Hear them all cheering, now they are nearing,
There's the captain stiff as starch.
Bayonet's flashing, music is crashing,
As the wooden soldiers march
Hear them all cheering, now they are nearing,
There's the captain stiff as starch.
Bayonet's flashing, music is crashing,
As the wooden soldiers march

Hear them all cheering, now they are nearing,
There's the captain stiff as starch.",toy shop door lock tight everything quiet night suddenly clock strike twelve fun begin doll good array go wonderful parade hark drum oh come cry everyone hear cheer near captain stiff starch bayonet flashing music crash wooden soldier march saber clink soldier winking little pretty maid come come come come wooden soldier parade toy shop door lock tight everything quiet night suddenly clock strike twelve fun begin doll good array go wonderful parade hark drum oh come cry everyone hear cheer near captain stiff starch bayonet flashing music crash wooden soldier march hear cheer near captain stiff starch bayonet flashing music crash wooden soldier march hear cheer near captain stiff starch,the toy shop door be lock up tight and everything be quiet for the night when suddenly the clock strike twelve the fun begin the doll be in their good array there be go to be a wonderful parade hark to the drum oh here they come cry everyone hear them all cheer now they be near there be the captain stiff as starch bayonet flashing music be crash as the wooden soldier march saber a clink soldier a winking at each little pretty maid here they come here they come here they come here they come wooden soldier on parade the toy shop door be lock up tight and everything be quiet for the night when suddenly the clock strike twelve the fun begin the doll be in their good array there be go to be a wonderful parade hark to the drum oh here they come cry everyone hear them all cheer now they be near there be the captain stiff as starch bayonet flashing music be crash as the wooden soldier march hear them all cheer now they be near there be the captain stiff as starch bayonet flashing music be crash as the wooden soldier march hear them all cheer now they be near there be the captain stiff as starch ,0.246,0.118,0.9666,1,/lyric/24382578/The+Crystals/Parade+of+the+Wooden+Soldiers,"['Holiday', 'Pop/Rock']",2:57,"['happy', 'lush', 'amiable/good-natured', 'cheerful', 'exuberant', 'gentle', 'innocent', 'sweet']",Parade of the Wooden Soldiers,https://www.allmusic.com/song/parade-of-the-wooden-soldiers-mt0001832601
70,Phil Spector,happy,A Christmas Gift for You?,/album/a-christmas-gift-for-you-from-phil-spector-mw0000193247,"(Christmas)
The snow's coming down
(Christmas)
I'm watching it fall
(Christmas)
Lots of people around
(Christmas)
Baby please come home

(Christmas)
The church bells in town
(Christmas)
All ringing in song
(Christmas)
Full of happy sounds
(Christmas)
Baby please come home

They're singing ""Deck The Halls""
But it's not like Christmas at all
'Cause I remember when you were here
And all the fun we had last year

(Christmas)
Pretty lights on the tree
(Christmas)
I'm watching them shine
(Christmas)
You should be here with me
(Christmas)
Baby please come home

They're singing ""Deck The Halls""
But it's not like Christmas at all
'Cause I remember when you were here
And all the fun we had last year

(Christmas)
If there was a way
(Christmas)
I'd hold back this tear
(Christmas)
But it's Christmas day
Please, please, please, please
Please, please, please, please
Please, please, please, please
Please, please
Baby, please come home
(Christmas)
Baby, please come home
(Christmas)
Baby, please come home
(Christmas)
Baby, please come home
(Christmas)
Oh, yeah, yeah, yeah
(Christmas)
(Christmas)
Please come home
(Christmas)",christmas snow come christmas watch fall christmas lot people around christmas baby please come home christmas church bell town christmas ring song christma full happy sound christmas baby please come home sing deck hall not like christma ecause remember fun last year christmas pretty light tree christmas watch shine christmas christmas baby please come home sing deck hall not like christma ecause remember fun last year christmas way christmas would hold back tear christmas christma day please please please please please please please please please please please please please please baby please come home christmas baby please come home christmas baby please come home christmas baby please come home christmas oh yeah yeah yeah christmas christma please come home christmas, christmas the snow come down christmas i be watch it fall christmas lot of people around christmas baby please come home christmas the church bell in town christmas all ring in song christma full of happy sound christmas baby please come home they be sing deck the hall but it be not like christma at all ecause i remember when you be here and all the fun we have last year christmas pretty light on the tree christmas i be watch them shine christmas you should be here with me christmas baby please come home they be sing deck the hall but it be not like christma at all ecause i remember when you be here and all the fun we have last year christmas if there be a way christmas i would hold back this tear christmas but it be christma day please please please please please please please please please please please please please please baby please come home christmas baby please come home christmas baby please come home christmas baby please come home christmas oh yeah yeah yeah christmas christma please come home christmas ,0.431,0.026,0.9952,1,/lyric/24382577/Darlene+Love/Christmas+%28Baby+Please+Come+Home%29,"['Holiday', 'Pop/Rock']",2:49,"['happy', 'lush', 'amiable/good-natured', 'cheerful', 'exuberant', 'gentle', 'innocent', 'sweet']",Christmas (Baby Please Come Home),https://www.allmusic.com/song/christmas-baby-please-come-home-mt0002228405
71,Phil Spector,happy,A Christmas Gift for You?,/album/a-christmas-gift-for-you-from-phil-spector-mw0000193247,"Hello, this is Phil Spector, it is so difficult at this time 
To say words that would express my feelings 
About the album to which you have just listened 
An album that has been in the planning for many, many months

First, let me thank all the people who worked so hard with me 
In the production of this album and in my endeavor and desire 
To bring something new and different to the music of Christmas 
And to the recording industry which is so much a part of my life

Of course, the biggest thanks goes to you 
For giving me the opportunity to relate my feelings 
Of Christmas through the music that I love

At this moment, I am very proud of all the artists 
And on behalf of all of them, The Crystals, The Ronettes 
Darlene Love, Bobby Soxx and the Blue Jeans, and myself

May we wish you the very merriest of Christmases 
And the happiest of New Years, and thank you so very much 
For letting us spend this Christmas with you

(Holy infant so tender and mild 
Sleep in heavenly peace)",hello phil spector difficult time say word would express feeling album listen album planning many many month first let thank people work hard production album endeavor desire bring something new different music christma recording industry much part life course big thank go give opportunity relate feeling christma music love moment proud artist behalf crystal ronette darlene love bobby soxx blue jean may wish merry christmas happy new year thank much let us spend christmas holy infant tender mild sleep heavenly peace,hello this be phil spector it be so difficult at this time to say word that would express my feeling about the album to which you have just listen an album that have be in the planning for many many month first let me thank all the people who work so hard with me in the production of this album and in my endeavor and desire to bring something new and different to the music of christma and to the recording industry which be so much a part of my life of course the big thank go to you for give me the opportunity to relate my feeling of christma through the music that i love at this moment i be very proud of all the artist and on behalf of all of them the crystal the ronette darlene love bobby soxx and the blue jean and myself may we wish you the very merry of christmas and the happy of new year and thank you so very much for let us spend this christmas with you holy infant so tender and mild sleep in heavenly peace ,0.398,0.035,0.9906,1,/lyric/5974775/Phil+Spector/Silent+Night,"['Holiday', 'Pop/Rock']",2:08,"['happy', 'lush', 'amiable/good-natured', 'cheerful', 'exuberant', 'gentle', 'innocent', 'sweet']",Silent Night,https://www.allmusic.com/song/silent-night-mt0001686461
72,Benny Goodman,happy,The Birth of Swing,/album/the-birth-of-swing-mw0000270154,"Got to give a little, take a little
And let your poor heart break a little
That's the story of, that's the glory of love

You got to laugh a little, cry a little
Until the clouds roll by a little
That's the story of, that's the glory of love

As long as there's the two of us
We've got the world and all it's charms
And when the world is through with us
We've got each other's arms

Got to win a little, lose a little
Always have the blues a little
That's the story of, that's the glory of love

",get give little take little let poor heart break little story glory love get laugh little cry little cloud roll little story glory love long two us get world charm world us get arm get win little lose little always blue little story glory love,get to give a little take a little and let your poor heart break a little that be the story of that be the glory of love you get to laugh a little cry a little until the cloud roll by a little that be the story of that be the glory of love as long as there be the two of us we have get the world and all it be charm and when the world be through with us we have get each other arm get to win a little lose a little always have the blue a little that be the story of that be the glory of love,0.435,0.111,0.9765,1,/lyric/914656/Benny+Goodman/Sometimes+I%27m+Happy,['Jazz'],3:43,"['amiable/good-natured', 'smooth', 'romantic', 'sentimental', 'sophisticated', 'innocent', 'elegant', 'happy']",Sometimes I'm Happy,https://www.allmusic.com/song/sometimes-im-happy-mt0031935754
73,Benny Goodman,happy,The Birth of Swing,/album/the-birth-of-swing-mw0000270154,"I just came back from a lovely trip along the Milky Way
Stopped off at the North Pole to spend a holiday
I called on dear old Santa Claus
To see what I could see
He took me to his workshop 
And told his plans to me, so
 
[Chorus]
You better watch out, you better not cry
Better not pout, I'm telling you why
Santa Claus is comin' to town
He's making a list and checking it twice
Gonna find out who's naughty and nice
Santa Claus is comin' to town
He sees you when you're sleepin'
He knows when you're a wake
He knows if you've been bad or good
So be good for goodness sake
Oh! You better watch out, you better not cry
Better not pout, I'm telling you why
Santa Claus is comin' to town
 
With little tin horns and little toy drums
Rooty toot toots and rummy tum tums
Santa Claus is comin' to town
And curly head dolls that toddle and coo
Elephants, boats, and kiddie cars too
Santa Claus is comin' to town
Then kids in Girl and Boy land will have a jubilee
They're gonna build a Toyland all around the Christmas tree
So! You better watch out, you better not cry
Better not pout, I'm telling you why
Santa Claus is comin' to town
 
Now Santa is a busy man, He has no time to play
He's got millions of stockings to fill on Christmas day
You'd better write your letter now
And mail it right away
Because he's getting ready
His reindeer's and his sleigh. So
 
[Chorus]
 
With little tin horns and little toy drums
Rooty toot toots and rummy tum tums
Santa Claus is comin' to town
And curly head dolls that toddle and coo
Elephants, boats, and kiddie cars too
Santa Claus is comin' to town
Then kids in Girl and Boy land will have a jubilee
They're gonna build a Toyland all around the Christmas tree
So! You better watch out, you better not cry
Better not pout, I'm telling you why
Santa Claus is comin' to town",come back lovely trip along milky way stop north pole spend holiday call dear old santa claus see could see take workshop tell plan [ chorus ] better watch better not cry better not pout tell santa claus comin town make list check twice go find naughty nice santa claus comin town see sleepin know wake know bad good good goodness sake oh better watch better not cry better not pout tell santa claus comin town little tin horn little toy drum rooty toot toot rummy tum tum santa claus comin town curly head doll toddle coo elephant boat kiddie car santa claus comin town kid girl boy land jubilee go build toyland around christmas tree better watch better not cry better not pout tell santa claus comin town santa busy man no time play get million stocking fill christma day would better write letter mail right away get ready reindeer sleigh [ chorus ] little tin horn little toy drum rooty toot toot rummy tum tum santa claus comin town curly head doll toddle coo elephant boat kiddie car santa claus comin town kid girl boy land jubilee go build toyland around christmas tree better watch better not cry better not pout tell santa claus comin town,i just come back from a lovely trip along the milky way stop off at the north pole to spend a holiday i call on dear old santa claus to see what i could see he take me to his workshop and tell his plan to me so [ chorus ] you better watch out you better not cry better not pout i be tell you why santa claus be comin to town he be make a list and check it twice go to find out who be naughty and nice santa claus be comin to town he see you when you be sleepin he know when you be a wake he know if you have be bad or good so be good for goodness sake oh you better watch out you better not cry better not pout i be tell you why santa claus be comin to town with little tin horn and little toy drum rooty toot toot and rummy tum tum santa claus be comin to town and curly head doll that toddle and coo elephant boat and kiddie car too santa claus be comin to town then kid in girl and boy land will have a jubilee they be go to build a toyland all around the christmas tree so you better watch out you better not cry better not pout i be tell you why santa claus be comin to town now santa be a busy man he have no time to play he be get million of stocking to fill on christma day you would better write your letter now and mail it right away because he be get ready his reindeer and his sleigh so [ chorus ] with little tin horn and little toy drum rooty toot toot and rummy tum tum santa claus be comin to town and curly head doll that toddle and coo elephant boat and kiddie car too santa claus be comin to town then kid in girl and boy land will have a jubilee they be go to build a toyland all around the christmas tree so you better watch out you better not cry better not pout i be tell you why santa claus be comin to town,0.287,0.031,0.9959,1,/lyric/957691/Benny+Goodman/Santa+Claus+Came+in+the+Spring,['Jazz'],3:09,"['amiable/good-natured', 'wintry', 'fun', 'happy', 'sweet', 'joyous', 'rollicking', 'innocent']",Santa Claus Came in the Spring,https://www.allmusic.com/song/santa-claus-came-in-the-spring-mt0011957007
74,Benny Goodman,happy,The Birth of Swing,/album/the-birth-of-swing-mw0000270154,"'Cause it's been so long
Since I held you tight
When we said good night
It's been so long
Honey, can't you see
What you've done to me?
I've been in a kind of daze
For days and days and days
Feelin' blue, missin' you
In, oh, so many ways
'Cause it was so nice
When we had that date
Every night at eight
It was so nice
Then we said good-bye
What a fool was I
Let me get back in your arms where I belong
'Cause it's been, oh, so long",ecause long since hold tight say good night long honey not see kind daze day day day feelin blue missin oh many way ecause nice date every night eight nice say good bye fool let get back arm belong ecause oh long,ecause it be be so long since i hold you tight when we say good night it be be so long honey can not you see what you have do to me i have be in a kind of daze for day and day and day feelin blue missin you in oh so many way ecause it be so nice when we have that date every night at eight it be so nice then we say good bye what a fool be i let me get back in your arm where i belong ecause it be be oh so long,0.241,0.106,0.7385,1,/lyric/957702/Benny+Goodman/It%27s+Been+So+Long,['Jazz'],3:24,"['amiable/good-natured', 'smooth', 'romantic', 'sentimental', 'sophisticated', 'innocent', 'elegant', 'happy']",It's Been So Long,https://www.allmusic.com/song/its-been-so-long-mt0011977754
75,Benny Goodman,happy,The Birth of Swing,/album/the-birth-of-swing-mw0000270154,"And now the purple dusk of twilight time
Steals across the meadows of my heart
High up in the sky the little stars climb
Always reminding me that we're apart
You wander down the lane and far away
Leaving me a song that will not die
Love is now the stardust of yesterday
The music of the years gone by.
 
Sometimes I wonder, how I spend
The lonely nights
Dreaming of a song
The melody 
Haunts my reverie
And I am once again with you
When our love was new 
And each kiss an inspiration
But that was long ago
And now my consolation is in the stardust of a song

Besides the garden wall, when stars are bright
You are in my arms
The nightingale 
Tells his fairytale
Of paradise, where roses grew
Though I dream in vain
In my heart it will remain
My stardust melody
The memory of love's refrain.",purple dusk twilight time steal across meadow heart high sky little star climb always remind apart wander lane far away leave song not die love stardust yesterday music year go sometimes wonder spend lonely night dream song melody haunt reverie love new kiss inspiration long ago consolation stardust song besides garden wall star bright arm nightingale tell fairytale paradise rose grow though dream vain heart remain stardust melody memory love refrain,and now the purple dusk of twilight time steal across the meadow of my heart high up in the sky the little star climb always remind me that we be apart you wander down the lane and far away leave me a song that will not die love be now the stardust of yesterday the music of the year go by sometimes i wonder how i spend the lonely night dream of a song the melody haunt my reverie and i be once again with you when our love be new and each kiss an inspiration but that be long ago and now my consolation be in the stardust of a song besides the garden wall when star be bright you be in my arm the nightingale tell his fairytale of paradise where rose grow though i dream in vain in my heart it will remain my stardust melody the memory of love refrain ,0.207,0.227,-0.2635,0,/lyric/668123/Benny+Goodman/Stardust,['Jazz'],2:51,"['amiable/good-natured', 'smooth', 'romantic', 'sentimental', 'sophisticated', 'innocent', 'elegant', 'happy']",Stardust,https://www.allmusic.com/song/stardust-mt0011975793
