,album_artist,album_mood,album_title,allmusic_href,lyrics,lyrics(normalized_no_stopwords),lyrics(normalized_with_stopwords),positive_score,negative_score,compound_score,sentiment_label,lyrics_href,track_genres,track_length,track_moods,track_title,track_url
24,Chaka Khan,happy,Epiphany: The Best of?,/album/epiphany-the-best-of-chaka-khan-vol-1-mw0000182607,"Chaka, Chaka, Chaka, Chaka Khan
Chaka Khan, Chaka Khan, Chaka Khan
Chaka Khan, let me rock you
Let me rock you, Chaka Khan
Let me rock you, that's all I wanna do
Chaka Khan, let me rock you
Let me rock you, Chaka Khan
Let me rock you, let me feel for you
Chaka Khan let me tell you what I wanna do
Do you feel for me, the way I feel for you
Chaka Khan let me tell you what I wanna do
I wanna love you, wanna hug you, wanna squeeze you too
Let me take you in my arms, let me fill you with my charms, Chaka
'Cause you know that I'm the one to keep you warm, Chaka
I'll make you more than just a physical dream
I wanna rock you, Chaka baby, 'cause you make me wanna scream
Let me rock you, rock you

Baby, baby, when I look at you
I get a warm feeling inside
There's something about the things you do
That keeps me satisfied

I wouldn't lie to you, baby
It's mainly a physical thing
This feeling that I got for you, baby
Makes me wanna sing

I feel for you
I think I love you
I feel for you
I think I love you

Chaka Khan, let me rock you
Let me rock you, Chaka Khan
Let me rock you, that's all I wanna do
Chaka Khan, let me rock you
Let me rock you, Chaka Khan
Let me rock you, let me feel for you
Feel for you

Baby, baby, when I lay with you
There's no place I'd rather be
I can't believe, can't believe it's true
The things that you do to me

I wouldn't lie to you, baby
I'm physically attracted to you
This feeling that I got for you, baby
There's nothing that I wouldn't do

I feel for you
I think I love you
I feel for you
I think I love you

Oh 
Oh ooh

Yes sir, one more time
Say yeah
I feel for you
(I think I love you)
I feel for you
(I, I, I think I love you)

Chaka Khan, let me rock you
Let me rock you, Chaka Khan
Let me rock you, that's all I wanna do
Chaka Khan, let me rock you
Let me rock you, Chaka Khan
Let me rock you, let me feel for you
Chaka Khan won't you tell me what you wanna do
Do you feel for me, the way I feel for you
Chaka Khan let me tell you what I wanna do
I wanna love you, wanna hug you, wanna squeeze you too
Let me take you in my arms
Let me fill you with my charms, Chaka
'Cause you know that I'm the one to keep you warm, Chaka
I'll make you more than just a physical dream
I wanna rock you, Chaka baby, 'cause you make me wanna scream
Feel for you

I feel for you (feel for you)
I feel it too (feel for you)
I feel for you (feel for you)

I feel for you
I think I love you
I feel for you
I think I love you

I feel for you
I think I love you
I feel for you
I think I love you

I feel for you
I think I love you
I feel for you
I think I love you

I feel for you",chaka chaka chaka chaka khan chaka khan chaka khan chaka khan chaka khan let rock let rock chaka khan let rock wanna chaka khan let rock let rock chaka khan let rock let feel chaka khan let tell wanna feel way feel chaka khan let tell wanna wanna love wanna hug wanna squeeze let take arm let fill charm chaka ecause know one keep warm chaka make physical dream wanna rock chaka baby ecause make wanna scream let rock rock baby baby look get warm feeling inside something thing keep satisfied would not lie baby mainly physical thing feeling get baby make wanna sing feel think love feel think love chaka khan let rock let rock chaka khan let rock wanna chaka khan let rock let rock chaka khan let rock let feel feel baby baby lie no place would rather not believe not believe true thing would not lie baby physically attract feeling get baby nothing would not feel think love feel think love oh oh ooh yes sir one time say yeah feel think love feel think love chaka khan let rock let rock chaka khan let rock wanna chaka khan let rock let rock chaka khan let rock let feel chaka khan not tell wanna feel way feel chaka khan let tell wanna wanna love wanna hug wanna squeeze let take arm let fill charm chaka ecause know one keep warm chaka make physical dream wanna rock chaka baby ecause make wanna scream feel feel feel feel feel feel feel feel think love feel think love feel think love feel think love feel think love feel think love feel,chaka chaka chaka chaka khan chaka khan chaka khan chaka khan chaka khan let me rock you let me rock you chaka khan let me rock you that be all i wanna do chaka khan let me rock you let me rock you chaka khan let me rock you let me feel for you chaka khan let me tell you what i wanna do do you feel for me the way i feel for you chaka khan let me tell you what i wanna do i wanna love you wanna hug you wanna squeeze you too let me take you in my arm let me fill you with my charm chaka ecause you know that i be the one to keep you warm chaka i will make you more than just a physical dream i wanna rock you chaka baby ecause you make me wanna scream let me rock you rock you baby baby when i look at you i get a warm feeling inside there be something about the thing you do that keep me satisfied i would not lie to you baby it be mainly a physical thing this feeling that i get for you baby make me wanna sing i feel for you i think i love you i feel for you i think i love you chaka khan let me rock you let me rock you chaka khan let me rock you that be all i wanna do chaka khan let me rock you let me rock you chaka khan let me rock you let me feel for you feel for you baby baby when i lie with you there be no place i would rather be i can not believe can not believe it be true the thing that you do to me i would not lie to you baby i be physically attract to you this feeling that i get for you baby there be nothing that i would not do i feel for you i think i love you i feel for you i think i love you oh oh ooh yes sir one more time say yeah i feel for you i think i love you i feel for you i i i think i love you chaka khan let me rock you let me rock you chaka khan let me rock you that be all i wanna do chaka khan let me rock you let me rock you chaka khan let me rock you let me feel for you chaka khan will not you tell me what you wanna do do you feel for me the way i feel for you chaka khan let me tell you what i wanna do i wanna love you wanna hug you wanna squeeze you too let me take you in my arm let me fill you with my charm chaka ecause you know that i be the one to keep you warm chaka i will make you more than just a physical dream i wanna rock you chaka baby ecause you make me wanna scream feel for you i feel for you feel for you i feel it too feel for you i feel for you feel for you i feel for you i think i love you i feel for you i think i love you i feel for you i think i love you i feel for you i think i love you i feel for you i think i love you i feel for you i think i love you i feel for you,0.277,0.029,0.9978,1,/lyric/890733/Chaka+Khan/I+Feel+for+You,"['Pop/Rock', 'R&B;', 'Electronic']",5:46,"['fun', 'lively', 'stylish', 'carefree', 'freewheeling', 'happy', 'playful', 'romantic']",I Feel for You,https://www.allmusic.com/song/i-feel-for-you-mt0004575061
25,Chaka Khan,happy,Epiphany: The Best of?,/album/epiphany-the-best-of-chaka-khan-vol-1-mw0000182607,"It's not difficult
For me to say I love you
It wouldn't be difficult
If you would say the same
And believe me when I tell you
That I know you very well
I know you like I know my name

I think that I have met you
Somewhere in my dreams
I may never have met you at all
And I know you must be thinking,
""What a silly girl""
I know your every thought and scheme

I wake up to the feeling each morning
I go to bed to it at night
I know you, I live you

CHORUS:
Like I feel a song in the morning
Like I see the moon at night
I know you as if I've known you all my life
I know you, I live you

One day you'll realize
That we're not strangers
If you open up your eyes
You'll know me too
And see that we were
Meant to be together, my dear
And all the rest is up to you

BRIDGE

Like I feel a song in the morning
Like I see the moon at night
I know you as if I've known you all my life
I know you, I know you
Like I feel a song in the morning
Like I see the moon at night
I think I know you more than you know yourself
I know you, I live you
Know you, live you
Know you, live you
Know you

And without me you'd stumble
And without you I'd fall
Without each other we would not be at all

",not difficult say love would not difficult would say believe tell know well know like know name think meet somewhere dream may never meet know must think silly girl know every thought scheme wake feeling morning go bed night know live chorus like feel song morning like see moon night know know life know live one day realize not stranger open eye know see mean together dear rest bridge like feel song morning like see moon night know know life know know like feel song morning like see moon night think know know know live know live know live know without would stumble without would fall without would not,it be not difficult for me to say i love you it would not be difficult if you would say the same and believe me when i tell you that i know you very well i know you like i know my name i think that i have meet you somewhere in my dream i may never have meet you at all and i know you must be think what a silly girl i know your every thought and scheme i wake up to the feeling each morning i go to bed to it at night i know you i live you chorus like i feel a song in the morning like i see the moon at night i know you as if i have know you all my life i know you i live you one day you will realize that we be not stranger if you open up your eye you will know me too and see that we be mean to be together my dear and all the rest be up to you bridge like i feel a song in the morning like i see the moon at night i know you as if i have know you all my life i know you i know you like i feel a song in the morning like i see the moon at night i think i know you more than you know yourself i know you i live you know you live you know you live you know you and without me you would stumble and without you i would fall without each other we would not be at all,0.242,0.026,0.9668,1,/lyric/4287764/Chaka+Khan/I+Know+You%2C+I+Live+You+%28Reprise%29,"['Electronic', 'R&B;']",4:28,"['gentle', 'intimate', 'soft/quiet', 'bright', 'celebratory', 'confident', 'happy', 'passionate']","I Know You, I Live You",https://www.allmusic.com/song/i-know-you-i-live-you-mt0002292945
26,Chubby Checker,happy,The Best of Chubby?,/album/the-best-of-chubby-checker-cameo-parkway-1959-1963-mw0000183636,"Come on baby
Let's do the twist
Come on baby
Let's do the twist
Take me by my little hand
And go like this

E-yah twist
Baby, baby twist
Oh yeah, just like this
Come on little miss and do the twist

My daddy is sleepin'
And mama ain't around
Yeah, daddy just sleepin'
And mama ain't around
We're gonna twisty twisty twisty
Till we tear the house down

Come on and twist
Yeah, baby twist
Oh yeah, just like this
Come on little miss and do the twist
E-yah

('Round and 'round and 'round and 'round)
('Round and 'round and 'round and 'round)

('Round and 'round and 'round and 'round)
('Round and 'round and 'round and 'round)
('Round and 'round and 'round and 'round)

Yeah, you should see my little sis'
You should see my my little sis'
She really knows how to rock
She knows how to twist

Come on and twist
Yeah, baby twist
Oh yeah, just like this
Come on little miss and do the twist

('Round and 'round and 'round and 'round)
Yeah
That's all now
Yeah, twist all night
Twist
('Round and 'round and 'round)",come baby let us twist come baby let us twist take little hand go like e yah twist baby baby twist oh yeah like come little miss twist daddy sleepin mama not around yeah daddy sleepin mama not around go twisty twisty twisty till tear house come twist yeah baby twist oh yeah like come little miss twist e yah round round round round round round round round round round round round round round round round round round round round yeah see little sis see little sis really know rock know twist come twist yeah baby twist oh yeah like come little miss twist round round round round yeah yeah twist night twist round round round,come on baby let us do the twist come on baby let us do the twist take me by my little hand and go like this e yah twist baby baby twist oh yeah just like this come on little miss and do the twist my daddy be sleepin and mama as not around yeah daddy just sleepin and mama as not around we be go to twisty twisty twisty till we tear the house down come on and twist yeah baby twist oh yeah just like this come on little miss and do the twist e yah round and round and round and round round and round and round and round round and round and round and round round and round and round and round round and round and round and round yeah you should see my little sis you should see my my little sis she really know how to rock she know how to twist come on and twist yeah baby twist oh yeah just like this come on little miss and do the twist round and round and round and round yeah that be all now yeah twist all night twist round and round and round ,0.239,0.03,0.9742,1,/lyric/27366467/The+Fat+Boys/The+Twist%21,"['R&B;', 'Pop/Rock']",2:35,"['amiable/good-natured', 'celebratory', 'playful', 'exuberant', 'fun', 'happy', 'summery', 'rollicking']",The Twist,https://www.allmusic.com/song/the-twist-mt0007141140
27,Chubby Checker,happy,The Best of Chubby?,/album/the-best-of-chubby-checker-cameo-parkway-1959-1963-mw0000183636,"It's pony time, get up
(Boogety, boogety, boogety, boogety shoo)

Hey now everybody (boogety, boogety, boogety, boogety shoo)
In the union hall (boogety, boogety, boogety, boogety shoo)
It's pony time (boogety, boogety, boogety, boogety shoo)
When ya hear this call (boogety, boogety, boogety, boogety shoo)

So get with it
Don't quit it
Get up (boogety, boogety, boogety, boogety shoo)

Do the pony with your partner (boogety, boogety, boogety, boogety shoo)
With a big boss line (boogety, boogety, boogety, boogety shoo)
Well anyway ya do it (boogety, boogety, boogety, boogety shoo)
You're gonna look real fine (boogety, boogety, boogety, boogety shoo)

So get with it
Don't quit it
Get up (boogety, boogety, boogety, boogety shoo)

Now ya turn to the left when I say gee
You turn to the right when I say haw
Now gee, ya ya baby
Now haw
Oh baby, oh baby, pretty baby
Do it baby, oh baby, oh baby
(Boogety, boogety, boogety, boogety shoo)

Gonna see little Suzie (boogety, boogety, boogety, boogety shoo)
You know she lives next door (boogety, boogety, boogety, boogety shoo)
She's doin' the pony (boogety, boogety, boogety, boogety shoo)
She's takin' the floor (boogety, boogety, boogety, boogety shoo)

Eee-ah, so get with it
Don't quit it
Come on (boogety, boogety, boogety, boogety shoo)

Do the pony with your partner (boogety, boogety, boogety, boogety shoo)
Oh in a big boss line (boogety, boogety, boogety, boogety shoo)
But anyway you do it (boogety, boogety, boogety, boogety shoo)
You're gonna look real fine (boogety, boogety, boogety, boogety shoo)

So get with
Don't quit it
Get up (boogety, boogety, boogety, boogety shoo)

Eee-ah, now you turn to the left when I say gee
You turn to the right when I say haw
Now gee, ya ya little baby
Now haw, ya
Oh baby, oh baby, pretty baby
Do it baby, oh baby, oh baby",pony time get boogety boogety boogety boogety shoo hey everybody boogety boogety boogety boogety shoo union hall boogety boogety boogety boogety shoo pony time boogety boogety boogety boogety shoo ya hear call boogety boogety boogety boogety shoo get not quit get boogety boogety boogety boogety shoo pony partner boogety boogety boogety boogety shoo big boss line boogety boogety boogety boogety shoo well anyway ya boogety boogety boogety boogety shoo go look real fine boogety boogety boogety boogety shoo get not quit get boogety boogety boogety boogety shoo ya turn left say gee turn right say haw gee ya ya baby haw oh baby oh baby pretty baby baby oh baby oh baby boogety boogety boogety boogety shoo go see little suzie boogety boogety boogety boogety shoo know live next door boogety boogety boogety boogety shoo pony boogety boogety boogety boogety shoo takin floor boogety boogety boogety boogety shoo eee ah get not quit come boogety boogety boogety boogety shoo pony partner boogety boogety boogety boogety shoo oh big boss line boogety boogety boogety boogety shoo anyway boogety boogety boogety boogety shoo go look real fine boogety boogety boogety boogety shoo get not quit get boogety boogety boogety boogety shoo eee ah turn left say gee turn right say haw gee ya ya little baby haw ya oh baby oh baby pretty baby baby oh baby oh baby,it be pony time get up boogety boogety boogety boogety shoo hey now everybody boogety boogety boogety boogety shoo in the union hall boogety boogety boogety boogety shoo it be pony time boogety boogety boogety boogety shoo when ya hear this call boogety boogety boogety boogety shoo so get with it do not quit it get up boogety boogety boogety boogety shoo do the pony with your partner boogety boogety boogety boogety shoo with a big boss line boogety boogety boogety boogety shoo well anyway ya do it boogety boogety boogety boogety shoo you be go to look real fine boogety boogety boogety boogety shoo so get with it do not quit it get up boogety boogety boogety boogety shoo now ya turn to the left when i say gee you turn to the right when i say haw now gee ya ya baby now haw oh baby oh baby pretty baby do it baby oh baby oh baby boogety boogety boogety boogety shoo go to see little suzie boogety boogety boogety boogety shoo you know she live next door boogety boogety boogety boogety shoo she be do the pony boogety boogety boogety boogety shoo she be takin the floor boogety boogety boogety boogety shoo eee ah so get with it do not quit it come on boogety boogety boogety boogety shoo do the pony with your partner boogety boogety boogety boogety shoo oh in a big boss line boogety boogety boogety boogety shoo but anyway you do it boogety boogety boogety boogety shoo you be go to look real fine boogety boogety boogety boogety shoo so get with do not quit it get up boogety boogety boogety boogety shoo eee ah now you turn to the left when i say gee you turn to the right when i say haw now gee ya ya little baby now haw ya oh baby oh baby pretty baby do it baby oh baby oh baby,0.052,0.0,0.8779,1,/lyric/172718/Chubby+Checker/Pony+Time,"['R&B;', 'Pop/Rock']",2:30,"['celebratory', 'playful', 'amiable/good-natured', 'exuberant', 'fun', 'happy', 'summery', 'rollicking']",Pony Time,https://www.allmusic.com/song/pony-time-mt0007113007
28,Chubby Checker,happy,The Best of Chubby?,/album/the-best-of-chubby-checker-cameo-parkway-1959-1963-mw0000183636,"Come on everybody clap your hands
Ahhh you're looking good
I'm gonna sing my song and you won't take long
We gonna do the twist and it goes like this

Come on let's twist again like we did last summer
Yea, let's twist again like we did last year
Do you remember when things were really hummin'
Yea, let's twist again, twistin' time is here

Round 'n around 'n up 'n down we go again
Oh baby make me know you love me so again
Twist again like we did last summer
Come on twist again, like we did last year

Who's that, flyin' up there?
Is it a bird? no
Is it a plane? no
Is it the twister? yeah

Twist again like we did last summer
Come on let's twist again, like we did last year
Do you remember when things were really hummin'
Come on let's twist again, twistin' time is here

Round 'n around 'n up 'n down we go again
Oh baby make me know you love me so again
Come on twist again like we did last summer
Girl let's twist again, like we did last year
Come on twist again, twistin' time is here",come everybody clap hand ahhh look good go sing song not take long go twist go like come let us twist like last summer yea let us twist like last year remember thing really hummin yea let us twist twistin time round n around n n go oh baby make know love twist like last summer come twist like last year flyin bird no plane no twister yeah twist like last summer come let us twist like last year remember thing really hummin come let us twist twistin time round n around n n go oh baby make know love come twist like last summer girl let us twist like last year come twist twistin time,come on everybody clap your hand ahhh you be look good i be go to sing my song and you will not take long we go to do the twist and it go like this come on let us twist again like we do last summer yea let us twist again like we do last year do you remember when thing be really hummin yea let us twist again twistin time be here round n around n up n down we go again oh baby make me know you love me so again twist again like we do last summer come on twist again like we do last year who be that flyin up there be it a bird no be it a plane no be it the twister yeah twist again like we do last summer come on let us twist again like we do last year do you remember when thing be really hummin come on let us twist again twistin time be here round n around n up n down we go again oh baby make me know you love me so again come on twist again like we do last summer girl let us twist again like we do last year come on twist again twistin time be here,0.285,0.032,0.9859,1,/lyric/5649253/Chubby+Checker/Let%27s+Twist+Again+%5BGerman%5D,"['R&B;', 'Pop/Rock']",2:19,"['celebratory', 'playful', 'amiable/good-natured', 'exuberant', 'fun', 'happy', 'summery', 'rollicking']",Let's Twist Again,https://www.allmusic.com/song/lets-twist-again-mt0008383971
29,Chubby Checker,happy,The Best of Chubby?,/album/the-best-of-chubby-checker-cameo-parkway-1959-1963-mw0000183636,"Come on come on and do the fly with me
Hey come on everybody and do the fly with me
Well if you don't know how to do it
Just watch and see

You've gotta shake your hands all around and around the sky
And then you buzz around the floor
You can do it if you really try
All the girls and guys are getting the [    ] they're gonna fly

Oh you pretty little girl come and fly away with me
Hey pretty little girl fly away with me
We're gonna fly to the sky
But you mustn't fly away from me
Oh yeah hey

Don't cha know
You've gotta shake your hands all around and around the sky
And then you buzz around the floor
You can do it if you really try
All the girls and guys are getting the [    ] they're gonna fly
Go ahead baby

Come on come on and do the fly with me
Hey come on everybody and do the fly with me
Well if you don't know how to do it
Just watch and see
Now fly

Fly fly baby
Yeah gotta fly fly fly",come come fly hey come everybody fly well not know watch see get shake hand around around sky buzz around floor really try girl guy get [ ] go fly oh pretty little girl come fly away hey pretty little girl fly away go fly sky must not fly away oh yeah hey not cha know get shake hand around around sky buzz around floor really try girl guy get [ ] go fly go ahead baby come come fly hey come everybody fly well not know watch see fly fly fly baby yeah get fly fly fly,come on come on and do the fly with me hey come on everybody and do the fly with me well if you do not know how to do it just watch and see you have get to shake your hand all around and around the sky and then you buzz around the floor you can do it if you really try all the girl and guy be get the [ ] they be go to fly oh you pretty little girl come and fly away with me hey pretty little girl fly away with me we be go to fly to the sky but you must not fly away from me oh yeah hey do not cha know you have get to shake your hand all around and around the sky and then you buzz around the floor you can do it if you really try all the girl and guy be get the [ ] they be go to fly go ahead baby come on come on and do the fly with me hey come on everybody and do the fly with me well if you do not know how to do it just watch and see now fly fly fly baby yeah get to fly fly fly,0.197,0.031,0.9517,1,/lyric/1096566/Chubby+Checker/The+Fly,['Pop/Rock'],2:31,"['happy', 'rousing', 'uplifting']",The Fly,https://www.allmusic.com/song/the-fly-mt0006922432
