,album_artist,album_mood,album_title,allmusic_href,lyrics,lyrics_href,track_genres,track_length,track_moods,track_title,track_url
23,Sting,ambitious,25 Years,/album/25-years-mw0002197928,"So high above the world tonight 
The angels watch us sleeping 
And underneath a bridge of stars 
We dream in safety's keeping 

But perhaps the dream 
Is dreaming us 
Soaring with the seagulls 
Astride the backs of eagles 

When the angels fall 
Shadows on the wall 
In the thunder's call 
Something haunts us all 

When the angels fall 
When the angels fall 

Take your father's cross 
Gently from the wall 
A shadow still remaining 
See the churches fall 

In mighty arcs of sound 
And all that they're containing 
Yet all the ragged souls 
Of all the ragged men 

Looking for their lost homes 
Shuffle to the ruins 
From the levelled plain 
To search among the tombstones 

When the angels fall 
Shadows on the wall 
In the thunder's call 
Something haunts us all 

When the angels fall 
When the angels fall 
When the angels fall 

These are my feet 
These are my hands 
These are my children 
And this is my demand 

Bring down the angels 
Cast them from my sight 
I never want to see 
A million suns at midnight 

Your hands are empty 
The streets are empty 
You can't control us 
You can't control us anymore 

When the angels fall 
When the angels fall 
When the angels fall 
When the angels fall 

When the angels fall 
When the angels fall",/lyric/831199/Sting/When+the+Angels+Fall,['Pop/Rock'],7:49,"['literate', 'ambitious', 'atmospheric', 'brooding', 'cerebral', 'earnest', 'intimate', 'refined']",When the Angels Fall,https://www.allmusic.com/song/when-the-angels-fall-mt0042177024
24,Mick Jagger,ambitious,The Very Best of Mick,/album/the-very-best-of-mick-jagger-mw0000495796,"Give me just another night 
Just another night with you
Give me just another kiss
Just before the dawn breaks through 

'Cause I'm homesick 
Feel a little down and blue 
And I'm hurting 
Hurting baby just like you 

I was lonely till I saw you at the station
And I never thought 
You'd keep our rendezvous 
Baby it's true

Give me just another night 
Just another night with you 
Give me just another kiss
Just before the dawn breaks through 

'Cause I'm hungry 
Hungry for you loving baby 
And I'm thirsty 
Thirsty for your loving baby 

And a one day pass to heaven is so hard to find
And a one night pass 
Ain't really what I had in mind

I need your sweet tenderness 
I need your soft caress
I know the day is coming 
Don't take away your loving 
Can't you see that I'm human 

Just because you've seen my face 
Just because you know my name
I'm a stranger in this town 
Can't I have my ups and downs 
Can't you see that I'm human 

I get hungry, get thirsty
I get moody 
I need attention 
I need your love
I need your love
I want your love

Give me just another night 
Just another night with you 
'Cause I'm freezing in this
Hundred dollar hotel room
Don't make me leave you 
No don't you be so cruel",/lyric/809499/Mick+Jagger/Just+Another+Night,['Pop/Rock'],5:15,"['ambitious', 'confident', 'romantic', 'rousing', 'slick', 'swaggering', 'wistful', 'detached']",Just Another Night,https://www.allmusic.com/song/just-another-night-mt0004421053
25,Mick Jagger,ambitious,The Very Best of Mick,/album/the-very-best-of-mick-jagger-mw0000495796,"No sitting down on your butt
The world don't owe you
No sitting down in a rut
I wanna show you

Don't waste your energy
On making enemies
Just take a deep breath
And work your way up 

Let's work, be proud
Stand tall, touch the clouds
Man and woman, be free
Let's work, kill poverty 

La, la, la
Work your way up 

Let's work, be proud
Stand tall, touch the clouds
Man and woman, be free
Let's work, kill poverty 

You're sitting down on your butt
And your get greedy
You start to lose your nuts
Don't you look seedy
Can generosity bring you humility
So take a deep breath 

Ain't gonna sweat for you
Ain't gonna sigh for you
Ain't gonna cry for you
If you're lazy 

Ain't gonna slave for you
Ain't gonna hurt for you
It just won't work for you
If you're lazy 

Let's work, be proud
Stand tall, touch the clouds
Let's work, let's eat
Let's live in ecstasy
Man and woman, be free
Let's work, kill poverty 

Let's work, be proud
Stand tall, touch the clouds
Man and woman, be free
Let's work, let's work

Get down in the dirt and let's work
Get down in the dirt and let's work
Get up, be free
Get down in the dirt, let's work

Get down in the dirt, let's work
Get down in the dirt
Take off your shirt
Get down in the dirt
Let's work",/lyric/995548/Mick+Jagger/Let%27s+Work,['Pop/Rock'],4:44,"['ambitious', 'boisterous', 'bravado', 'celebratory', 'confident', 'playful', 'rousing', 'slick']",Let's Work,https://www.allmusic.com/song/lets-work-mt0002065592
26,Mick Jagger,ambitious,The Very Best of Mick,/album/the-very-best-of-mick-jagger-mw0000495796,"Oh joy love you bring
Oh joy make my heart sing

And I drove across the desert
I was in my four wheel drive
I was looking for the Buddha
And I saw Jesus Christ

He smiled and shrugged his shoulder
And lit a cigarette
Said jump for joy
Make some noise
Remember what I said

My soul is a like a ruby
And I threw it in the earth
But now my hands are bleeding
From scrabbling in the dirt
And I look up to the heavens
And a light is on my face
I never never never
Thought I'd find a state of grace

Hey joy
Love you bring
Oh joy
Make my heart sing
Oh joy
Joy in everything

Joy joy joy oh joy
Joy joy joy oh joy

I was drowning in the darkness
As I drove down to the sea

Joy joy joy oh joy

And I looked up to the mountain
And the light burst over me
Joy joy joy oh oh joy

You make me sing
Joy [cont]

Oh joy
The love you bring
You make me sing
Oh joy
In everything
In everything
Everything

Jump for joy
Jump for joy
Jump for joy",/lyric/5214246/Mick+Jagger/Joy,['Pop/Rock'],4:40,"['ambitious', 'confident', 'slick', 'wistful', 'happy', 'lively', 'reflective', 'rousing']",Joy,https://www.allmusic.com/song/joy-mt0004684016
27,Mick Jagger,ambitious,The Very Best of Mick,/album/the-very-best-of-mick-jagger-mw0000495796,"If it's love that you're running from, there's no hiding place.
You can't run it, you can't hide it, you can't run it
Love has problems I know but there problems, we'll just have to face.
If you just put your hand in mine,
We're gonna leave all our troubles behind.
We're gonna walk and don't look back. 
Don't look back
And don't look back
And don't look back, baby. 
Don't look back

The places behind you let them re-remind you
If your first lover broke your heart,
There's something that can be done.
You don't run it, you don't hide it, you don't run it
Don't end your faith in love because of what he's done.
So if you just put your hand in mine,
We're gonna leave all our troubles behind.
Keep on walking and don't look back.
Forget about the past now.
Don't look back, baby.
Keep on walking and don't look back
The places behind you let them re-remind you.

Love can be a beautiful thing.
Though your first love let you down.
'Cause I know we can make love bloom, baby.
The second time around.
So if you just put your hand in mine,
We're gonna leave all our troubles behind.
Keep on pushing and don't look back.
Now, till I say, we won't look back, girl.
Keep on walking and won't look back.
Forget about the past now, baby.
And don't look back.
Baby, baby, baby, baby, baby, baby, baby, don't look back.",/lyric/12269077/Mick+Jagger/%28You+Got+To+Walk+and%29+Don%27t+Look+Back,"['Reggae', 'Pop/Rock']",5:17,"['ambitious', 'confident', 'rousing', 'wistful', 'exuberant', 'reflective', 'relaxed', 'searching']",(You Got To Walk and) Don't Look Back,https://www.allmusic.com/song/you-got-to-walk-and-dont-look-back-mt0000910659
28,Mogwai,ambitious,Young Team,/album/young-team-mw0000033755,"Instrumental






",/lyric/20994441/Mogwai/Like+Herod,"['Pop/Rock', 'Electronic']",11:44,"['ambitious', 'brooding', 'eerie', 'hypnotic', 'intense', 'nocturnal', 'paranoid', 'tense/anxious']",Like Herod,https://www.allmusic.com/song/like-herod-mt0000566810
29,The Decemberists,ambitious,The Hazards of Love,/album/the-hazards-of-love-mw0000811120,"Gentle leaves, gentle leaves
Please array a path for me
The woods are blowing thick and fast around

Columbine, Columbine
Please alert this love of mine
Let him know his Margaret comes along

And all this stirring inside my belly
Won't quell my want for love
And I may swoon from all this swaying
But I won't want for love

Mistlethrush, Mistlethrush
Lay me down in the underbrush
My naked feet grow weary with the dusk

Willow Boughs, Willow Boughs,
Make a bed to lay me down
Let your branches bow to cradle us

And all this stirring inside my belly
Won't quell my want for love
And I may swoon from all this swaying
But I won't want for love

Oh, my own true love
Oh, my own true love
Can you hear me, love?
Can you hear me, love?

And all this stirring inside my belly
Won't quell my want for love
And I may swoon from all this swaying
But I won't want for love

Won't want for love
Won't want for love
Won't want for love",/lyric/30829888/The+Decemberists/Won%27t+Want+For+Love+%28Margaret+In+The+Taiga%29,['Pop/Rock'],4:06,"['intimate', 'lively', 'lush', 'passionate', 'poignant', 'ambitious', 'cerebral', 'dramatic']",Won't Want For Love (Margaret In The Taiga),https://www.allmusic.com/song/wont-want-for-love-margaret-in-the-taiga-mt0010019572
30,The Decemberists,ambitious,The Hazards of Love,/album/the-hazards-of-love-mw0000811120,"I'm
Made of bones of the branches
The boughs and the brow-beating light

While my feet are the trunks
And my head is the canopy high

And my fingers extend
To the leaves
And the eaves
And the (bright?)

Might I shine?
It's my shine (child?)

He
Was a baby abandoned
Entombed in a cradle of claim (clay?)

And I was a soul
Who took pity
And stole him away

And gave him the form of
A fawn to inhabit
By day

Bright Eyes, stay
It's my day

And you
Have removed this temptation
That's troubled my innocent child

To abduct and abuse and to render, (bereft?) and defiled

But the river is deep
To the banks and the water is wild,
I will fly you
To the far side",/lyric/19553596/The+Decemberists/The+Queen%27s+Approach,['Pop/Rock'],0:29,"['intimate', 'lively', 'lush', 'passionate', 'poignant', 'ambitious', 'cerebral', 'dramatic']",The Queen's Approach,https://www.allmusic.com/song/the-queens-approach-mt0010019574
31,The Decemberists,ambitious,The Hazards of Love,/album/the-hazards-of-love-mw0000811120,"I had entered into a marriage
In the summer of my twenty-first year
And the bells rang for our wedding
Only now do I remember it clear
Alright, alright, alright

No more a rake and no more a bachelor
I was wedded and it whetted my thirst
Until her womb start spilling out babies
Only then did I reckon my curse
Alright, alright, alright
Alright, alright, alright

First came Isaiah with his crinkled little fingers
Then came Charlotte and that wretched girl Dawn
Ugly Myfanwy died on delivery
Mercifully taking her mother along
Alright, alright, alright

What can one do when one is widower
Shamefully saddled with three little pests
All that I wanted was the freedom of a new life
So my burden I began to divest
Alright, alright, alright
Alright, alright, alright

Charlotte I buried after feeding her foxglove
Dawn was easy, she was drowned in the bath
Isaiah fought but was easily bested
Burned his body for incurring my wrath
Alright, alright, alright

And that's how I came your humble narrator
To be living so easy and free
Expect you think that I should be haunted
But it never really bothers me
Alright, alright, alright
Alright, alright, alright",/lyric/25361512/The+Decemberists/The+Rake%27s+Song,['Pop/Rock'],3:15,"['intimate', 'lively', 'lush', 'passionate', 'poignant', 'ambitious', 'cerebral', 'dramatic']",The Rake's Song,https://www.allmusic.com/song/the-rakes-song-mt0010019578
32,The Decemberists,ambitious,The Hazards of Love,/album/the-hazards-of-love-mw0000811120,"The Queen
I'm made of bones of the branches the boughs and the bough beating light
Well my feet are the trunks, my head is the canopy
And my fingers extend to the leaves in the eves

And a bright, brighter shine
It's my shine

And he
Was a baby abandoned
Entombed in a cradle of clay
And I was a soul who took pity and stole him away
And gave him the form of a faun to inhabit

And a day, brightest day
It's my day

And you
Have removed this temptation that's troubled my innocent child
To abduct and abuse
And to render ? and defiled
But the river is deep to the base of the water

And I
I will fly you
To the far side",/lyric/19553590/The+Decemberists/The+Queen%27s+Rebuke-The+Crossing,['Pop/Rock'],3:56,"['intimate', 'lively', 'lush', 'passionate', 'poignant', 'ambitious', 'cerebral', 'dramatic']",The Queen's Rebuke/The Crossing,https://www.allmusic.com/song/the-queens-rebuke-the-crossing-mt0010019580
33,The Decemberists,ambitious,The Hazards of Love,/album/the-hazards-of-love-mw0000811120,"You loom so deep and wide
I would cross over
If you would stem the tide
Build a boat
That I might thwart the other side
To reach the farther shore
Where my true love lies in wait for me
In wait for me
In wait for me
In wait for me 

Oh, gray river
Your waters ramble while
The horses shiver
And bide against the bridal
But I will cross
If mine own horse is pulled from me
Though my mother cries that if I try
I sure will drown it be
Will drown it be
Will drown it be
Will drown it be

But if you cull
And let me pass
You may render me a wreck
When I come back
So calm your waves
And slow the churn
And you may have my precious bones on my return

Annan water
Oh hear my true love's call
Hear her holler
Above your water's pall
God, that I could
That my two arms could give me way
And I would cross your breath
And rest my breast about her amber ring
Her amber ring
Her amber ring

But if you cull
And let me pass
You may render me a wreck
When I come back
So calm your waves
And slow the churn
And you may have my precious bones
On my
On my
Return",/lyric/19553589/The+Decemberists/Annan+Water,['Pop/Rock'],5:11,"['intimate', 'lively', 'lush', 'passionate', 'poignant', 'ambitious', 'cerebral', 'dramatic']",Annan Water,https://www.allmusic.com/song/annan-water-mt0010019581
34,Peter Gabriel,ambitious,So,/album/so-mw0000650174,"Love I get so lost, sometimes
Days pass and this emptiness fills my heart
When I want to run away
I drive off in my car
But whichever way I go
I come back to the place you are

All my instincts, they return
And the grand facade, so soon will burn
Without a noise, without my pride
I reach out from the inside

In your eyes
The light the heat
In your eyes
I am complete
In your eyes
I see the doorway to a thousand churches
In your eyes
The resolution of all the fruitless searches
In your eyes
I see the light and the heat
In your eyes
Oh, I want to be that complete
I want to touch the light
The heat I see in your eyes

Love, I don't like to see so much pain
So much wasted and this moment keeps slipping away
I get so tired of working so hard for our survival
I look to the time with you to keep me awake and alive

And all my instincts, they return
And the grand facade, so soon will burn
Without a noise, without my pride
I reach out from the inside

In your eyes
The light the heat
In your eyes
I am complete
In your eyes
I see the doorway to a thousand churches
In your eyes
The resolution of all the fruitless searches
In your eyes
I see the light and the heat
In your eyes
Oh, I want to be that complete
I want to touch the light,
The heat I see in your eyes
In your eyes, in your eyes
In your eyes, in your eyes
In your eyes, in your eyes",/lyric/1536884/Peter+Gabriel/Mercy+Street,['Pop/Rock'],6:22,"['intimate', 'ominous', 'passionate', 'reflective', 'ambitious', 'brooding', 'complex', 'eerie']",Mercy Street,https://www.allmusic.com/song/mercy-street-mt0045458922
35,Peter Gabriel,ambitious,So,/album/so-mw0000650174,"Milgram's 37

We do what we're told
We do what we're told
We do what we're told
Told to do

We do what we're told
We do what we're told
We do what we're told
Told to do

One doubt
One voice
One war
One truth
One dream",/lyric/5514784/Peter+Gabriel/We+Do+What+We%27re+Told+%28Milgram%27s+37%29,['Pop/Rock'],3:22,"['intimate', 'quirky', 'reflective', 'ambitious', 'complex', 'eerie', 'intense', 'dramatic']",We Do What We're Told (Milgram's 37),https://www.allmusic.com/song/we-do-what-were-told-milgrams-37-mt0045458924
36,Peter Gabriel,ambitious,So,/album/so-mw0000650174,"Flying birds
Excellent birds
Watch them fly, there they go
Falling snow
Excellent snow
Here it comes. watch it fall

Long words
Excellent words
I can hear them now

This is the picture, this is the picture
This is the picture, this is the picture

I'm sitting by the window
Watching the snow fall
I'm looking out
And I'm moving, turning in time
Catching up. moving in
Jump up! I can land on my feet. look out!

This is the picture, this is the picture
This is the picture, this is the picture

Looking out. watching out
When I see the future I close my eyes
I can see it now

I see pictures of people, rising up
Pictures of people, falling down
I see pictures of people
They're standing on their heads, they're ready
They're looking out, look out!
They're watching out, watch out!
They're looking out, look out!
They're watching out, watch out!

I see pictures of people
I see pictures of people",/lyric/3101248/Peter+Gabriel/This+Is+the+Picture+%28Excellent+Birds%29,['Pop/Rock'],4:25,"['reflective', 'ambitious', 'bleak', 'eerie', 'intense', 'dramatic', 'elegant', 'brooding']",This Is the Picture (Excellent Birds),https://www.allmusic.com/song/this-is-the-picture-excellent-birds-mt0045458925
