,album_artist,album_mood,album_title,allmusic_href,lyrics,lyrics_href,track_genres,track_length,track_moods,track_title,track_url
0,Charles Mingus,circular,East Coasting,/album/east-coasting-mw0000188431,"Waking skies at sunrise
Every sunset too
Seems to be bringing me
Memories of you

Here and there, everywhere
Scenes that we once knew
And they all just recall
Memories of you

How I wish, I could forget those
Those happy yesteryears
That have left a rosary of tears

Your face beams in my dreams
'Spite of all I do
Everything seems to bring
Memories of you

And your face beams in my dreams
'Spite of all I do
Everything seems to bring
Memories, just memories of you",/lyric/3102622/Charles+Mingus/Memories+of+You,['Jazz'],4:27,"['circular', 'complex', 'ambitious', 'passionate', 'aggressive', 'fiery', 'intense', 'volatile']",Memories of You,https://www.allmusic.com/song/memories-of-you-mt0003185865
1,Charles Mingus,circular,East Coasting,/album/east-coasting-mw0000188431,"Waking skies at sunrise
Every sunset too
Seems to be bringing me
Memories of you

Here and there, everywhere
Scenes that we once knew
And they all just recall
Memories of you

How I wish, I could forget those
Those happy yesteryears
That have left a rosary of tears

Your face beams in my dreams
'Spite of all I do
Everything seems to bring
Memories of you

And your face beams in my dreams
'Spite of all I do
Everything seems to bring
Memories, just memories of you",/lyric/3102622/Charles+Mingus/Memories+of+You,['Jazz'],4:42,"['circular', 'complex', 'ambitious', 'passionate', 'aggressive', 'fiery', 'intense', 'volatile']",Memories of You,https://www.allmusic.com/song/memories-of-you-mt0008532980
2,Enya,circular,Shepherd Moons,/album/shepherd-moons-mw0000275476,"Eurus
Afer Ventus

So the world goes round and round
With all you ever knew
They say the sky high above
Is Caribbean blue

If every man says all he can
If every man is true
Do I believe the sky above
Is Caribbean blue 

Boreas 
Zephryus 

If all you told was turned to gold
If all you dreamed was new
Imagine sky high above
In Caribbean blue",/lyric/2775752/Enya/Caribbean+Blue,"['New Age', 'Pop/Rock', 'International']",3:59,"['calm/peaceful', 'atmospheric', 'circular', 'complex', 'dreamy', 'elegant', 'ethereal', 'gentle']",Caribbean Blue,https://www.allmusic.com/song/caribbean-blue-mt0007071918
3,Enya,circular,Shepherd Moons,/album/shepherd-moons-mw0000275476,"Eww harlay eyuwee heewah oohah sharlay marc toh cheeteeh woodenuh.
Aran doi dig coh hoh partenuh ooh lee ah ooh harlorh.
Eww harlay eyuwee heewah oohah harlay mwahnee kahah montenah.
Ooh de keewah! Ooh de keewah!
Oohnah li ansai angrass de la ooh hoo lee ah ooh harlorh.

Ahh

Amharc, mn ag obair l ‘s mall san och’,
Ceolann siad ar laetha geal, a bh,
Bealach fada annon ‘s anall a choch’.

Ahh

Eww harlay eyuwee heewah oohah harlay wooneenchi doidig dohtenuh, dohtenuh, dohtenuh
Ooh de keewah!
Woohnah wui an jaeshah woodenuh ooh lee ah ooh harlorh.
Eww harlay eyuwee heewah oohah sharlay marc toh cheeteeh woodenuh.
Ooh de keewah! Ooh de keewah!
Aran doi dig coh hoh partenuh ooh lee ah ooh harlorh.
Ooh, eww harlay eyuwee heewah oohah
Ooh, li ah, kahah montenah.",/lyric/145813/Enya/Ebudae,"['International', 'New Age', 'Pop/Rock']",1:56,"['atmospheric', 'circular', 'complex', 'dreamy', 'elegant', 'gentle', 'hypnotic', 'light']",Ebudae,https://www.allmusic.com/song/ebudae-mt0007069111
4,Enya,circular,Shepherd Moons,/album/shepherd-moons-mw0000275476,"One day, one night, one moment
My dreams could be tomorrow
One step, one fall, one falter
East or west,
Over earth or by ocean
One way to be my journey
This way could be my
Book of days

No day, no night, no moment
Can hold me back from trying
I'll flag, I'll fall, I'll falter
I'll find my day maybe
Far and away
Far and away

One day, one night, one moment
With a dream to be living
One step, one fall, one falter
And a new world that cross a wide ocean
This sway became my journey
This day ends together
Far and away

This day ends together
Far and away
Far and away.",/lyric/45949/Enya/Book+of+Days+%5BFrom+Far+and+Away%5D,"['International', 'New Age', 'Pop/Rock']",2:56,"['atmospheric', 'circular', 'complex', 'dreamy', 'elegant', 'gentle', 'hypnotic', 'light']",Book of Days,https://www.allmusic.com/song/book-of-days-mt0008464604
5,Enya,circular,Shepherd Moons,/album/shepherd-moons-mw0000275476,"I dreamt I dwelt in marble halls
With vassals and serfs at my side,
And of all who assembled within those walls
That I was the hope and the pride.
I had riches all too great to count
And a high ancestral name. 

But I also dreamt which pleased me most
That you loved me still the same,
That you loved me
You loved me still the same,
That you loved me
You loved me still the same.

I dreamt that suitors sought my hand,
That knights upon bended knee
And with vows no maidens heart could withstand,
They pledged their faith to me.
And I dreamt that one of that noble host
Came forth my hand to claim. 

But I also dreamt which charmed me most
That you loved me still the same
That you loved me
You loved me still the same,
That you loved me
You loved me still the same.
",/lyric/469621/Enya/Marble+Halls,"['International', 'New Age', 'Pop/Rock']",3:54,"['atmospheric', 'circular', 'complex', 'dreamy', 'elegant', 'gentle', 'hypnotic', 'light']",Marble Halls,https://www.allmusic.com/song/marble-halls-mt0007007968
6,Enya,circular,Shepherd Moons,/album/shepherd-moons-mw0000275476,"Mare Nubium. Umbriel.
Mare Imbrium. Ariel.
Et itur ad astra.
Et itur ad astra.
Mare Undarum. Io. Vela.

Mirabile dictu. Mirabilia.
Mirabile visu. Mirabilia.
Et itur ad astra.
Et itur ad astra.
Sempervirent. Rosetum.

Afer Ventus. Zephyrus.
Volturnus. Africus.
Et itur ad astra.
Et itur ad astra.
Etesiarum. Eurus. 
 
Suus cuique mos. Suum cuique.
Meus mihi, suus cuique carus.
Mememto, terrigena.
Mememto, vita brevis.
Meus mihi, suus cuique carus.
",/lyric/4388301/Enya/After+Ventus,"['International', 'New Age', 'Pop/Rock']",4:06,"['atmospheric', 'circular', 'dramatic', 'dreamy', 'elegant', 'ethereal', 'gentle', 'hypnotic']",After Ventus,https://www.allmusic.com/song/after-ventus-mt0006893085
7,Enya,circular,Shepherd Moons,/album/shepherd-moons-mw0000275476,"Eist le mo chroi
Go bronach a choich
Ta me cailte gan ta
's do bhean cheile
An gro mor i do shaoil
Threorai si me
Bigi liomsa i gconai
La 's oich",/lyric/2538274/Enya/Smaointe,"['International', 'New Age', 'Pop/Rock']",6:07,"['atmospheric', 'circular', 'dramatic', 'dreamy', 'elegant', 'ethereal', 'gentle', 'hypnotic']",Smaointe,https://www.allmusic.com/song/smaointe-mt0008279890
8,Enya,circular,Watermark,/album/watermark-mw0000198831,"Cursum perficio 
Cursum perficio 
Cursum perficio 
Cursum perficio 
Cursum perficio 

Verbum sapienti (eo plus cupiunt) 
Verbum sapienti 
Quo plus habent, eo plus cupiunt 
Verbum sapienti 
Quo plus habent, eo plus cupiunt 

Post nubila, Phoebus 
Post nubila, Phoebus 
Post nubila, Phoebus 

Quo plus habent, eo plus cupiunt 
Quo plus habent, eo plus cupiunt 
Quo plus habent, eo plus cupiunt 

Post nubila, Phoebus 
Post nubila, Phoebus 
Post nubila, Phoebus 
Post nubila, Phoebus 
Post nubila, Phoebus 
Post nubila, Phoebus 

Iternum 
Iternum 
Iternum",/lyric/1544554/Enya/Cursum+Perficio,"['International', 'New Age', 'Pop/Rock']",4:06,"['atmospheric', 'circular', 'dramatic', 'dreamy', 'elegant', 'ethereal', 'hypnotic', 'lush']",Cursum Perficio,https://www.allmusic.com/song/cursum-perficio-mt0007207968
9,Enya,circular,Watermark,/album/watermark-mw0000198831,"Strange how my heart beats 
To find myself upon your shore. 
Strange how I still feel 
My loss of comfort gone before. 
Cool waves wash over 
And drift away with dreams of youth 
So time is stolen 
I cannot hold you long enough. 
And so this is where I should be now 

Days and nights falling by 
Days and nights falling by me. 
I know of a dream I should be holding 
Days and nights falling by 
Days and nights falling by me. 

Cool waves wash over 
And drift away with reams of youth 
So time is stolen 
I cannot hold you long enough. 
Soft blue horizons 
Reach far into my childhood days 
As you are rising 
To bring me my forgotten ways 

Strange how I falter 
To find I'm standing in deep water 
Strange how my heart beats 
To find I'm standing on your shore 
",/lyric/1544555/Enya/On+Your+Shore,"['International', 'New Age', 'Pop/Rock']",3:59,"['atmospheric', 'circular', 'dramatic', 'dreamy', 'elegant', 'ethereal', 'gentle', 'hypnotic']",On Your Shore,https://www.allmusic.com/song/on-your-shore-mt0008403628
10,Enya,circular,Watermark,/album/watermark-mw0000198831,"Cá fhad é ó 
Cá fhad é ó 
Siúl tríd na stoirmeacha. 
Dul tríd na stoirmeacha. 
Cá fhad é ó 
an tús don stoirm. 
Cá fhad é ó 
an tús go deireadh. 

Tóg do Chroí. 
Siúl tríd na stoirmeacha. 
Tóg do chroísa. 
Dul tríd na stoirmeacha. 

Turas mór. 
Tor tríd na Stoirmeacha. 
Turas fada. 
Amharc tríd na Stoirmeacha
",/lyric/1162061/Enya/Storms+in+Africa,"['International', 'New Age', 'Pop/Rock']",4:03,"['atmospheric', 'circular', 'dramatic', 'dreamy', 'elegant', 'ethereal', 'gentle', 'hypnotic']",Storms in Africa,https://www.allmusic.com/song/storms-in-africa-mt0006921787
11,Enya,circular,Watermark,/album/watermark-mw0000198831,"Cold as the northern winds
in December mornings,
Cold is the cry that rings
from this far distand shore.


Winter has come too late
too close beside me.
How can I chase away
all these fears deep inside?


I'll wait the signs to come.
I'll find a way
I will wait the time to come.
I'll find a way home.


My light shall be the moon
and my path - the ocean.
My guide the morning star
as I sail home to you.


I'll wait the signs to come.
I'll find a way.
I will wait the time to come.
I'll find a way home.


Who then can warm my soul?
Who can quell my passion?
Out of these dreamsQa boat
I will sail home to you. ",/lyric/1538531/Enya/Exile+%5BFrom+L.A.+Story%5D,"['International', 'New Age', 'Pop/Rock']",4:20,"['atmospheric', 'circular', 'dramatic', 'dreamy', 'elegant', 'ethereal', 'gentle', 'hypnotic']",Exile,https://www.allmusic.com/song/exile-mt0008412251
12,Enya,circular,Watermark,/album/watermark-mw0000198831,"Let me sail, let me sail,
Let the Orinoco Flow,
Let me reach, let me beach
On the shores of Tripoli.
Let me sail, let me sail,
Let me crash upon your shore,
Let me reach, let me beach
Far beyond the Yellow Sea.

Sail away, sail away, sail away. [Repeat: x4]

From Bissau to Palau, in the shade of Avalon,
From Fiji to Tiree and the Isles of Ebony,
From Peru to Cebu hear the power of Babylon,
From Bali to Cali, far beneath the Coral Sea.

Turn it up, turn it up, turn it up, up, adieu. Oh. [Repeat: x3]

Sail away, sail away, sail away. [Repeat: x4]

From the North to the South, Ebudæ into Khartoum,
From the deep sea of Clouds to the island of the moon,
Carry me on the waves to the lands I've never been,
Carry me on the waves to the lands I've never seen.
We can sail, we can sail with the Orinoco Flow,
We can sail, we can sail.
(Sail away, sail away, sail away)

We can steer, we can near
With Rob Dickins at the wheel,
We can sigh, say goodbye Ross and his dependencies
We can sail, we can sail
(Sail away, sail away, sail away)

We can reach, we can beach,
On the shores of Tripoli,
We can sail, we can sail
(Sail away, sail away, sail away)
From Bali to Cali, far beneath the Coral Sea,
We can sail, we can sail
(Sail away, sail away, sail away)
From Bissau to Palau, in the shade of Avalon,
We can sail, we can sail
(Sail away, sail away, sail away)
We can reach, we can beach,
Far beyond the Yellow Sea,
We can sail, we can sail
(Sail away, sail away, sail away)
From Peru to Cebu hear the power of Babylon,
We can sail, we can sail.
(Sail away, sail away, sail away)
We can sail, we can sail.

Sail away, sail away, sail away. [Repeat: x5]",/lyric/547697/Enya/Orinoco+Flow,"['International', 'New Age', 'Pop/Rock']",4:25,"['atmospheric', 'circular', 'complex', 'dreamy', 'elegant', 'gentle', 'hypnotic', 'light']",Orinoco Flow,https://www.allmusic.com/song/orinoco-flow-mt0008384255
13,Enya,circular,Watermark,/album/watermark-mw0000198831,"When the evening falls 
And the daylight is fading,
From within me calls
Could it be I am sleeping?
For a moment I stray, 
Then it holds me completely
Close to home - I cannot say
Close to home feeling so far away

As I walk the room there before me a shadow
From another world, where no other can follow
Carry me to my own, to where I can cross over
Close to home - I cannot say
Close to home feeling so far away

Forever searching; never right,
I am lost in oceans of night. 
Forever hoping I can find memories
Those memories I left behind

Even though I leave will I go on believing
That this time is real - am I lost in this feeling?
Like a child passing through, 
Never knowing the reason
I am home - I know the way
I am home - feeling oh, so far away
",/lyric/28797941/Enya/Evening+Falls..,"['International', 'New Age', 'Pop/Rock']",3:46,"['atmospheric', 'circular', 'dramatic', 'dreamy', 'elegant', 'ethereal', 'gentle', 'hypnotic']",Evening Falls,https://www.allmusic.com/song/evening-falls-mt0006946756
14,Enya,circular,Watermark,/album/watermark-mw0000198831,"Ai! laurie lantar lassi surinen,
yeni unotime ve ramar aldaron!
yeni ve linte...

'Alas! golden leaves fall in the wind,
long years numberless as [the] wings of trees!
Long years like swift...'

Verse 2

Et Earello Endorenna utulien.
Sinome maruvan ar Hildinyar tenn' Ambar-metta!

'Out of the Great Sea to Middle-earth I am come.
In this place I will abide, and my heirs, unto the ending of the world'",/lyric/5224602/Enya/The+Great+River,"['International', 'New Age', 'Pop/Rock']",3:10,"['atmospheric', 'circular', 'dramatic', 'dreamy', 'elegant', 'ethereal', 'gentle', 'hypnotic']",River,https://www.allmusic.com/song/river-mt0007263164
15,Enya,circular,Watermark,/album/watermark-mw0000198831,"Hi-ri-u
Ho-ro-ho
Ho-ri-u
Him-o-ro-ho 

Hoireann is oro
Tá muid beo
Him oro ho
Go Deo na ndeor 
",/lyric/1544562/Enya/The+Longships,"['International', 'New Age', 'Pop/Rock']",3:36,"['atmospheric', 'circular', 'dramatic', 'dreamy', 'elegant', 'ethereal', 'gentle', 'hypnotic']",The Longships,https://www.allmusic.com/song/the-longships-mt0007205614
16,Enya,circular,Watermark,/album/watermark-mw0000198831,"Ag amharc tré m'óige
Is mé bhí sámh
Gan eolas marbh
Bhí mé óg san am,

[Chorus]
Anois, táim buartha
's fad ar shiúil an lá.
Ochón 's ochón ó.

Na laetha geal m'óige
Bhí siad lán de dhóchas
An bealach mór a bhí romham anonn
Bhí sé I ndán domh go mbeinn, slán, slán.


[Chorus]

[Translation]
The bright days of my youth

(In honor of my father and mother)

Looking back over my youth
I see I was contented
Without knowledge of death
I was young then

Now I am worried
During the course of the day.
(Oh sorrow!) (Alas and woe, oh.)

The bright days of my youth
Were full of hope
The big road that was before us then
Was what was destined to be,
Bye bye)",/lyric/1544563/Enya/Na+Laetha+Geal+M%27%C3%93ige,"['International', 'New Age', 'Pop/Rock']",3:54,"['atmospheric', 'circular', 'dramatic', 'dreamy', 'elegant', 'ethereal', 'gentle', 'hypnotic']",Na Laetha Geal M'Óige,https://www.allmusic.com/song/na-laetha-geal-m%C3ige-mt0007064337
17,Enya,circular,Watermark,/album/watermark-mw0000198831,"Though I walk through
Warm sands in Africa
Winds will grow soon
To storms in Africa.

How far to go
I cannot say.
How many more
Will journey this way?

Dark skies fall on
Black earth and ivory.
Far from your sun
Clouds now close over me.

How far to go
I cannot say.
How many more
Will journey this way?

Storms have come!
Rains wash the earth away
Dark skies fall down
Into another day.
Rains have now come
From storms in Africa
Time will go on
Through Storms in Africa",/lyric/497577/Enya/Storms+in+Africa%2C+Pt.+2,"['International', 'New Age', 'Pop/Rock']",3:01,"['atmospheric', 'circular', 'dramatic', 'dreamy', 'elegant', 'ethereal', 'gentle', 'hypnotic']","Storms in Africa, Pt. 2",https://www.allmusic.com/song/storms-in-africa-pt-2-mt0006949330
18,My Bloody Valentine,circular,Loveless,/album/loveless-mw0000272104,"Sleep
Like a pillow
Down(ward)
And
(Where)
She won't care
Anyway (where)

Soft
As a pillow
Touch her there
Where she won't dare
Somewhere
Sleep
Like a (royal)
(Subject)

Think
That you grew
Stronger there
Speak
Your troubles
She's not scared

Soft like there's silk
Everywhere
Sleep
(Is a) pillow
Come

Where she won't dare
Anyway (where)
(Look)
In the mirror
She's not there
Where she won't care
Somewhere",/lyric/2323918/My+Bloody+Valentine/Only+Shallow,['Pop/Rock'],4:17,"['circular', 'hypnotic', 'intense', 'sensual', 'trippy', 'visceral', 'ethereal', 'passionate']",Only Shallow,https://www.allmusic.com/song/only-shallow-mt0010490320
19,The Beach Boys,circular,The SMiLE Sessions,/album/the-smile-sessions-mw0002215480,"I've been in this town so long that back in the city
I've been taken for lost and gone
And unknown for a long long time

Fell in love years ago
With an innocent girl
From the Spanish and Indian home
Home of the heroes and villains

Once at night Catillian squared the fight
And she was right in the rain of the bullets that eventually
Brought her down
But she's still dancing in the night
Unafraid of what a dude'll do in a town full of heroes and
Villains

Heroes and villains
Just see what you've done

Heroes and villains
Just see what you've done

Stand or fall I know there
Shall be peace in the valley
And it's all an affair
Of my life with the heroes and villains

My children were raised
You know they suddenly rise
They started slow long ago
Head to toe healthy wealthy and wise

I've been in this town so long
So long to the city
I'm fit with the stuff
To ride in the rough
And sunny down snuff I'm alright
By the heroes and

Heroes and villains
Just see what you've done

Heroes and villains
Just see what you've done",/lyric/21610/The+Beach+Boys/Heroes+and+Villains,['Pop/Rock'],4:51,"['fractured', 'freewheeling', 'trippy', 'boisterous', 'circular', 'complex', 'eccentric', 'exuberant']",Heroes and Villains,https://www.allmusic.com/song/heroes-and-villains-mt0042039855
20,Stereolab,circular,"Switched On, Vols. 1-3",/album/switched-on-vols-1-3-mw0003204904,"Constitution biologique
La fois rigide et plastique
Don't la souplesse laisse place
La faculte critique
Don't la souplesse laisse place
Une bien plus grande optique
Extension Trip

Biological constitution
At the time rigid and plastic
Of which the flexibility loses its place
To the critical faculties
Of which the flexibility loses its place
To a nice large perspective",/lyric/2601073/Stereolab/The+Extension+Trip,['Pop/Rock'],3:43,"['circular', 'detached', 'hypnotic', 'innocent', 'knotty', 'quirky', 'refined', 'relaxed']",The Extension Trip,https://www.allmusic.com/song/the-extension-trip-mt0055879528
21,Stereolab,circular,"Switched On, Vols. 1-3",/album/switched-on-vols-1-3-mw0003204904,"Chaque art particulier
Rien n'est jamais donné
Des cas particuliers sont á dissocier
Toute chose reste infernal
Ça ne vient pas du ciel
En toute lucidité
Jamais la solution
Je n'ai que des questions
(n'est pas du ""ciel?"")

Each particular art/talent
Nothing is ever freely given
Each particular case has to be disassociated
Everything remains diabolical
It does not come from heaven
In all lucidity
Never the solution
I have nothing but questions
(not from ""heaven"")",/lyric/4199235/Stereolab/Cadriopo,['Pop/Rock'],3:09,"['circular', 'detached', 'gritty', 'gutsy', 'hypnotic', 'knotty', 'laid-back/mellow', 'quirky']",Cadriopo,https://www.allmusic.com/song/cadriopo-mt0055879542
22,The Beach Boys,circular,Pet Sounds/Smiley…,/album/pet-sounds-smiley-smile-wild-honey-mw0000744149,"I've been in this town so long that back in the city
I've been taken for lost and gone
And unknown for a long long time

Fell in love years ago
With an innocent girl
From the Spanish and Indian home
Home of the heroes and villains

Once at night Catillian squared the fight
And she was right in the rain of the bullets that eventually
Brought her down
But she's still dancing in the night
Unafraid of what a dude'll do in a town full of heroes and
Villains

Heroes and villains
Just see what you've done

Heroes and villains
Just see what you've done

Stand or fall I know there
Shall be peace in the valley
And it's all an affair
Of my life with the heroes and villains

My children were raised
You know they suddenly rise
They started slow long ago
Head to toe healthy wealthy and wise

I've been in this town so long
So long to the city
I'm fit with the stuff
To ride in the rough
And sunny down snuff I'm alright
By the heroes and

Heroes and villains
Just see what you've done

Heroes and villains
Just see what you've done",/lyric/21610/The+Beach+Boys/Heroes+and+Villains,['Pop/Rock'],3:39,"['fractured', 'freewheeling', 'trippy', 'boisterous', 'circular', 'complex', 'eccentric', 'exuberant']",Heroes and Villains,https://www.allmusic.com/song/heroes-and-villains-mt0014659938
23,The Beach Boys,circular,Pet Sounds/Smiley…,/album/pet-sounds-smiley-smile-wild-honey-mw0000744149,"I've been in this town so long that back in the city
I've been taken for lost and gone
And unknown for a long long time

Fell in love years ago
With an innocent girl
From the Spanish and Indian home
Home of the heroes and villains

Once at night Catillian squared the fight
And she was right in the rain of the bullets that eventually
Brought her down
But she's still dancing in the night
Unafraid of what a dude'll do in a town full of heroes and
Villains

Heroes and villains
Just see what you've done

Heroes and villains
Just see what you've done

Stand or fall I know there
Shall be peace in the valley
And it's all an affair
Of my life with the heroes and villains

My children were raised
You know they suddenly rise
They started slow long ago
Head to toe healthy wealthy and wise

I've been in this town so long
So long to the city
I'm fit with the stuff
To ride in the rough
And sunny down snuff I'm alright
By the heroes and

Heroes and villains
Just see what you've done

Heroes and villains
Just see what you've done",/lyric/21610/The+Beach+Boys/Heroes+and+Villains,['Pop/Rock'],2:59,"['fractured', 'freewheeling', 'trippy', 'boisterous', 'circular', 'complex', 'eccentric', 'exuberant']",Heroes and Villains,https://www.allmusic.com/song/heroes-and-villains-mt0014665245
24,The Beach Boys,circular,Platinum Collection:…,/album/platinum-collection-sounds-of-summer-edition-mw0000523021,"I've been in this town so long that back in the city
I've been taken for lost and gone
And unknown for a long long time

Fell in love years ago
With an innocent girl
From the Spanish and Indian home
Home of the heroes and villains

Once at night Catillian squared the fight
And she was right in the rain of the bullets that eventually
Brought her down
But she's still dancing in the night
Unafraid of what a dude'll do in a town full of heroes and
Villains

Heroes and villains
Just see what you've done

Heroes and villains
Just see what you've done

Stand or fall I know there
Shall be peace in the valley
And it's all an affair
Of my life with the heroes and villains

My children were raised
You know they suddenly rise
They started slow long ago
Head to toe healthy wealthy and wise

I've been in this town so long
So long to the city
I'm fit with the stuff
To ride in the rough
And sunny down snuff I'm alright
By the heroes and

Heroes and villains
Just see what you've done

Heroes and villains
Just see what you've done",/lyric/21610/The+Beach+Boys/Heroes+and+Villains,['Pop/Rock'],3:39,"['fractured', 'freewheeling', 'trippy', 'boisterous', 'circular', 'complex', 'eccentric', 'exuberant']",Heroes and Villains,https://www.allmusic.com/song/heroes-and-villains-mt0008745139
