,album_artist,album_mood,album_title,allmusic_href,lyrics,lyrics_href,track_genres,track_length,track_moods,track_title,track_url
49,Enya,circular,Only Time: The Collection,/album/only-time-the-collection-mw0000227416,"Hi-ri-u
Ho-ro-ho
Ho-ri-u
Him-o-ro-ho 

Hoireann is oro
Tá muid beo
Him oro ho
Go Deo na ndeor 
",/lyric/1544562/Enya/The+Longships,"['International', 'New Age', 'Pop/Rock']",3:37,"['atmospheric', 'circular', 'dramatic', 'dreamy', 'elegant', 'ethereal', 'gentle', 'hypnotic']",The Longships,https://www.allmusic.com/song/the-longships-mt0013152316
50,Enya,circular,Only Time: The Collection,/album/only-time-the-collection-mw0000227416,"Ag amharc tré m'óige
Is mé bhí sámh
Gan eolas marbh
Bhí mé óg san am,

[Chorus]
Anois, táim buartha
's fad ar shiúil an lá.
Ochón 's ochón ó.

Na laetha geal m'óige
Bhí siad lán de dhóchas
An bealach mór a bhí romham anonn
Bhí sé I ndán domh go mbeinn, slán, slán.


[Chorus]

[Translation]
The bright days of my youth

(In honor of my father and mother)

Looking back over my youth
I see I was contented
Without knowledge of death
I was young then

Now I am worried
During the course of the day.
(Oh sorrow!) (Alas and woe, oh.)

The bright days of my youth
Were full of hope
The big road that was before us then
Was what was destined to be,
Bye bye)",/lyric/1544563/Enya/Na+Laetha+Geal+M%27%C3%93ige,"['International', 'New Age', 'Pop/Rock']",3:59,"['atmospheric', 'circular', 'dramatic', 'dreamy', 'elegant', 'ethereal', 'gentle', 'hypnotic']",Na Laetha Geal M'Óige,https://www.allmusic.com/song/na-laetha-geal-m%C3ige-mt0034098666
51,Enya,circular,Only Time: The Collection,/album/only-time-the-collection-mw0000227416,"One day, one night, one moment
My dreams could be tomorrow
One step, one fall, one falter
East or west,
Over earth or by ocean
One way to be my journey
This way could be my
Book of days

No day, no night, no moment
Can hold me back from trying
I'll flag, I'll fall, I'll falter
I'll find my day maybe
Far and away
Far and away

One day, one night, one moment
With a dream to be living
One step, one fall, one falter
And a new world that cross a wide ocean
This sway became my journey
This day ends together
Far and away

This day ends together
Far and away
Far and away.",/lyric/45949/Enya/Book+of+Days+%5BFrom+Far+and+Away%5D,"['International', 'New Age', 'Pop/Rock']",2:56,"['atmospheric', 'circular', 'complex', 'dramatic', 'dreamy', 'elegant', 'gentle', 'hypnotic']",Book of Days,https://www.allmusic.com/song/book-of-days-mt0013155323
52,Enya,circular,Only Time: The Collection,/album/only-time-the-collection-mw0000227416,"Eurus
Afer Ventus

So the world goes round and round
With all you ever knew
They say the sky high above
Is Caribbean blue

If every man says all he can
If every man is true
Do I believe the sky above
Is Caribbean blue 

Boreas 
Zephryus 

If all you told was turned to gold
If all you dreamed was new
Imagine sky high above
In Caribbean blue",/lyric/2775752/Enya/Caribbean+Blue,"['New Age', 'Pop/Rock', 'International']",4:00,"['atmospheric', 'calm/peaceful', 'circular', 'complex', 'dreamy', 'elegant', 'ethereal', 'gentle']",Caribbean Blue,https://www.allmusic.com/song/caribbean-blue-mt0033865455
53,Enya,circular,Only Time: The Collection,/album/only-time-the-collection-mw0000227416,"Each time on my leaving home
I run back to my mother's arms,
One last hold and then it's over. 

Watching me, you know I cry,
You wave a kiss to say goodbye,
Feel the sky fall down upon me! 

All I am, a child with promises
All I have, are miles full of promises of home. 

If only I could stay with you,
My train moves on, you're gone from view,
Now I must wait until it's over. 

Days will pass, your words to me,
It seems so long; eternity,
But I must wait until it's over.
",/lyric/2775791/Enya/Evacuee,"['International', 'New Age', 'Pop/Rock']",3:51,"['atmospheric', 'circular', 'dramatic', 'dreamy', 'elegant', 'ethereal', 'gentle', 'hypnotic']",Evacuee,https://www.allmusic.com/song/evacuee-mt0013129771
54,Enya,circular,Only Time: The Collection,/album/only-time-the-collection-mw0000227416,"When the evening falls 
And the daylight is fading,
From within me calls
Could it be I am sleeping?
For a moment I stray, 
Then it holds me completely
Close to home - I cannot say
Close to home feeling so far away

As I walk the room there before me a shadow
From another world, where no other can follow
Carry me to my own, to where I can cross over
Close to home - I cannot say
Close to home feeling so far away

Forever searching; never right,
I am lost in oceans of night. 
Forever hoping I can find memories
Those memories I left behind

Even though I leave will I go on believing
That this time is real - am I lost in this feeling?
Like a child passing through, 
Never knowing the reason
I am home - I know the way
I am home - feeling oh, so far away
",/lyric/28797941/Enya/Evening+Falls..,"['International', 'New Age', 'Pop/Rock']",3:49,"['atmospheric', 'circular', 'dramatic', 'dreamy', 'elegant', 'ethereal', 'gentle', 'hypnotic']",Evening Falls,https://www.allmusic.com/song/evening-falls-mt0013153198
55,Enya,circular,Only Time: The Collection,/album/only-time-the-collection-mw0000227416,"I dreamt I dwelt in marble halls
With vassals and serfs at my side,
And of all who assembled within those walls
That I was the hope and the pride.
I had riches all too great to count
And a high ancestral name. 

But I also dreamt which pleased me most
That you loved me still the same,
That you loved me
You loved me still the same,
That you loved me
You loved me still the same.

I dreamt that suitors sought my hand,
That knights upon bended knee
And with vows no maidens heart could withstand,
They pledged their faith to me.
And I dreamt that one of that noble host
Came forth my hand to claim. 

But I also dreamt which charmed me most
That you loved me still the same
That you loved me
You loved me still the same,
That you loved me
You loved me still the same.
",/lyric/469621/Enya/Marble+Halls,"['International', 'New Age', 'Pop/Rock']",3:53,"['atmospheric', 'circular', 'complex', 'dreamy', 'elegant', 'gentle', 'hypnotic', 'light']",Marble Halls,https://www.allmusic.com/song/marble-halls-mt0013144430
56,Enya,circular,Only Time: The Collection,/album/only-time-the-collection-mw0000227416,"I walk the maze of moments
But everywhere I turn to
Begins a new beginning
But never finds a finish
I walk to the horizon
And there I find another
It all seems so surprising
And then I find that I know

You go there you're gone forever
I go there I'll lose my way
If we stay here we're not together
Anywhere is

The moon upon the ocean
Is swept around in motion
But without ever knowing
The reason for its flowing
In motion on the ocean
The moon still keeps on moving
The waves still keep on waving
And I still keep on going

You go there you're gone forever
I go there I'll lose my way
If we stay here we're not together
Anywhere is

I wonder if the stars sign
The life that is to be mine
And would they let their light shine
Enough for me to follow
I look up to the heavens
But night has clouded over
No spark of constellation
No Vela no Orion

The shells upon the warm sands
Have taken from their own lands
The echo of their story
But all I hear are low sounds
As pillow words are weaving
And willow waves are leaving
But should I be believing
That I am only dreaming

You go there you're gone forever
I go there I'll lose my way
If we stay here we're not together
Anywhere is

To leave the tread of all time
And let it make a dark line
In hopes that I can still find
The way back to the moment
I took the turn and turned to
Begin a new beginning
Still looking for the answer
I cannot find the finish
It's either this or that way
It's one way or the other
It should be one direction
It could be on reflection
The turn I have just taken
The turn that I was making
I might be just beginning
I might be near the end.",/lyric/1474423/Enya/Anywhere+Is,"['International', 'New Age', 'Pop/Rock']",3:59,"['atmospheric', 'circular', 'complex', 'dreamy', 'elegant', 'gentle', 'hypnotic', 'light']",Anywhere Is,https://www.allmusic.com/song/anywhere-is-mt0013151144
57,Enya,circular,Only Time: The Collection,/album/only-time-the-collection-mw0000227416,"Who can tell me if we have heaven,
Who can say the way it should be;
Moonlight holly, the Sappho Comet,
Angel's tears below a tree. 

You talk of the break of morning
As you view the new aurora,
Cloud in crimson, the key of heaven,
One love carved in acajou.

One told me of China Roses,
One a thousand nights and one night,
Earth's last picture, the end of evening
Hue of indigo and blue.

A new moon leads me to
Woods of dreams and I follow.
A new world waits for me;
My dream, my way. 

I know that if I have heaven
There is nothing to desire.
Rain and river, a world of wonder
May be paradise to me.

I see the sun.
I see the stars.
",/lyric/1727198/Enya/China+Roses,"['International', 'New Age', 'Pop/Rock']",4:49,"['atmospheric', 'circular', 'complex', 'dreamy', 'elegant', 'gentle', 'hypnotic', 'light']",China Roses,https://www.allmusic.com/song/china-roses-mt0013149165
58,Enya,circular,Only Time: The Collection,/album/only-time-the-collection-mw0000227416,"My life goes on in endless song
Above earth´s lamentations,
I hear the real, though far-off hymn
That hails a new creation.

Through all the tumult and the strife
I hear its music ringing,
It sounds an echo in my soul.
How can I keep from singing?

While though the tempest loudly roars,
I hear the truth, it liveth.
And though the darkness 'round me close,
Songs in the night it giveth.

No storm can shake my inmost calm,
While to that rock I´m clinging.
Since love is lord of heaven and earth
How can I keep from singing?

When tyrants tremble in their fear
And hear their death knell ringing,
When friends rejoice both far and near
How can I keep from singing?

In prison cell and dungeon vile
Our thoughts to them are winging,
When friends by shame are undefiled
How can I keep from singing?",/lyric/1538555/Enya/How+Can+I+Keep+from+Singing%3F,"['International', 'New Age', 'Pop/Rock']",4:24,"['atmospheric', 'circular', 'dramatic', 'dreamy', 'elegant', 'ethereal', 'gentle', 'hypnotic']",How Can I Keep from Singing?,https://www.allmusic.com/song/how-can-i-keep-from-singing-mt0013148671
59,Enya,circular,Only Time: The Collection,/album/only-time-the-collection-mw0000227416,"One look at love and you may see
It weaves a web over mystery,
All ravelled threads can rend apart
For hope has a place in the lover's heart.
Hope has a place in a lover's heart. 

Whispering world, a sigh of sighs,
The ebb and the flow of the ocean tides.
One breath, one word may end or may start
A hope in a place of the lover's heart.
Hope has a place in a lover's heart.

Look to love you may dream,
And if it should leave then give it wings.
But if such a love is meant to be;
Hope is home, and the heart is free

Under the heavens we journey far,
On roads of life we're the wanderers,
So let love rise, so let love depart,
Let hope have a place in the lover's heart.
Hope has a place in a lover's heart. 

Look to love and you may dream,
And if it should leave then give it wings.
But if such a love is meant to be;
Hope is home, and the heart is free.
Hope is home, and the heart is free.
",/lyric/2538277/Enya/Hope+Has+a+Place,"['International', 'New Age', 'Pop/Rock']",4:46,"['atmospheric', 'circular', 'dramatic', 'dreamy', 'elegant', 'ethereal', 'gentle', 'hypnotic']",Hope Has a Place,https://www.allmusic.com/song/hope-has-a-place-mt0013149842
60,Enya,circular,Only Time: The Collection,/album/only-time-the-collection-mw0000227416,"Domineoveniteosacramentum(discesm)eodeo
Domineoveniteosacramentum(discesm)eodeo
Domineoveniteosacramentum(discesm)eodeo
Athairarneamhdialinn, athairarneamhdialiom

Omnem crede diem tibi diluxisse supremum.
Omnem crede diem tibi diluxisse supremum.",/lyric/2538278/Enya/Pax+Deorum,"['International', 'New Age', 'Pop/Rock']",4:59,"['atmospheric', 'circular', 'dramatic', 'dreamy', 'elegant', 'ethereal', 'gentle', 'hypnotic']",Pax Deorum,https://www.allmusic.com/song/pax-deorum-mt0031278857
61,Enya,circular,Only Time: The Collection,/album/only-time-the-collection-mw0000227416,"I do bheatha sa tús, sa deireadh,
I do bheatha sa tús, sa deireadh.
Isobella, o
Isobella, o

I do lá 's tú go sámh
I do lá 's tú go fior.
Grá, anois go deo na ndeor.

I do bheatha sa tús, sa deireadh
I do bheatha sa tús, sa deireadh
Isobella, o
Isobella, o

I do lá 's tú gan buairt
I do lá 's tú gan brón
Grá, anois go deo
Grá, anois go deo na ndeor.




Translation:

Out of morning and into midnight,
Through the sunrise and under moonlight.
Isobella, oh!
Isobella, dream of me.

Everything that comes from day
Comes into the heart to stay.
Love is in your name each day.

In the moment you come before me,
In that moment I see you only
Isobella, oh!
Isobella, dream of me.

Everything that comes from night
Comes within your shining light.
Love is in your name each night.",/lyric/5913664/Enya/Isobella,"['International', 'New Age', 'Pop/Rock']",4:27,"['atmospheric', 'circular', 'dramatic', 'dreamy', 'elegant', 'ethereal', 'gentle', 'hypnotic']",Isobella,https://www.allmusic.com/song/isobella-mt0013146944
62,Enya,circular,Only Time: The Collection,/album/only-time-the-collection-mw0000227416,"Ever close your eyes
Ever stop and listen
Ever feel alive
And you've nothing missing
You don't need a reason
Let the day go on and on

Let the rain fall down
Everywhere around you
Give into it now
Let the day surround you
You don't need a reason
Let the rain go on and on

What a day, what a day to take to
What a way, what a way to make it through
What a day, what a day to take to a wild child

Only take the time
From the helter skelter
Every day you find
Everything's in kilter
You don't need a reason
Let the day go on and on

Every summer sun
Every winter evening
Every spring to come
Every autumn leaving
You don't need a reason
Let it all go on and on

What a day, what a day to take to
What a way, what a way to make it through
What a day, what a day to take to a wild child

What a day, what a day to take to
What a way, what a way to make it through
What a day, what a day to take to a wild child

What a day, what a day to take to
What a way, what a way to make it through
What a day, what a day to take to

What a way, what a way to make it through

What a way, what a way to make it through
What a day, what a day to take to a wild child
What a day, what a day to take to a wild child",/lyric/4294551/Enya/Wild+Child,"['International', 'New Age', 'Pop/Rock']",3:47,"['atmospheric', 'circular', 'dramatic', 'dreamy', 'elegant', 'ethereal', 'gentle', 'hypnotic']",Wild Child,https://www.allmusic.com/song/wild-child-mt0013142445
63,Enya,circular,Only Time: The Collection,/album/only-time-the-collection-mw0000227416,"Lovers in the long grass
Look above them
Only they can see
Where the clouds are going
Only to discover
Dust and sunlight
Ever make the sky so blue

Afternoon is hazy
River flowing
All around the sounds
Moving closer to them
Telling them the story
Told by Flora
Dreams they never knew

Silver willows
Tears from Persia
Those who come
From a far-off island
Winter Chanterelle lies
Under cover
Glory-of-the-sun in blue

Some they know as passion
Some as freedom
Some they know as love
And the way it leaves them
Summer snowflake
For a season
When the sky above is blue
When the sky above is blue

Lying in the long grass
Close beside her
Giving her the name
Of the one the moon loves
This will be the day she
Will remember
When she knew his heart
Was
Loving in the long grass
Close beside her
Whispering of love
And the way it leaves them
Lying in the long grass
In the sunlight
They believe it's true love
And from all around them
Flora's secret
Telling them of love
And the way it breathes
And
Looking up from eyes of
Amaranthine
They can see the sky
Is blue
Knowing that their love
Is true
Dreams they never knew
And the sky above is blue",/lyric/4294555/Enya/Flora%27s+Secret,"['International', 'New Age', 'Pop/Rock']",4:07,"['atmospheric', 'circular', 'dramatic', 'dreamy', 'elegant', 'ethereal', 'gentle', 'hypnotic']",Flora's Secret,https://www.allmusic.com/song/floras-secret-mt0013152545
64,Enya,circular,Only Time: The Collection,/album/only-time-the-collection-mw0000227416,"Once, as my heart remembers,
All the stars were fallen embers.
Once, when night seemed forever
I was with you.

Once, in the care of morning
In the air was all belonging.
Once, when that day was dawning
I was with you.

How far we are from morning,
How far we are
And the stars shining through the darkness,
Falling in the air.

Once, as the night was leaving
Into us our dreams were weaving.
Once, all dreams were worth keeping.
I was with you.

Once, when our hearts were singing,
I was with you.",/lyric/4294556/Enya/Fallen+Embers,"['International', 'New Age', 'Pop/Rock']",2:31,"['atmospheric', 'circular', 'dramatic', 'dreamy', 'elegant', 'ethereal', 'gentle', 'hypnotic']",Fallen Embers,https://www.allmusic.com/song/fallen-embers-mt0034839110
65,Enya,circular,Only Time: The Collection,/album/only-time-the-collection-mw0000227416,"Ergo,
Oceanus, maritimus,
Ergo
Opacare, matutinus,
Ergo
Septentrio, meridies,
Ergo
Occidens et orientis,
Ergo
Oceanus, maritimus,
Opacare, matutinus,
Septentrio, meridies,
Occidens et orientis,
Ergo
Terra, stella,
Hiems et aestas,
Ergo
Autumnus et 
Tempus vernum,
Ergo
Radius solis 
Et umbra,
Ignis, aqua
Caelum, luna,
Terra, stella,
Hierns et aestas,
Autumnus et 
Tempus vernum

Tempus vernum

[Translation]

Therefore  
Ocean, sea,  
Therefore
Dusk, dawn,  
Therefore
North, south,
Therefore
West and east,
Therefore 
Ocean, sea
Dusk, dawn,
North, south,
West and east,
Therefore
Earth, star,
Winter and summer,
Therefore
Autumn and 
Spring time,
Therefore
Ray of the sun 
And shade,
Fire, water
Sky, moon,
Earth, star,
Winter and summer,
Autumn and 
Spring time

Spring time",/lyric/4294553/Enya/Tempus+Vernum,"['International', 'New Age', 'Pop/Rock']",2:24,"['atmospheric', 'circular', 'dramatic', 'dreamy', 'elegant', 'ethereal', 'gentle', 'hypnotic']",Tempus Vernum,https://www.allmusic.com/song/tempus-vernum-mt0013144789
66,Enya,circular,Only Time: The Collection,/album/only-time-the-collection-mw0000227416,"Ba dheas an lá go oíche
Na glórtha binne i mo thaobh
'S aoibhneas i gach áit gan gruaim
Áthas are mo chroí go deo
He-a-ro
He-a-o-ro

Ma shiúlaim ó na laetha beo
An ghrian 's an ghealach are mo chúl
Nil uaim ach smaointe ó mo shaoil
Deora are mo chroí go brón
He-a-ro
He-a-ro
He-a-o-ro",/lyric/5913673/Enya/Deora+Ar+Mo+Chroi+%5BTears+on+My+Heart%5D,"['International', 'New Age', 'Pop/Rock']",2:48,"['atmospheric', 'circular', 'dramatic', 'dreamy', 'elegant', 'ethereal', 'gentle', 'hypnotic']",Deora Ar Mo Chroi [Tears on My Heart],https://www.allmusic.com/song/deora-ar-mo-chroi-tears-on-my-heart-mt0013145806
67,Enya,circular,Only Time: The Collection,/album/only-time-the-collection-mw0000227416,"Here am I
Yet another goodbye!
He says AdiÃ³s, says AdiÃ³s,
And do you know why
She won't break down and cry?
She says AdiÃ³s, says AdiÃ³s, Goodbye. 

One by one my leaves fall.
One by one my tales are told.

It's no lie
She is yearning to fly.
She says AdiÃ³s, says AdiÃ³s,
And now you know why
He's a reason to sigh
She says AdiÃ³s, says AdiÃ³s, Goodbye.

One by one my leaves fall.
One by one my tales are told. 

My, oh my!
She was aiming too high.
He says AdiÃ³s, says AdiÃ³s,
And now you know why
There's no moon in her sky
He says AdiÃ³s, says AdiÃ³s, Goodbye. 
He says AdiÃ³s, says AdiÃ³s, Goodbye. 

No Goodbyes
For love brightens their eyes.
Don't say AdiÃ³s, say AdiÃ³s,
And do you know why
There's a love that won't die?
Don't say AdiÃ³s, say AdiÃ³s, Goodbye.
Don't say AdiÃ³s, say AdiÃ³s, Goodbye.
Don't say AdiÃ³s, say AdiÃ³s, Goodbye.",/lyric/4294559/Enya/One+by+One,"['International', 'New Age', 'Pop/Rock']",3:54,"['atmospheric', 'circular', 'dramatic', 'dreamy', 'elegant', 'ethereal', 'gentle', 'hypnotic']",One by One,https://www.allmusic.com/song/one-by-one-mt0030292490
68,Enya,circular,Only Time: The Collection,/album/only-time-the-collection-mw0000227416,"Lazy old day
Rolling away
Dreaming the day away
Don't want to go
Now that I'm in the flow
Crazy amazing day

One red balloon
Floats to the moon
Just let it fly away
I only know
That I'm longing to go
Back to my lazy day

And how it sings and how it sighs
And how it never stays
And how it rings and how it cries
And how it sails away, away, away",/lyric/4294560/Enya/Lazy+Days,"['International', 'New Age', 'Pop/Rock']",3:43,"['atmospheric', 'circular', 'dramatic', 'dreamy', 'elegant', 'ethereal', 'gentle', 'hypnotic']",Lazy Days,https://www.allmusic.com/song/lazy-days-mt0013129219
69,Enya,circular,Only Time: The Collection,/album/only-time-the-collection-mw0000227416,"May it be an evening star
Shines down upon you
May it be when darkness falls
Your heart will be true
You walk a lonely road
Oh! How far you are from home

Mornie utulie 
Believe and you will find your way
Mornie alantie 
A promise lives within you now

May it be the shadow's call
Will fly away
May it be your journey on
To light the day
When the night is overcome
You may rise to find the sun

Mornie utulie (darkness has come) 
Believe and you will find your way
Mornie alantie (darkness has fallen) 
A promise lives within you now

A promise lives within you now",/lyric/5224605/Enya/May+It+Be,"['International', 'New Age', 'Pop/Rock', 'Stage & Screen']",3:33,"['atmospheric', 'circular', 'dramatic', 'dreamy', 'elegant', 'ethereal', 'gentle', 'hypnotic']",May It Be,https://www.allmusic.com/song/may-it-be-mt0013152793
70,Enya,circular,Only Time: The Collection,/album/only-time-the-collection-mw0000227416,"Oiche chiuin, oiche Mhic De,
Cach 'na suan dis araon.
Dis is dilse 'faire le speis
Naion beag, leanbh ceansa 'gus caomh.

Criost, 'na chodladh go samh.
Criost, 'na chodladh go samh.

Oiche chiuin, oiche Mhic De,
Aoiri are dtus chuala 'n sceal.
Alleluia aingeal ag glaoch.
Cantain suairc i ngar is i gcein.

Criost an Slanaitheoir Fein.
Criost an Slanaitheoir Fein.

Silent night, night of God's son,
Everyone is asleep, the pair together.
The most faithful pair, watching with hope
A little baby, a mild and gentle child.

Christ, calmly asleep.
Christ, calmly asleep.",/lyric/622751/Enya/O%C3%ADche+Chi%C3%BAin+%5BSilent+Night%5D,"['International', 'New Age', 'Holiday', 'Pop/Rock']",6:17,"['atmospheric', 'circular', 'dramatic', 'dreamy', 'elegant', 'ethereal', 'gentle', 'hypnotic']",Oíche Chiúin [Silent Night],https://www.allmusic.com/song/o%C3%ADche-chi%C3%BAin-silent-night-mt0013143464
71,Enya,circular,Only Time: The Collection,/album/only-time-the-collection-mw0000227416,"Oiche chiuin, oiche Mhic De,
Cach 'na suan dis araon.
Dis is dilse 'faire le speis
Naion beag, leanbh ceansa 'gus caomh.

Criost, 'na chodladh go samh.
Criost, 'na chodladh go samh.

Oiche chiuin, oiche Mhic De,
Aoiri are dtus chuala 'n sceal.
Alleluia aingeal ag glaoch.
Cantain suairc i ngar is i gcein.

Criost an Slanaitheoir Fein.
Criost an Slanaitheoir Fein.

Silent night, night of God's son,
Everyone is asleep, the pair together.
The most faithful pair, watching with hope
A little baby, a mild and gentle child.

Christ, calmly asleep.
Christ, calmly asleep.",/lyric/622751/Enya/O%C3%ADche+Chi%C3%BAin+%5BSilent+Night%5D,"['International', 'New Age', 'Holiday', 'Pop/Rock']",17:59,"['atmospheric', 'circular', 'dramatic', 'dreamy', 'elegant', 'ethereal', 'gentle', 'hypnotic']",Oíche Chiúin [Silent Night],https://www.allmusic.com/song/o%C3%ADche-chi%C3%BAin-silent-night-mt0013149787
