,album_artist,album_mood,album_title,allmusic_href,lyrics,lyrics_href,track_genres,track_length,track_moods,track_title,track_url
25,Sonic Youth,circular,Rather Ripped,/album/rather-ripped-mw0000775736,"I ripped your heart out from your chest
Replaced it with a grenade blast

Incinerate
Incinerate
Incinerate
Incinerate

The firefighters hose me down
I don't care, I'll burn out anyhow
It's four-alarm girl, nothing to see
Hear the sirens come for me
You doused my soul with gasoline
You flicked a match into my brain

Incinerate
Incinerate
Incinerate
Incinerate

The firefighters are so nice
I remember you so cold as ice
The flames are licking at your feet
The sirens come to put me me out of misery
You wave your torch into my eyes
Flamethrower lover burning mind

Incinerate
Incinerate
Incinerate
Incinerate
Incinerate
Incinerate
Incinerate
Incinerate",/lyric/10009043/Sonic+Youth/Incinerate,['Pop/Rock'],4:55,"['atmospheric', 'dramatic', 'tense/anxious', 'cerebral', 'circular', 'complex', 'detached', 'hypnotic']",Incinerate,https://www.allmusic.com/song/incinerate-mt0000506088
26,Sonic Youth,circular,Rather Ripped,/album/rather-ripped-mw0000775736,"Stand behind his drunken imp
Stand behind his light of love
Hear him yell his bloody tongue
Hear him yell of blood and war

Do you believe in his sweet sensation?
Do you believe in second chance?
Do you believe in rapture, babe?

A terrible hit strikes today
A terrible hit for the parade
Burning eyes see Jesus coming
Jesus comes to pave the way

Do you believe in his sweet sensation?
Do you believe in second chance?
Do you believe in rapture, babe?

Can you tell me what to feel?
Open up your tender soul
Can I drink your drunken mercy?
Wine burns the devil's home

Do you believe in his sweet sensation?
Do you believe in second chance?
Do you believe in rapture, babe?",/lyric/10009044/Sonic+Youth/Do+You+Believe+in+Rapture%3F,['Pop/Rock'],3:11,"['atmospheric', 'dramatic', 'spooky', 'tense/anxious', 'cerebral', 'circular', 'complex', 'detached']",Do You Believe in Rapture?,https://www.allmusic.com/song/do-you-believe-in-rapture-mt0000329116
27,Sonic Youth,circular,Rather Ripped,/album/rather-ripped-mw0000775736,"Sleepin' around sleepin' around
What will the neighbors say
Sleepin' around all over town
What will the neighbors say

[Chorus:]
What you did was wrong
What did you good is gone
Nothing you do is right
Always ends up in a fight

Sleepin' around sleepin' around
What will the neighbors do
Sleepin' around all over town
What will the neighbors do

[Chorus]

Sleepin' around sleepin' around
What will the neighbors think
Sleepin' around all over town
What will the neighbors think

[Chorus]",/lyric/10009045/Sonic+Youth/Sleepin%27+Around,['Pop/Rock'],3:42,"['dramatic', 'tense/anxious', 'circular', 'cynical/sarcastic', 'detached', 'energetic', 'freewheeling', 'hypnotic']",Sleepin' Around,https://www.allmusic.com/song/sleepin-around-mt0005046092
28,Sonic Youth,circular,Rather Ripped,/album/rather-ripped-mw0000775736,"She got you, got you good didn't have a chance
Pretty lady put you in wear hat master ends 
Oh baby don't you know you're livin' on the death
You better stay away if you want to live

Lalalalalalalalalaaaaaah
Lalalalalalalalalaaaaaah

Every time you turn around she is lookin' up at you and down below
Oooh sugar pie
Mmm come on
Chocolate spot

She gotta gun and all don't you even know
She looks into your eyes angels wanna go
She takes it on the stride leap through mind again 
Don't worry you are fine living with the mess

Lalalalalalalalalaaaaaah
Lalalalalalalalalaaaaaah

Every time you turn around she is lookin' up at you and down below
Ooh sugar pudding
Candy tic
Orange rolls angel's spit

Boy she's got you got you good don't you even try?
Come on if you could you would surely die
You take it towards your mouth you don't even know
Come on sugar tic you are gonna go

Lalalalalalalalalaaaaaah
Lalalalalalalalalaaaaaah

Every time you turn around she is lookin' up at you and down below
Cool dye chocolate spot
Check her out don't you know 
Deep in my heart saying g'bye",/lyric/2535271/Sonic+Youth/Orange+Rolls%2C+Angel%27s+Spit,['Pop/Rock'],3:31,"['atmospheric', 'dramatic', 'spooky', 'tense/anxious', 'cerebral', 'circular', 'complex', 'detached']",Or,https://www.allmusic.com/song/or-mt0001229188
29,Foals,circular,Antidotes,/album/antidotes-mw0000783365,"[Chorus: x4]
Un peu d'air sur la terre
D'air sur la
D'air sur la
D'air sur la terre

Wasted games
All these wasted games
Racquet's gadgets
Wasted games
All these wasted games
Racquet's

[Chorus: x4]

Waste away
All these wasted games
Racquet's gadgets
Wasted games
All these wasted games
Racquet's

Wasted games
Oh we waste away
Racquet's gadgets
Wasted games
All these wasted games
Racquet's",/lyric/13985053/Foals/The+French+Open,['Pop/Rock'],3:45,"['confident', 'fractured', 'brittle', 'cerebral', 'circular', 'dramatic', 'energetic', 'exciting']",The French Open,https://www.allmusic.com/song/the-french-open-mt0018009795
30,Foals,circular,Antidotes,/album/antidotes-mw0000783365,"Cassius is over!
Cassius away!
Cassius these daydreams, these daydreams decay!

Cassius an accident!
Cassius an accident!
Accident!
Accident!
Accident!

Cassius it's over!
Cassius away!
Cassius these daydreams, these daydreams decay!

Lighthouse (Life) is an accident!
The lighthouse (Love) is an accident!
Accident!
Accident!
Accident!

Wish you've gone-a, wish you've gone away, what you've gone-a
What you've got has always gone away
Cassius! Cassius! At best, it's all that we could do,
All that we could do
The wind is in, the wind is in my heart, the wind is in-
Now what you've got has always gone away
Cassius! Cassius! At best, it's all that we could do,
All that we could do

Cassius, is over! You're second best!
Cassius, it's over! You're second best!
It's over! You're second best!
Second best!
Second best!
Second best!

Cassius is over!
Cassius away!
Cassius these daydreams, these daydreams decay!

Lighthouse (Life) is an accident!
The lighthouse (Love) is an accident!
Accident!
Accident!
Accident!

Wish you've gone-a, wish you've gone away, what you've gone-a
What you've got has always gone away
Cassius! Cassius! at best, it's all that we could do,
All that we could do
The wind is in, the wind is in my heart, the wind is in-
Now what you've got has always gone away
Cassius! Cassius! At best, it's all that we could do,
All that we could do

Cassius, is over! You're second best!
Cassius, it's over! You're second best!
It's over! You're second best!
Second best!
Second best!
Second best!

Wish you've gone-a, wish you've gone away, what you've gone-a
What you've got has always gone away
Cassius! Cassius! At best, it's all that we could do,
All that we could do
The wind is in, the wind is in my heart, the wind is in-
Now what you've got has always gone away
Cassius! Cassius! At best, it's all that we could do,
All that we could do",/lyric/13985054/Foals/Cassius,['Pop/Rock'],3:49,"['confident', 'fractured', 'aggressive', 'brittle', 'cerebral', 'circular', 'dramatic', 'energetic']",Cassius,https://www.allmusic.com/song/cassius-mt0018008249
31,Foals,circular,Antidotes,/album/antidotes-mw0000783365,"Contact
She said, these wasp's nests in your head
These wasp's nests, these terminals in your head
These heart swells, these contacts in your head

Oh help no, these vessels
Our heart swells on these vessels
Our heart swells up, let's make them explode

Oh help no, these vessels
Our heart swells on these vessels
Our heart swells up let's make them explode

Oh, what the hell, she should've said
Oh, what the hell, we should've said
Our heart swells up, let's make them explode

These wasp's nests, these contacts in your head
Once again...
We could set it on fire for them
We could set it on fire for them
We could set it on fire for them
We could set it on fire for them, for them, for them, for them

Oh help no, these vessels
Our heart swells on these vessels
Our heart swells up let's make them explode

Oh, what the hell, she should've said
Oh, what the hell, we should've said
Our heart swells up, let's make them explode

Oh help no, these vessels
Our heart swells on these vessels
Our heart swells up let's make them explode

Oh what the hell,
We set it on fire
We set it on fire
We set it on fire",/lyric/13985055/Foals/Red+Socks+Pugie,['Pop/Rock'],5:15,"['confident', 'fractured', 'atmospheric', 'brittle', 'cerebral', 'circular', 'dramatic', 'dreamy']",Red Socks Pugie,https://www.allmusic.com/song/red-socks-pugie-mt0031036259
32,Foals,circular,Antidotes,/album/antidotes-mw0000783365,"Sun up, we wait all day
Sun's up, we wait all day, all day
While the hell outside is kept away
If only we could move away from here
This is how we build a place
An aviary for today
An aviary for today
Let's disappear till tomorrow
Let's disappear till tomorrow
Disappear
Disappear
Disappear

Blow up these plane parades, let's go
To an aviary far from home
To an aviary far from home
A one hand clap is me and you, and you, and you
While the hell outside is kept away
If only we'd moved away
Disappear
Disappear
Disappear

Last vacation was the same
We could move away
Last vacation was the same
We could move away
Last vacation was the same
(The same)

Sun down now
We have built our place
An aviary
Forever
An aviary
Forever
Forever
Forever

Reappear, oh
Reappear, oh
Reappear, oh
Reappear, oh",/lyric/13985056/Foals/Olympic+Airways,['Pop/Rock'],4:12,"['confident', 'fractured', 'atmospheric', 'cerebral', 'circular', 'dramatic', 'dreamy', 'exciting']",Olympic Airways,https://www.allmusic.com/song/olympic-airways-mt0018006969
33,Foals,circular,Antidotes,/album/antidotes-mw0000783365,"Sun side sun dance step for two
Sun side dance step for two
Sun side dance step for two
Sun side dance step for two (dance upon and sing)
Sun side dance step for two (dance upon and sing)
Sun side dance step for two (dance upon and sing)
Sun side dance step for two (dance upon and sing)
Sun side dance step for two (dance upon and sing)
Sun side dance step for two (dance upon and sing)
Sun side dance step for two (dance upon and sing)
Sunset disco this is for you!

Thats one step one step two step
Thats two steps two steps speed bikes
Thats one step one step two step
Thats two step dance step speed bikes
Thats one side one side one side
Thats one side two steps speed bikes
Lets swim lets swim lets swim this song
Lets swim lets swim lets swim this song

Thats two step two step one step
Thats one step two step dance step
Thats two step dance step speed bikes

Lets swim lets swim lets swim this off [Repeat x5]",/lyric/13985060/Foals/Two+Steps+Twice,['Pop/Rock'],4:39,"['confident', 'fractured', 'aggressive', 'atmospheric', 'brittle', 'cerebral', 'circular', 'dramatic']",Two Steps Twice,https://www.allmusic.com/song/two-steps-twice-mt0018009978
34,Foals,circular,Antidotes,/album/antidotes-mw0000783365,"[Chorus: x3]
See how the skulls we built 
Fill, all the towers we fill. 
Crush down fury red 
It cracks in our hearts and heads. 

Smile Sticks a kiss 
That could stop it. 

Smile Sticks a kiss 
That could stop it. 

Smile Sticks a kiss 
That could stop it. 

Smile Sticks a kiss 

Smile Sticks a kiss 

Smile Sticks a kiss 
That could stop it. 

Smile Sticks a kiss 

Smile Sticks a kiss 

All could be well 

[Chorus]

Place we can hide. 

Ow, Electric shocks, no! [Repeat x8] 

[Chorus: x3]

Smile sticks a kiss That could stop [Repeat x2] 
Smile sticks a kiss 
Smile mile sticks a kiss [Repeat x2] 

All could be well 

Ow, Electric shocks, no! [Repeat x4]",/lyric/13985061/Foals/Big+Big+Love+%28Fig.+2%29,['Pop/Rock'],5:47,"['confident', 'atmospheric', 'cerebral', 'circular', 'dreamy', 'lively', 'quirky', 'reflective']",Big Big Love (Fig. 2),https://www.allmusic.com/song/big-big-love-fig-2-mt0028103889
35,Foals,circular,Antidotes,/album/antidotes-mw0000783365,"Away, away from this system there is another country, a place we could go
Away, away from this system there is another country, a place we could go
Away, away from this system there is a flower shop by which I mean to say
Away, away from this system there is another country place we could go
Away, away, away, away, away, away, away

If something won't heal, our children can't help you out
If something won't heal, our children can't help you out
If something won't heal, a compass can't help you out
If something won't heal, our children can't help you out

Away, away from this system there is a flower shop by which I mean to say
Away, away from this system there is another country place we could go
Away, away, away, away, away, away, away

A waste is a waste

If something won't heal, our children can't help us out
If something won't heal, our children can't help us out
If something won't heal, a compass can't help you out
This love is foreign, why don't we quieten down?",/lyric/13985063/Foals/Tron,['Pop/Rock'],4:50,"['confident', 'fractured', 'atmospheric', 'brittle', 'cerebral', 'circular', 'dreamy', 'energetic']",Tron,https://www.allmusic.com/song/tron-mt0029424577
36,Foals,circular,Antidotes,/album/antidotes-mw0000783365,"Quite a heartbeat,
Your quite a heartbeat,
Race right through you,
You sleep like small stars fly back home
Quite a heartbeat (Shine like million)
Your quite a heartbeat (Shine like million)
Race right through you (Shine like million)
You sleep like small stars fly back home

I, come on
I, come on
I, come on
I, come on
Oh, come on
Oh, come on
Oh, come on
Oh, come on
We are everywhere,
We are everywhere,
We are everywhere,
We are everywhere. 
I, come on
I, come on
I, come on
I, come on
Oh, come on
Oh, come on
Oh, come on
Oh, come on

Quite a heartbeat (Shine like million)
Your quite a heartbeat (Shine like million)
Race right through you (Shine like million)
Have we come too far to get home? 
Quite a heartbeat (Shine like million)
Your quite a heartbeat (Shine like million)
Race right through you (Shine like million)
You sleep like small stars fly back home

I, come on
I, come on
I, come on
I, come on
Oh, come on
Oh, come on
Oh, come on
Oh, come on",/lyric/10652862/Foals/Hummer,['Pop/Rock'],2:54,"['confident', 'fractured', 'brittle', 'circular', 'lively', 'passionate', 'quirky', 'raucous']",Hummer,https://www.allmusic.com/song/hummer-mt0018017272
37,Foals,circular,Antidotes,/album/antidotes-mw0000783365,"Calling all kids
This is our spear
It's on track to call yourself
A hero now
A hero then
You come on yourself like some way
Go sideways
Wait late there
Like some kind of ocean takes you there
Takes you there
Takes you there
Takes you there

[Chorus]
Turning the
Academy down
Academy down
Academy down
The hood
To turn it down oh
To turn it down oh
To turn it down oh
Turning the
Academy down
Academy down
Academy down
The hood
C-count me out oh
C-count me out oh
C-count me out oh

Side way
We'll go sideway
Calling all kids
On
And on
And on and on and on and on
Side way
We'll go sideway
Calling all kids
On
And on
And on and on and on
And on and on and on
And on and on and on

And on and on and on

Go sideway
Go sideway sideway sideway
Wait to twelve
For sideway
For sideway sideway to show
Show himself
For sideway
For sideway sideway sideway
Wait to seven
Wait to seven
Wait to seven
To seven to seven to show

[Chorus]",/lyric/13985066/Foals/Mathletics+%5B%2A%5D,['Pop/Rock'],3:08,"['confident', 'aggressive', 'brittle', 'cerebral', 'circular', 'dramatic', 'energetic', 'exciting']",Mathletics,https://www.allmusic.com/song/mathletics-mt0032635765
38,Enya,circular,Only Time: The Collection,/album/only-time-the-collection-mw0000227416,"Cold as the northern winds
in December mornings,
Cold is the cry that rings
from this far distand shore.


Winter has come too late
too close beside me.
How can I chase away
all these fears deep inside?


I'll wait the signs to come.
I'll find a way
I will wait the time to come.
I'll find a way home.


My light shall be the moon
and my path - the ocean.
My guide the morning star
as I sail home to you.


I'll wait the signs to come.
I'll find a way.
I will wait the time to come.
I'll find a way home.


Who then can warm my soul?
Who can quell my passion?
Out of these dreamsQa boat
I will sail home to you. ",/lyric/1538531/Enya/Exile+%5BFrom+L.A.+Story%5D,"['International', 'New Age', 'Pop/Rock']",4:22,"['atmospheric', 'circular', 'dramatic', 'dreamy', 'elegant', 'ethereal', 'gentle', 'hypnotic']",Exile,https://www.allmusic.com/song/exile-mt0013148858
39,Enya,circular,Only Time: The Collection,/album/only-time-the-collection-mw0000227416,"Codladh fada,
Codladh domhain.
Éirigh! Amharc síos
Aldebaran. 

Siúil liom tríd an réalta dearg.
Deireadh, deireadh an turas.
Réaltóg, réaltóg dearg.
",/lyric/497579/Enya/Aldebaran,"['International', 'New Age', 'Pop/Rock']",3:07,"['atmospheric', 'circular', 'dramatic', 'dreamy', 'elegant', 'ethereal', 'gentle', 'hypnotic']",Aldebaran,https://www.allmusic.com/song/aldebaran-mt0035133404
40,Enya,circular,Only Time: The Collection,/album/only-time-the-collection-mw0000227416,"Hi-ra-U-O
Beo go deo. 

Ole ole ole,
Ole ole ole ole ole ole ole,
Ole ole ole,
Ole ole ole. 

Hi-ri-U-O
Marbh go deo.
",/lyric/1544567/Enya/March+of+the+Celts,"['International', 'New Age', 'Pop/Rock']",3:17,"['atmospheric', 'circular', 'dramatic', 'dreamy', 'elegant', 'ethereal', 'gentle', 'hypnotic']",March of the Celts,https://www.allmusic.com/song/march-of-the-celts-mt0013153458
41,Enya,circular,Only Time: The Collection,/album/only-time-the-collection-mw0000227416,"Strange how my heart beats 
To find myself upon your shore. 
Strange how I still feel 
My loss of comfort gone before. 
Cool waves wash over 
And drift away with dreams of youth 
So time is stolen 
I cannot hold you long enough. 
And so this is where I should be now 

Days and nights falling by 
Days and nights falling by me. 
I know of a dream I should be holding 
Days and nights falling by 
Days and nights falling by me. 

Cool waves wash over 
And drift away with reams of youth 
So time is stolen 
I cannot hold you long enough. 
Soft blue horizons 
Reach far into my childhood days 
As you are rising 
To bring me my forgotten ways 

Strange how I falter 
To find I'm standing in deep water 
Strange how my heart beats 
To find I'm standing on your shore 
",/lyric/1544555/Enya/On+Your+Shore,"['International', 'New Age', 'Pop/Rock']",4:01,"['atmospheric', 'circular', 'dramatic', 'dreamy', 'elegant', 'ethereal', 'gentle', 'hypnotic']",On Your Shore,https://www.allmusic.com/song/on-your-shore-mt0013154024
42,Enya,circular,Only Time: The Collection,/album/only-time-the-collection-mw0000227416,"Cursum perficio 
Cursum perficio 
Cursum perficio 
Cursum perficio 
Cursum perficio 

Verbum sapienti (eo plus cupiunt) 
Verbum sapienti 
Quo plus habent, eo plus cupiunt 
Verbum sapienti 
Quo plus habent, eo plus cupiunt 

Post nubila, Phoebus 
Post nubila, Phoebus 
Post nubila, Phoebus 

Quo plus habent, eo plus cupiunt 
Quo plus habent, eo plus cupiunt 
Quo plus habent, eo plus cupiunt 

Post nubila, Phoebus 
Post nubila, Phoebus 
Post nubila, Phoebus 
Post nubila, Phoebus 
Post nubila, Phoebus 
Post nubila, Phoebus 

Iternum 
Iternum 
Iternum",/lyric/1544554/Enya/Cursum+Perficio,"['International', 'New Age', 'Pop/Rock']",4:08,"['atmospheric', 'circular', 'dramatic', 'dreamy', 'elegant', 'hypnotic', 'lush', 'pastoral']",Cursum Perficio,https://www.allmusic.com/song/cursum-perficio-mt0013148605
43,Enya,circular,Only Time: The Collection,/album/only-time-the-collection-mw0000227416,"Cá fhad é ó 
Cá fhad é ó 
Siúl tríd na stoirmeacha. 
Dul tríd na stoirmeacha. 
Cá fhad é ó 
an tús don stoirm. 
Cá fhad é ó 
an tús go deireadh. 

Tóg do Chroí. 
Siúl tríd na stoirmeacha. 
Tóg do chroísa. 
Dul tríd na stoirmeacha. 

Turas mór. 
Tor tríd na Stoirmeacha. 
Turas fada. 
Amharc tríd na Stoirmeacha
",/lyric/1162061/Enya/Storms+in+Africa,"['International', 'New Age', 'Pop/Rock']",4:04,"['atmospheric', 'circular', 'dramatic', 'dreamy', 'elegant', 'ethereal', 'gentle', 'hypnotic']",Storms in Africa,https://www.allmusic.com/song/storms-in-africa-mt0013163558
44,Enya,circular,Only Time: The Collection,/album/only-time-the-collection-mw0000227416,"Hi-ri, Hi-ro, Hi-ri.
Hoireann is O, ha hi, ra ha, ra ho ra.
Hoireann is O, ha hi, ra ha, ra ha ra.
Hi-ri, Hi-ra, Hi-ri.

Saol na saol,
Tús go deireadh.
Tá muid beo
Go deo.

Saol na saol,
Tús go deireadh.
Tá muid beo
Go deo.

Hi-ri, Hi-ra, Hi-ri,
Hoireann is O, ho hi, ra ha, ra ha ra.",/lyric/622755/Enya/The+Celts,"['International', 'New Age', 'Pop/Rock']",2:58,"['atmospheric', 'circular', 'complex', 'dreamy', 'elegant', 'gentle', 'hypnotic', 'light']",The Celts,https://www.allmusic.com/song/the-celts-mt0013127023
45,Enya,circular,Only Time: The Collection,/album/only-time-the-collection-mw0000227416,"Dawn breaks, there is blue in the sky.
Your face before me
Though I don't know why.
Thoughts disappearing like tears from the Moon. 

Waiting here, as I sit by the stone,
They came before me
Those men from the Sun.
Signs from the heavens say I am the one. 
 
Now you're here, I can see your light,
This light that I must follow.
You, you may take my life away, so far away.
Now I know I must leave your spell
I want tomorrow. 

Now you're here, I can see your light,
This light that I must follow.
You, you may take my life away, so far away.
Now I know I must leave your spell
I want tomorrow.",/lyric/360862/Enya/I+Want+Tomorrow,"['International', 'New Age', 'Pop/Rock']",4:01,"['atmospheric', 'circular', 'dramatic', 'dreamy', 'elegant', 'ethereal', 'gentle', 'hypnotic']",I Want Tomorrow,https://www.allmusic.com/song/i-want-tomorrow-mt0013151777
46,Enya,circular,Only Time: The Collection,/album/only-time-the-collection-mw0000227416,"Let me sail, let me sail, let the Orinoco flow,
Let me reach, let me beach on the shores of Tripoli.
Let me sail, let me sail, let me crash upon your shore,
Let me reach, let me beach far beyond the Yellow Sea.

From Bissau to Palau,  in the shade of Avalon,
From Fiji to Tiree and the Isles of Ebony,
From Peru to Cebu hear the power of Babylon,
From Bali to Cali, far beneath the Coral Sea.

From the North to the South, Ebudae into Khartoum,
From the deep sea of Clouds to the island of the moon,
Carry me on the waves to the lands I've never been,
Carry me on the waves to the lands I've never seen.

We can sail, we can sail
We can steer, we can near with Rob Dickins at the wheel,
We can sigh, say goodbye Ross and his dependencies
We can sail, we can sail",/lyric/5913641/Enya/Orinoco+Flow+%5BSail+Away%5D,"['International', 'New Age', 'Pop/Rock']",4:28,"['atmospheric', 'circular', 'complex', 'dreamy', 'elegant', 'gentle', 'hypnotic', 'light']",Orinoco Flow [Sail Away],https://www.allmusic.com/song/orinoco-flow-sail-away-mt0013151103
47,Enya,circular,Only Time: The Collection,/album/only-time-the-collection-mw0000227416,"Eww harlay eyuwee heewah oohah sharlay marc toh cheeteeh woodenuh.
Aran doi dig coh hoh partenuh ooh lee ah ooh harlorh.
Eww harlay eyuwee heewah oohah harlay mwahnee kahah montenah.
Ooh de keewah! Ooh de keewah!
Oohnah li ansai angrass de la ooh hoo lee ah ooh harlorh.

Ahh

Amharc, mn ag obair l ‘s mall san och’,
Ceolann siad ar laetha geal, a bh,
Bealach fada annon ‘s anall a choch’.

Ahh

Eww harlay eyuwee heewah oohah harlay wooneenchi doidig dohtenuh, dohtenuh, dohtenuh
Ooh de keewah!
Woohnah wui an jaeshah woodenuh ooh lee ah ooh harlorh.
Eww harlay eyuwee heewah oohah sharlay marc toh cheeteeh woodenuh.
Ooh de keewah! Ooh de keewah!
Aran doi dig coh hoh partenuh ooh lee ah ooh harlorh.
Ooh, eww harlay eyuwee heewah oohah
Ooh, li ah, kahah montenah.",/lyric/145813/Enya/Ebudae,"['International', 'New Age', 'Pop/Rock']",1:56,"['atmospheric', 'circular', 'complex', 'dramatic', 'dreamy', 'elegant', 'gentle', 'hypnotic']",Ebudae,https://www.allmusic.com/song/ebudae-mt0026834014
48,Enya,circular,Only Time: The Collection,/album/only-time-the-collection-mw0000227416,"Ai! laurie lantar lassi surinen,
yeni unotime ve ramar aldaron!
yeni ve linte...

'Alas! golden leaves fall in the wind,
long years numberless as [the] wings of trees!
Long years like swift...'

Verse 2

Et Earello Endorenna utulien.
Sinome maruvan ar Hildinyar tenn' Ambar-metta!

'Out of the Great Sea to Middle-earth I am come.
In this place I will abide, and my heirs, unto the ending of the world'",/lyric/5224602/Enya/The+Great+River,"['International', 'New Age', 'Pop/Rock']",3:12,"['atmospheric', 'circular', 'dramatic', 'dreamy', 'elegant', 'ethereal', 'gentle', 'hypnotic']",River,https://www.allmusic.com/song/river-mt0013141236
