,Unnamed: 0,album_artist,album_mood,album_title,allmusic_href,lyrics,lyrics(normalized_no_stopwords),lyrics(normalized_with_stopwords),lyrics_href,track_genres,track_length,track_moods,track_title,track_url
11,11,Michael Bublé,brassy,Michael Bublé,/album/michael-bubl%C3%A9-mw0000592979,"You are far
When I could have been your star
You listened to people
Who scared you to death
And from my heart
Strange that you were strong enough
To even make a start
You?ll never find
Peace of mind
Till you listen to your heart

People
You can never change the way they feel
Better let them do just what they will
For they will
If you let them
Steal your heart from you
People
Will always make a lover feel a fool
But you knew I loved you
We could have shown them all
We should have seen love through

Fooled me with the tears in your eyes
Covered me with kisses and lies
So far
But please don?t take my heart

You are far
I?m never gonna be your star
I?ll pick up the pieces
To mend my heart
Strange that I was wrong enough
To think you?d love me too
You must have been kissing a fool
I said you must have been kissing a fool

But remember this
Every other kiss
That you?ll ever give
Long as we both live
When you need the hand of another man
One you really can surrender with
I will wait for you
Like I always do
There?s something there
That can?t compare with any other

You are far
When I could have been your star
You listened to people
Who scared you to death
And from my heart
Strange that I was wrong enough
To think you?d love me too
You must have been kissing a fool
You must have been kissing a fool
You must have been kissing a fool",far could star listen people scar death heart strange strong enough even make start never find peace mind till listen heart people never change way feel better let let steal heart people always make lover feel fool know love could show see love fool tear eye cover kiss lie far please not take heart far never go star ill pick piece mend heart strange wrong enough think would love must kiss fool say must kiss fool remember every kiss ever give long live need hand another man one really surrender wait like always something not compare far could star listen people scar death heart strange wrong enough think would love must kiss fool must kiss fool must kiss fool,you be far when i could have be your star you listen to people who scar you to death and from my heart strange that you be strong enough to even make a start you will never find peace of mind till you listen to your heart people you can never change the way they feel better let them do just what they will for they will if you let them steal your heart from you people will always make a lover feel a fool but you know i love you we could have show them all we should have see love through fool me with the tear in your eye cover me with kiss and lie so far but please do not take my heart you be far i be never go to be your star ill pick up the piece to mend my heart strange that i be wrong enough to think you would love me too you must have be kiss a fool i say you must have be kiss a fool but remember this every other kiss that you will ever give long as we both live when you need the hand of another man one you really can surrender with i will wait for you like i always do there s something there that can not compare with any other you be far when i could have be your star you listen to people who scar you to death and from my heart strange that i be wrong enough to think you would love me too you must have be kiss a fool you must have be kiss a fool you must have be kiss a fool,/lyric/6053479/Michael+Bubl%C3%A9/Kissing+a+Fool,"['Vocal', 'Pop/Rock', 'Jazz']",4:36,"['smooth', 'stylish', 'confident', 'dramatic', 'lush', 'sophisticated', 'theatrical', 'brassy']",Kissing a Fool,https://www.allmusic.com/song/kissing-a-fool-mt0008267896
12,12,Michael Bublé,brassy,Michael Bublé,/album/michael-bubl%C3%A9-mw0000592979,"For once in my life I have someone who needs me
Someone I?ve needed so long
For once unafraid I can go where life leads me and somehow I know I?ll be strong

For once I can touch what my heart used to dream of
Long before I knew
Someone warm like you
Who have my dreams come true

For once in my life I won't let sorrow hurt me
Not like it's hurt me before

For once I have someone I know won't desert me
I?m not alone anymore

For once I can say 
This is mine you can?t take it
As long as I know I have love I can make it
For once in my life I have someone who needs me

For once I can say
This is mine you can?t take it

As long as I know I have love we can make it
For once in my life I have someone who needs me",life someone need someone need long unafraid go life lead somehow know ill strong touch heart use dream long know someone warm like dream come true life not let sorrow hurt not like hurt someone know not desert not alone anymore say mine not take long know love make life someone need say mine not take long know love make life someone need,for once in my life i have someone who need me someone i have need so long for once unafraid i can go where life lead me and somehow i know ill be strong for once i can touch what my heart use to dream of long before i know someone warm like you who have my dream come true for once in my life i will not let sorrow hurt me not like it be hurt me before for once i have someone i know will not desert me i be not alone anymore for once i can say this be mine you can not take it as long as i know i have love i can make it for once in my life i have someone who need me for once i can say this be mine you can not take it as long as i know i have love we can make it for once in my life i have someone who need me,/lyric/6053480/Michael+Bubl%C3%A9/For+Once+in+My+Life,"['Vocal', 'Pop/Rock', 'Jazz']",2:34,"['smooth', 'stylish', 'confident', 'dramatic', 'lush', 'sophisticated', 'theatrical', 'brassy']",For Once in My Life,https://www.allmusic.com/song/for-once-in-my-life-mt0007281371
13,13,Michael Bublé,brassy,Michael Bublé,/album/michael-bubl%C3%A9-mw0000592979,"The summer wind, came blowin' in - from across the sea
It lingered there, so warm and fair - to walk with me
All summer long, we sang a song - and strolled on golden sand
Two sweethearts, and the summer wind

Like painted kites, those days and nights - went flyin' by
The world was new, beneath a blue - umbrella sky
Then softer than, a piper man - one day it called to you
And I lost you, to the summer wind

The autumn wind, and the winter wind - have come and gone
And still the days, those lonely days - go on and on
And guess who sighs his lullabies - through nights that never end
My fickle friend, the summer wind",summer wind come blowin across sea linger warm fair walk summer long sing song stroll golden sand two sweetheart summer wind like paint kite day night go flyin world new beneath blue umbrella sky soft piper man one day call lose summer wind autumn wind winter wind come go still day lonely day go guess sigh lullaby night never end fickle friend summer wind,the summer wind come blowin in from across the sea it linger there so warm and fair to walk with me all summer long we sing a song and stroll on golden sand two sweetheart and the summer wind like paint kite those day and night go flyin by the world be new beneath a blue umbrella sky then soft than a piper man one day it call to you and i lose you to the summer wind the autumn wind and the winter wind have come and go and still the day those lonely day go on and on and guess who sigh his lullaby through night that never end my fickle friend the summer wind,/lyric/6053482/Michael+Bubl%C3%A9/Summer+Wind,"['Vocal', 'Pop/Rock', 'Jazz']",2:56,"['smooth', 'stylish', 'confident', 'lush', 'sophisticated', 'brassy', 'exuberant', 'intimate']",Summer Wind,https://www.allmusic.com/song/summer-wind-mt0009134297
14,14,Michael Bublé,brassy,Michael Bublé,/album/michael-bubl%C3%A9-mw0000592979,"This thing called love I just can't handle it
This thing called love I must get round to it
I ain't ready
Crazy little thing called love

This thing (this thing)
Called love (called love)
It cries (like a baby)
In a cradle all night
It swings (woo woo)
It jives (woo woo)
It shakes all over like a jelly fish
I kinda like it
Crazy little thing called love

There goes my baby
She knows how to rock 'n' roll
She drives me crazy
She gives me hot and cold fever
Then she leaves me in a cool cool sweat

I gotta be cool, relax, get hip
And get on my track's
Take a back seat, hitch-hike
And take a long ride on my motorbike
Until I'm ready
Crazy little thing called love

I gotta be cool, relax, get hip
And get on my track's
Take a back seat (ah hum), hitch-hike (ah hum)
And take a long ride on my motorbike
Until I'm ready (ready Freddie)
Crazy little thing called love

This thing called love I just can't handle it
This thing called love I must get round to it
I ain't ready
Ooh ooh ooh ooh

Crazy little thing called love",thing call love not handle thing call love must get round not ready crazy little thing call love thing thing call love call love cry like baby cradle night swing woo woo jive woo woo shake like jelly fish kinda like crazy little thing call love go baby know rock n roll drive crazy give hot cold fever leave cool cool sweat get cool relax get hip get track take back seat hitch hike take long ride motorbike ready crazy little thing call love get cool relax get hip get track take back seat ah hum hitch hike ah hum take long ride motorbike ready ready freddie crazy little thing call love thing call love not handle thing call love must get round not ready ooh ooh ooh ooh crazy little thing call love,this thing call love i just can not handle it this thing call love i must get round to it i as not ready crazy little thing call love this thing this thing call love call love it cry like a baby in a cradle all night it swing woo woo it jive woo woo it shake all over like a jelly fish i kinda like it crazy little thing call love there go my baby she know how to rock n roll she drive me crazy she give me hot and cold fever then she leave me in a cool cool sweat i get to be cool relax get hip and get on my track take a back seat hitch hike and take a long ride on my motorbike until i be ready crazy little thing call love i get to be cool relax get hip and get on my track take a back seat ah hum hitch hike ah hum and take a long ride on my motorbike until i be ready ready freddie crazy little thing call love this thing call love i just can not handle it this thing call love i must get round to it i as not ready ooh ooh ooh ooh crazy little thing call love,/lyric/6085869/Michael+Bubl%C3%A9/Crazy+Little+Thing+Called+Love,"['Vocal', 'Pop/Rock', 'Jazz']",3:11,"['stylish', 'confident', 'smooth', 'swaggering', 'theatrical', 'brassy', 'celebratory', 'cheerful']",Crazy Little Thing Called Love,https://www.allmusic.com/song/crazy-little-thing-called-love-mt0007498230
15,15,Michael Bublé,brassy,Michael Bublé,/album/michael-bubl%C3%A9-mw0000592979,"Hold me in your arms, baby
Squeeze me oh so tight
Show me that you love me too.

Put your lips next to mine, dear
Won't you kiss me once, baby
Just a kiss good-night
Maybe you and I will fall in love.

People say that love's a game
A game you just can't win.
If there's a way
I'll find it some day
And then this fool will rush in.

Put your head on my shoulder
Whisper in my ear baby
Words I want to hear tell me
Tell me that you love me too.

Put your head on my shoulder
Whisper in my ear baby
Put your head on my shoulder.",hold arm baby squeeze oh tight show love put lip next mine dear not kiss baby kiss good night maybe fall love people say love game game not win way find day fool rush put head shoulder whisper ear baby word want hear tell tell love put head shoulder whisper ear baby put head shoulder,hold me in your arm baby squeeze me oh so tight show me that you love me too put your lip next to mine dear will not you kiss me once baby just a kiss good night maybe you and i will fall in love people say that love a game a game you just can not win if there be a way i will find it some day and then this fool will rush in put your head on my shoulder whisper in my ear baby word i want to hear tell me tell me that you love me too put your head on my shoulder whisper in my ear baby put your head on my shoulder ,/lyric/6053485/Michael+Bubl%C3%A9/Put+Your+Head+on+My+Shoulder,"['Vocal', 'Jazz', 'Pop/Rock']",4:27,"['brassy', 'playful', 'sentimental', 'smooth', 'carefree', 'fun', 'stylish', 'cheerful']",Put Your Head on My Shoulder,https://www.allmusic.com/song/put-your-head-on-my-shoulder-mt0007515314
16,16,Michael Bublé,brassy,Michael Bublé,/album/michael-bubl%C3%A9-mw0000592979,"When marimba rhythms start to play
Dance with me, make me sway
Like a lazy ocean hugs the shore
Hold me close, sway me more

Like a flower bending in the breeze
Bend with me, sway with ease
When we dance you have a way with me
Stay with me, sway with me

Other dancers may be on the floor
Dear, but my eyes will see only you
Only you have that magic technique
When we sway I go weak

I can hear the sounds of violins
Long before it begins
Make me thrill as only you know how
Sway me smooth, sway me now

Other dancers may be on the floor
Dear, but my eyes will see only you
Only you have that magic technique
When we sway I go weak

I can hear the sounds of violins
Long before it begins
Make me thrill as only you know how
Sway me smooth, sway me now

When marimba rhythms start to play
Dance with me, make me sway
Like a lazy ocean hugs the shore
Hold me close, sway me more

Like a flower bending in the breeze
Bend with me, sway with ease
When we dance you have a way with me
Stay with me, sway with me

When marimba rhythms start to play
Hold me close, make me sway
Like a lazy ocean hugs the shore
Hold me close, sway me more

Like a flower bending in the breeze
Bend with me, sway with ease
When we dance you have a way with me
Stay with me, sway with me",marimba rhythm start play dance make sway like lazy ocean hug shore hold close sway like flower bend breeze bend sway ease dance way stay sway dancer may floor dear eye see magic technique sway go weak hear sound violin long begin make thrill know sway smooth sway dancer may floor dear eye see magic technique sway go weak hear sound violin long begin make thrill know sway smooth sway marimba rhythm start play dance make sway like lazy ocean hug shore hold close sway like flower bend breeze bend sway ease dance way stay sway marimba rhythm start play hold close make sway like lazy ocean hug shore hold close sway like flower bend breeze bend sway ease dance way stay sway,when marimba rhythm start to play dance with me make me sway like a lazy ocean hug the shore hold me close sway me more like a flower bend in the breeze bend with me sway with ease when we dance you have a way with me stay with me sway with me other dancer may be on the floor dear but my eye will see only you only you have that magic technique when we sway i go weak i can hear the sound of violin long before it begin make me thrill as only you know how sway me smooth sway me now other dancer may be on the floor dear but my eye will see only you only you have that magic technique when we sway i go weak i can hear the sound of violin long before it begin make me thrill as only you know how sway me smooth sway me now when marimba rhythm start to play dance with me make me sway like a lazy ocean hug the shore hold me close sway me more like a flower bend in the breeze bend with me sway with ease when we dance you have a way with me stay with me sway with me when marimba rhythm start to play hold me close make me sway like a lazy ocean hug the shore hold me close sway me more like a flower bend in the breeze bend with me sway with ease when we dance you have a way with me stay with me sway with me,/lyric/6053486/Michael+Bubl%C3%A9/Sway,"['Vocal', 'Pop/Rock', 'Jazz']",3:09,"['stylish', 'confident', 'dramatic', 'sophisticated', 'theatrical', 'brassy', 'exuberant', 'sexy']",Sway,https://www.allmusic.com/song/sway-mt0008268398
17,17,Michael Bublé,brassy,Michael Bublé,/album/michael-bubl%C3%A9-mw0000592979,"Come fly with me, let's fly let's fly away
If you can use some exotic booze
There's a bar in far Bombay
Come fly with me, let's fly let's fly away

Come fly with me, let's float down to Peru
In lama land, there's a one man band
And he'll toot his flute for you
Come fly with me, let's take off in the blue

Once I get you up there,
Where the air is rarefied
We'll just glide
Starry eyed
Once I get you up there
I'll be holding you so near
You may hear the angels cheer
Just because we're together

Weather wise it's such a lovely day
Just say the words, and we'll beat the birds
Down to Acapulco bay
It's perfect, for a flying honeymoon, they say
Come fly with me
Let's fly, let's fly away

Once I get you up there,
Where the air is rarefied
We'll just glide
Starry eyed
Once I get you up there
I'll be holding you so near
You may hear all the angels cheer
Just because we're together

Weather wise it's such a lovely day
You just say the words, and I'll beat the birds
Down to Acapulco bay
It's perfect, for a flying honeymoon, they say
Come fly with me
Let's fly, let's fly away
Pack up let's fly away",come fly let us fly let us fly away use exotic booze bar far bombay come fly let us fly let us fly away come fly let us float peru lama land one man band toot flute come fly let us take blue get air rarefy glide starry eyed get hold near may hear angel cheer together weather wise lovely day say word beat bird acapulco bay perfect flying honeymoon say come fly let us fly let us fly away get air rarefy glide starry eyed get hold near may hear angel cheer together weather wise lovely day say word beat bird acapulco bay perfect flying honeymoon say come fly let us fly let us fly away pack let us fly away,come fly with me let us fly let us fly away if you can use some exotic booze there be a bar in far bombay come fly with me let us fly let us fly away come fly with me let us float down to peru in lama land there be a one man band and he will toot his flute for you come fly with me let us take off in the blue once i get you up there where the air be rarefy we will just glide starry eyed once i get you up there i will be hold you so near you may hear the angel cheer just because we be together weather wise it be such a lovely day just say the word and we will beat the bird down to acapulco bay it be perfect for a flying honeymoon they say come fly with me let us fly let us fly away once i get you up there where the air be rarefy we will just glide starry eyed once i get you up there i will be hold you so near you may hear all the angel cheer just because we be together weather wise it be such a lovely day you just say the word and i will beat the bird down to acapulco bay it be perfect for a flying honeymoon they say come fly with me let us fly let us fly away pack up let us fly away,/lyric/6053488/Michael+Bubl%C3%A9/Come+Fly+With+Me,"['Vocal', 'Pop/Rock', 'Jazz']",3:20,"['smooth', 'stylish', 'confident', 'lush', 'sophisticated', 'brassy', 'exuberant', 'fun']",Come Fly With Me,https://www.allmusic.com/song/come-fly-with-me-mt0007397847
18,18,Michael Bublé,brassy,Michael Bublé,/album/michael-bubl%C3%A9-mw0000592979,"I can only give you love that lasts forever, 
And a promise to be near each time you call. 
And the only heart I own 
For you and you alone 
That's all, 
That's all... 

I can only give you country walks in springtime 
And a hand to hold when leaves begin to fall;
And a love whose burning light 
Will warm the winter's night 
That's all, 
That's all. 

There are those I am sure who have told you, 
They would give you the world for a toy. 
All I have are these arms to enfold you, 
And a love even time can't destroy. 

If you're wondering what I'm asking in return, dear, 
You'll be glad to know that my demands are small. 
Say it's me that you'll adore, 
For now and evermore 
That's all, 
That's all.",give love last forever promise near time call heart alone give country walk springtime hand hold leaf begin fall love whose burn light warm winter night sure tell would give world toy arm enfold love even time not destroy wonder ask return dear glad know demand small say adore evermore,i can only give you love that last forever and a promise to be near each time you call and the only heart i own for you and you alone that be all that be all i can only give you country walk in springtime and a hand to hold when leaf begin to fall and a love whose burn light will warm the winter night that be all that be all there be those i be sure who have tell you they would give you the world for a toy all i have be these arm to enfold you and a love even time can not destroy if you be wonder what i be ask in return dear you will be glad to know that my demand be small say it be me that you will adore for now and evermore that be all that be all ,/lyric/6053489/Michael+Bubl%C3%A9/That%27s+All,"['Vocal', 'Pop/Rock', 'Jazz']",4:01,"['smooth', 'stylish', 'confident', 'brassy', 'exuberant', 'intimate', 'amiable/good-natured', 'sentimental']",That's All,https://www.allmusic.com/song/thats-all-mt0007420626
19,19,Aerosmith,brassy,Permanent Vacation,/album/permanent-vacation-mw0000192978,"Met a woman, she had a man
Couldn't help it, I had a plan
Right around midnight he was gone
Saw her red light, she left it on
And oh my heart's done time
And oh, now she's mine
If there's a reason for these chains
It's like we suffer to ease the pain
Now I got this feelin' inside of me
My heart's in jail and I can't break free
And oh my heart's done time
And oh now she's mine
Now she's mine
Now she's mine
Now she's mine
Now she's mine
And oh my heart's done time
And oh now she's mine
Now she's mine
Now she's mine
Now she's mine",meet woman man could not help plan right around midnight go see red light leave oh heart time oh mine reason chain like suffer ease pain get feelin inside heart jail not break free oh heart time oh mine mine mine mine mine oh heart time oh mine mine mine mine,meet a woman she have a man could not help it i have a plan right around midnight he be go see her red light she leave it on and oh my heart do time and oh now she be mine if there be a reason for these chain it be like we suffer to ease the pain now i get this feelin inside of me my heart in jail and i can not break free and oh my heart do time and oh now she be mine now she be mine now she be mine now she be mine now she be mine and oh my heart do time and oh now she be mine now she be mine now she be mine now she be mine,/lyric/229325/Aerosmith/Heart%27s+Done+Time,['Pop/Rock'],4:41,"['brassy', 'campy', 'cynical/sarcastic', 'energetic', 'exuberant', 'fun', 'humorous', 'irreverent']",Heart's Done Time,https://www.allmusic.com/song/hearts-done-time-mt0036154996
