,Unnamed: 0,album_artist,album_mood,album_title,allmusic_href,lyrics,lyrics(normalized_no_stopwords),lyrics(normalized_with_stopwords),lyrics_href,track_genres,track_length,track_moods,track_title,track_url
0,0,Cher,brassy,The Greatest Hits,/album/the-greatest-hits-mw0000461223,"If I could turn back time
If I could find a way
I'd take back those words that'll hurt you and you'd stay
I don't know why I did the things I did
I don't know why I said the things I said
Love's like a knife it can cut deep inside
Words are like weapons, they wound sometimes

I didn't really mean to hurt you
I didn't want to see you go
I know I made you cry, but baby

If I could turn back time
If I could find a way
I'd take back those words that'd hurt you
And you'd stay
If I could reach the stars
I'd give 'em all to you
Then you'd love me, love me, like you used to do
If I could turn back time

My world was shattered I was torn apart
Like someone took a knife and drove it deep in my heart
You walked out that door I swore that I didn't care
But I lost everything darling then and there

Too strong to tell you I was sorry
Too proud to tell you I was wrong
I know that I was blind,
And darling

If I could turn back time
If I could find a way
I'd take back those words that'll hurt you
And you'd stay
If I could reach the stars
I'd give them all to you
Then you'd love me, love me, like you used to do, oh

If I could turn back time
If I could turn back time
If I could turn back time, whoa baby

I didn't really mean to hurt you
I didn't want to see you go
I know I made you cry, but baby

If I could turn back time
If I could find a way
I'd take back those words that hurt you
If I could reach the stars
I'd give 'em all to you
Then you'd love me, love me, like you used to do

If I could turn back time
If I could find a way
Then maybe, maybe, maybe
You'd stay
(Reach the stars) If I could reach the stars
(All to you) I'd give 'em all to you",could turn back time could find way would take back word hurt would stay not know thing not know say thing say love like knife cut deep inside word like weapon wound sometimes not really mean hurt not want see go know make cry baby could turn back time could find way would take back word would hurt would stay could reach star would give em would love love like use could turn back time world shatter tear apart like someone take knife drive deep heart walk door swear not care lose everything darling strong tell sorry proud tell wrong know blind darling could turn back time could find way would take back word hurt would stay could reach star would give would love love like use oh could turn back time could turn back time could turn back time whoa baby not really mean hurt not want see go know make cry baby could turn back time could find way would take back word hurt could reach star would give em would love love like use could turn back time could find way maybe maybe maybe would stay reach star could reach star would give em,if i could turn back time if i could find a way i would take back those word that will hurt you and you would stay i do not know why i do the thing i do i do not know why i say the thing i say love like a knife it can cut deep inside word be like weapon they wound sometimes i do not really mean to hurt you i do not want to see you go i know i make you cry but baby if i could turn back time if i could find a way i would take back those word that would hurt you and you would stay if i could reach the star i would give em all to you then you would love me love me like you use to do if i could turn back time my world be shatter i be tear apart like someone take a knife and drive it deep in my heart you walk out that door i swear that i do not care but i lose everything darling then and there too strong to tell you i be sorry too proud to tell you i be wrong i know that i be blind and darling if i could turn back time if i could find a way i would take back those word that will hurt you and you would stay if i could reach the star i would give them all to you then you would love me love me like you use to do oh if i could turn back time if i could turn back time if i could turn back time whoa baby i do not really mean to hurt you i do not want to see you go i know i make you cry but baby if i could turn back time if i could find a way i would take back those word that hurt you if i could reach the star i would give em all to you then you would love me love me like you use to do if i could turn back time if i could find a way then maybe maybe maybe you would stay reach the star if i could reach the star all to you i would give em all to you,/lyric/27566382/Cher/If+I+Could+Turn+Back+Time+%5BAlbum+Version%5D,['Pop/Rock'],3:59,"['dramatic', 'sentimental', 'theatrical', 'passionate', 'reflective', 'romantic', 'stylish', 'brassy']",If I Could Turn Back Time,https://www.allmusic.com/song/if-i-could-turn-back-time-mt0031707139
1,1,Cher,brassy,The Greatest Hits,/album/the-greatest-hits-mw0000461223,"Beneath the white fire of the moon 
Love's wings are broken all too soon 
We never learn 
Hurt together, hurt alone 
Don't you sometimes 

Wish your heart was a heart of stone 
We turn the wheel, and break the chain 
Put steel to steel, and laugh at pain 
We're dreamers in castle's made of sand 
The road to Eden's overgrown 

Don't you sometimes 
Wish your heart was a heart of stone 
Look at the headlines 
Big crowd at the crazy house 
Long cue for the joker's shoe 
Ten rounds in the ring with love 
Do you lose and win 

Or win and lose 
Sweet rain, like mercy in the night 
(Lay me down, wash away the sorrow) 
Caress my soul and set it right 
(Lay me down, show me your tomorrow) 
Summer tears, winter and the moment's flown 

Don't you sometimes 
Wish your heart was a heart of stone 
Mercy, mercy, wish your heart was a heart of stone 

Get the picture 
No room for the innocent 
Peak season in lonely town 
Knocked out of the ring by love 
Are you down and up 

Or up and down 
I ask the river for a sign 
(In a dream, we go on together) 
How long is love supposed to shine 
(In a dream, diamonds are forever 
But you and I, hurt together, hurt alone 

Don't you sometimes 
Wish you heart was a heart of stone 
Mercy, mercy, wish your heart was a heart of stone 
(With a heart of stone, you'll be well protected) 

Don't you sometimes 
Wish your heart was made of stone 
(With a heart of stone, you'll be well connected)",beneath white fire moon love wing break soon never learn hurt together hurt alone not sometimes wish heart heart stone turn wheel break chain put steel steel laugh pain dreamer castle make sand road edens overgrown not sometimes wish heart heart stone look headline big crowd crazy house long cue joker shoe ten round ring love lose win win lose sweet rain like mercy night lie wash away sorrow caress soul set right lie show tomorrow summer tear winter moment fly not sometimes wish heart heart stone mercy mercy wish heart heart stone get picture no room innocent peak season lonely town knock ring love ask river sign dream go together long love suppose shine dream diamond forever hurt together hurt alone not sometimes wish heart heart stone mercy mercy wish heart heart stone heart stone well protect not sometimes wish heart make stone heart stone well connect,beneath the white fire of the moon love wing be break all too soon we never learn hurt together hurt alone do not you sometimes wish your heart be a heart of stone we turn the wheel and break the chain put steel to steel and laugh at pain we be dreamer in castle make of sand the road to edens overgrown do not you sometimes wish your heart be a heart of stone look at the headline big crowd at the crazy house long cue for the joker shoe ten round in the ring with love do you lose and win or win and lose sweet rain like mercy in the night lie me down wash away the sorrow caress my soul and set it right lie me down show me your tomorrow summer tear winter and the moment fly do not you sometimes wish your heart be a heart of stone mercy mercy wish your heart be a heart of stone get the picture no room for the innocent peak season in lonely town knock out of the ring by love be you down and up or up and down i ask the river for a sign in a dream we go on together how long be love suppose to shine in a dream diamond be forever but you and i hurt together hurt alone do not you sometimes wish you heart be a heart of stone mercy mercy wish your heart be a heart of stone with a heart of stone you will be well protect do not you sometimes wish your heart be make of stone with a heart of stone you will be well connect ,/lyric/164988/Cher/Heart+of+Stone,['Pop/Rock'],4:15,"['dramatic', 'theatrical', 'literate', 'passionate', 'reflective', 'rousing', 'stylish', 'brassy']",Heart of Stone,https://www.allmusic.com/song/heart-of-stone-mt0011658371
2,2,Cher,brassy,The Greatest Hits,/album/the-greatest-hits-mw0000461223,"You're struttin' into town like you're slingin' a gun
Just a small town dude with a big city attitude
Honey are you lookin' for some trouble tonight
Well alright

You think you're so bad, drive the women folk wild
Shoot 'em all down with the flash of your pearly smile
Honey but you met your match tonight
Oh, that's right

You think you'll knock me off my feet
'Til I'm flat on the floor
'Til my heart is cryin' Indian and I'm begin' for more
So come on baby
Come on baby
Come on baby show me what that loaded gun is for

If you can give it
I can take it
'Cause if this heart is gonna break it's gonna take a lot to break it
I know tonight
Somebody's gonna win the fight
So if you're so tough
Come on and prove it

Your heart is down for the count and you know you're gonna lose it
Tonight you're gonna go down in flames
Just like Jesse James

You're an outlaw lover and I'm after your hide
Well you ain't so strong, won't be long 'til your hands are tied
Tonight I'm gonna take you in
Dead or Alive
That's right

You break the laws of love in the name of desire
Take ten steps back
'Cause I'm ready baby
Aim and fire
Baby there's nowhere you gonna run tonight
Ooh That's right

Well you've had your way with love but it's the end of the day
Now a team of wild horses couldn't drag your heart away

So come on baby
Come on baby

Come on baby you know there ain't nothing left to say

If you can give it
I can take it
'Cause if this heart is gonna break it's gonna take a lot to break it
I know tonight
Somebody's gonna win the fight
So if you're so tough
Come on and prove it

Your heart is down for the count and you know you're gonna lose it
Tonight you're gonna go down in flames
Just like Jesse James

You think you'll knock me off my feet
'til I'm flat on the floor
'Til my heart is cryin' Indian and I'm begin' for more
So come on baby
Come on baby
Come on baby
Come on

If you can give it
I can take it
'Cause if this heart is gonna break it's gonna take a lot to break it

I know tonight
Somebody's gonna win the fight
So if you're so tough
Come on and prove it
Your heart is down for the count and you know you're gonna lose it
Tonight you're gonna go down in flames
Just like Jesse James
Tonight you're gonna go down in flames
Just like Jesse James
Tonight you're gonna go down in flames
Just like Jesse James

I'm gonna shoot ya down Jesse James",struttin town like slingin gun small town dude big city attitude honey lookin trouble tonight well alright think bad drive woman folk wild shoot em flash pearly smile honey meet match tonight oh right think knock foot til flat floor til heart cryin indian begin come baby come baby come baby show load gun give take ecause heart go break go take lot break know tonight somebody go win fight tough come prove heart count know go lose tonight go go flame like jesse james outlaw lover hide well not strong not long til hand tie tonight go take dead alive right break law love name desire take ten step back ecause ready baby aim fire baby nowhere go run tonight ooh right well way love end day team wild horse could not drag heart away come baby come baby come baby know not nothing leave say give take ecause heart go break go take lot break know tonight somebody go win fight tough come prove heart count know go lose tonight go go flame like jesse jame think knock foot til flat floor til heart cryin indian begin come baby come baby come baby come give take ecause heart go break go take lot break know tonight somebody go win fight tough come prove heart count know go lose tonight go go flame like jesse james tonight go go flame like jesse james tonight go go flame like jesse jame go shoot ya jesse jame,you be struttin into town like you be slingin a gun just a small town dude with a big city attitude honey be you lookin for some trouble tonight well alright you think you be so bad drive the woman folk wild shoot em all down with the flash of your pearly smile honey but you meet your match tonight oh that be right you think you will knock me off my foot til i be flat on the floor til my heart be cryin indian and i be begin for more so come on baby come on baby come on baby show me what that load gun be for if you can give it i can take it ecause if this heart be go to break it be go to take a lot to break it i know tonight somebody go to win the fight so if you be so tough come on and prove it your heart be down for the count and you know you be go to lose it tonight you be go to go down in flame just like jesse james you be an outlaw lover and i be after your hide well you as not so strong will not be long til your hand be tie tonight i be go to take you in dead or alive that be right you break the law of love in the name of desire take ten step back ecause i be ready baby aim and fire baby there be nowhere you go to run tonight ooh that be right well you have have your way with love but it be the end of the day now a team of wild horse could not drag your heart away so come on baby come on baby come on baby you know there as not nothing leave to say if you can give it i can take it ecause if this heart be go to break it be go to take a lot to break it i know tonight somebody go to win the fight so if you be so tough come on and prove it your heart be down for the count and you know you be go to lose it tonight you be go to go down in flame just like jesse jame you think you will knock me off my foot til i be flat on the floor til my heart be cryin indian and i be begin for more so come on baby come on baby come on baby come on if you can give it i can take it ecause if this heart be go to break it be go to take a lot to break it i know tonight somebody go to win the fight so if you be so tough come on and prove it your heart be down for the count and you know you be go to lose it tonight you be go to go down in flame just like jesse james tonight you be go to go down in flame just like jesse james tonight you be go to go down in flame just like jesse jame i be go to shoot ya down jesse jame,/lyric/1298679/Cher/Just+Like+Jesse+James,['Pop/Rock'],4:06,"['brassy', 'bravado', 'confident', 'dramatic', 'swaggering', 'theatrical', 'passionate', 'playful']",Just Like Jesse James,https://www.allmusic.com/song/just-like-jesse-james-mt0011664783
3,3,Bette Midler,brassy,The Rose [Original?,/album/the-rose-original-soundtrack-mw0000191650,"Some say love, it is a river, that drowns the tender reed
Some say love, it is a razor, that leaves your soul to bleed
Some say love, it is a hunger, an endless aching need
I say love, it is a flower, and you, its only seed

Its the heart afraid of breaking, that never learns to dance
Its the dream afraid of waking, that never takes the chance
Its the one who won't be taking, who cannot seem to give
And the soul afraid of dying, that never learns to live

When the night has been too lonely and the road has been too long
And you think that love is only for the lucky and the strong
Just remember in the winter, far beneath the bitter snows
Lies the seed, that with the sun's love in the spring becomes the rose",say love river drown tender reed say love razor leave soul bleed say love hunger endless ache need say love flower seed heart afraid break never learn dance dream afraid wake never take chance one not take not seem give soul afraid die never learn live night lonely road long think love lucky strong remember winter far beneath bitter snow lie seed sun love spring become rose,some say love it be a river that drown the tender reed some say love it be a razor that leave your soul to bleed some say love it be a hunger an endless ache need i say love it be a flower and you its only seed its the heart afraid of break that never learn to dance its the dream afraid of wake that never take the chance its the one who will not be take who can not seem to give and the soul afraid of die that never learn to live when the night have be too lonely and the road have be too long and you think that love be only for the lucky and the strong just remember in the winter far beneath the bitter snow lie the seed that with the sun love in the spring become the rose,/lyric/1169142/Bette+Midler/The+Rose,['Pop/Rock'],3:40,"['brassy', 'calm/peaceful', 'literate', 'passionate', 'sad', 'searching', 'self-conscious', 'somber']",The Rose,https://www.allmusic.com/song/the-rose-mt0003644083
4,4,Bette Midler,brassy,A Gift of Love,/album/a-gift-of-love-mw0002896730,"Some say love, it is a river, that drowns the tender reed
Some say love, it is a razor, that leaves your soul to bleed
Some say love, it is a hunger, an endless aching need
I say love, it is a flower, and you, its only seed

Its the heart afraid of breaking, that never learns to dance
Its the dream afraid of waking, that never takes the chance
Its the one who won't be taking, who cannot seem to give
And the soul afraid of dying, that never learns to live

When the night has been too lonely and the road has been too long
And you think that love is only for the lucky and the strong
Just remember in the winter, far beneath the bitter snows
Lies the seed, that with the sun's love in the spring becomes the rose",say love river drown tender reed say love razor leave soul bleed say love hunger endless ache need say love flower seed heart afraid break never learn dance dream afraid wake never take chance one not take not seem give soul afraid die never learn live night lonely road long think love lucky strong remember winter far beneath bitter snow lie seed sun love spring become rose,some say love it be a river that drown the tender reed some say love it be a razor that leave your soul to bleed some say love it be a hunger an endless ache need i say love it be a flower and you its only seed its the heart afraid of break that never learn to dance its the dream afraid of wake that never take the chance its the one who will not be take who can not seem to give and the soul afraid of die that never learn to live when the night have be too lonely and the road have be too long and you think that love be only for the lucky and the strong just remember in the winter far beneath the bitter snow lie the seed that with the sun love in the spring become the rose,/lyric/1169142/Bette+Midler/The+Rose,['Pop/Rock'],3:34,"['brassy', 'calm/peaceful', 'literate', 'passionate', 'sad', 'searching', 'self-conscious', 'somber']",The Rose,https://www.allmusic.com/song/the-rose-mt0052623256
5,5,Cher,brassy,The Very Best of Cher?,/album/the-very-best-of-cher-warner-bros-1-mw0000021651,"If I could turn back time
If I could find a way
I'd take back those words that'll hurt you and you'd stay
I don't know why I did the things I did
I don't know why I said the things I said
Love's like a knife it can cut deep inside
Words are like weapons, they wound sometimes

I didn't really mean to hurt you
I didn't want to see you go
I know I made you cry, but baby

If I could turn back time
If I could find a way
I'd take back those words that'd hurt you
And you'd stay
If I could reach the stars
I'd give 'em all to you
Then you'd love me, love me, like you used to do
If I could turn back time

My world was shattered I was torn apart
Like someone took a knife and drove it deep in my heart
You walked out that door I swore that I didn't care
But I lost everything darling then and there

Too strong to tell you I was sorry
Too proud to tell you I was wrong
I know that I was blind,
And darling

If I could turn back time
If I could find a way
I'd take back those words that'll hurt you
And you'd stay
If I could reach the stars
I'd give them all to you
Then you'd love me, love me, like you used to do, oh

If I could turn back time
If I could turn back time
If I could turn back time, whoa baby

I didn't really mean to hurt you
I didn't want to see you go
I know I made you cry, but baby

If I could turn back time
If I could find a way
I'd take back those words that hurt you
If I could reach the stars
I'd give 'em all to you
Then you'd love me, love me, like you used to do

If I could turn back time
If I could find a way
Then maybe, maybe, maybe
You'd stay
(Reach the stars) If I could reach the stars
(All to you) I'd give 'em all to you",could turn back time could find way would take back word hurt would stay not know thing not know say thing say love like knife cut deep inside word like weapon wound sometimes not really mean hurt not want see go know make cry baby could turn back time could find way would take back word would hurt would stay could reach star would give em would love love like use could turn back time world shatter tear apart like someone take knife drive deep heart walk door swear not care lose everything darling strong tell sorry proud tell wrong know blind darling could turn back time could find way would take back word hurt would stay could reach star would give would love love like use oh could turn back time could turn back time could turn back time whoa baby not really mean hurt not want see go know make cry baby could turn back time could find way would take back word hurt could reach star would give em would love love like use could turn back time could find way maybe maybe maybe would stay reach star could reach star would give em,if i could turn back time if i could find a way i would take back those word that will hurt you and you would stay i do not know why i do the thing i do i do not know why i say the thing i say love like a knife it can cut deep inside word be like weapon they wound sometimes i do not really mean to hurt you i do not want to see you go i know i make you cry but baby if i could turn back time if i could find a way i would take back those word that would hurt you and you would stay if i could reach the star i would give em all to you then you would love me love me like you use to do if i could turn back time my world be shatter i be tear apart like someone take a knife and drive it deep in my heart you walk out that door i swear that i do not care but i lose everything darling then and there too strong to tell you i be sorry too proud to tell you i be wrong i know that i be blind and darling if i could turn back time if i could find a way i would take back those word that will hurt you and you would stay if i could reach the star i would give them all to you then you would love me love me like you use to do oh if i could turn back time if i could turn back time if i could turn back time whoa baby i do not really mean to hurt you i do not want to see you go i know i make you cry but baby if i could turn back time if i could find a way i would take back those word that hurt you if i could reach the star i would give em all to you then you would love me love me like you use to do if i could turn back time if i could find a way then maybe maybe maybe you would stay reach the star if i could reach the star all to you i would give em all to you,/lyric/27566382/Cher/If+I+Could+Turn+Back+Time+%5BAlbum+Version%5D,['Pop/Rock'],4:00,"['dramatic', 'sentimental', 'theatrical', 'passionate', 'reflective', 'romantic', 'stylish', 'brassy']",If I Could Turn Back Time,https://www.allmusic.com/song/if-i-could-turn-back-time-mt0000537578
