,Unnamed: 0,album_artist,album_mood,album_title,allmusic_href,lyrics,lyrics(normalized_no_stopwords),lyrics(normalized_with_stopwords),lyrics_href,track_genres,track_length,track_moods,track_title,track_url
42,42,Michael Bublé,brassy,Caught in the Act,/album/caught-in-the-act-mw0000703573,"Never know how much I love you, never know how much I care
When you put your arms around me, I get a fever that's so hard to bear
You give me fever when you kiss me, fever when you hold me tight
Fever in the the morning, fever all through the night

Sun lights up the daytime, moon lights up the night
I light up when you call my name, and you know I'm gonna treat you right
You give me fever when you kiss me, fever when you hold me tight
Fever in the the morning, fever all through the night

Everybody's got the fever, that is something you all know
Fever isn't such a new thing, fever started long ago
Romeo loved Juliet, Juliet she felt the same
When he put his arms around her, he said ""Julie baby you're my flame""

Thou givest fever, when we kisseth, fever with thy flaming youth
Fever I'm afire, fever yea I burn forsooth
Captain Smith and Pocahontas had a very mad affair
When her Daddy tried to kill him, she said ""daddy-o don't you dare""

Give me fever with his kisses, fever when he holds me tight
Fever I'm his Missus, Oh daddy won't you treat him right

Now you've listened to my story, here's the point I have made:
Chicks were born to give you fever, be it Fahrenheit or Centigrade
They give you fever when you kiss them, fever if you live and learn
Fever till you sizzle, what a lovely way to burn
What a lovely way to burn
What a lovely way to burn",never know much love never know much care put arm around get fever hard bear give fever kiss fever hold tight fever morning fever night sun light daytime moon light night light call name know go treat right give fever kiss fever hold tight fever morning fever night everybody get fever something know fever not new thing fever start long ago romeo love juliet juliet feel put arm around say julie baby flame thou givest fever kisseth fever thy flaming youth fever afire fever yea burn forsooth captain smith pocahonta mad affair daddy try kill say daddy not dare give fever kiss fever hold tight fever missus oh daddy not treat right listen story point make chick bear give fever fahrenheit centigrade give fever kiss fever live learn fever till sizzle lovely way burn lovely way burn lovely way burn,never know how much i love you never know how much i care when you put your arm around me i get a fever that be so hard to bear you give me fever when you kiss me fever when you hold me tight fever in the the morning fever all through the night sun light up the daytime moon light up the night i light up when you call my name and you know i be go to treat you right you give me fever when you kiss me fever when you hold me tight fever in the the morning fever all through the night everybody get the fever that be something you all know fever be not such a new thing fever start long ago romeo love juliet juliet she feel the same when he put his arm around her he say julie baby you be my flame thou givest fever when we kisseth fever with thy flaming youth fever i be afire fever yea i burn forsooth captain smith and pocahonta have a very mad affair when her daddy try to kill him she say daddy o do not you dare give me fever with his kiss fever when he hold me tight fever i be his missus oh daddy will not you treat him right now you have listen to my story her the point i have make chick be bear to give you fever be it fahrenheit or centigrade they give you fever when you kiss them fever if you live and learn fever till you sizzle what a lovely way to burn what a lovely way to burn what a lovely way to burn,/lyric/6053477/Michael+Bubl%C3%A9/Fever,"['Vocal', 'Pop/Rock', 'Jazz']",,"['smooth', 'stylish', 'confident', 'dramatic', 'sophisticated', 'swaggering', 'theatrical', 'brassy']",Fever,https://www.allmusic.com/song/fever-mt0026757293
43,43,Michael Bublé,brassy,Caught in the Act,/album/caught-in-the-act-mw0000703573,"Come fly with me, let's fly let's fly away
If you can use some exotic booze
There's a bar in far Bombay
Come fly with me, let's fly let's fly away

Come fly with me, let's float down to Peru
In lama land, there's a one man band
And he'll toot his flute for you
Come fly with me, let's take off in the blue

Once I get you up there,
Where the air is rarefied
We'll just glide
Starry eyed
Once I get you up there
I'll be holding you so near
You may hear the angels cheer
Just because we're together

Weather wise it's such a lovely day
Just say the words, and we'll beat the birds
Down to Acapulco bay
It's perfect, for a flying honeymoon, they say
Come fly with me
Let's fly, let's fly away

Once I get you up there,
Where the air is rarefied
We'll just glide
Starry eyed
Once I get you up there
I'll be holding you so near
You may hear all the angels cheer
Just because we're together

Weather wise it's such a lovely day
You just say the words, and I'll beat the birds
Down to Acapulco bay
It's perfect, for a flying honeymoon, they say
Come fly with me
Let's fly, let's fly away
Pack up let's fly away",come fly let us fly let us fly away use exotic booze bar far bombay come fly let us fly let us fly away come fly let us float peru lama land one man band toot flute come fly let us take blue get air rarefy glide starry eyed get hold near may hear angel cheer together weather wise lovely day say word beat bird acapulco bay perfect flying honeymoon say come fly let us fly let us fly away get air rarefy glide starry eyed get hold near may hear angel cheer together weather wise lovely day say word beat bird acapulco bay perfect flying honeymoon say come fly let us fly let us fly away pack let us fly away,come fly with me let us fly let us fly away if you can use some exotic booze there be a bar in far bombay come fly with me let us fly let us fly away come fly with me let us float down to peru in lama land there be a one man band and he will toot his flute for you come fly with me let us take off in the blue once i get you up there where the air be rarefy we will just glide starry eyed once i get you up there i will be hold you so near you may hear the angel cheer just because we be together weather wise it be such a lovely day just say the word and we will beat the bird down to acapulco bay it be perfect for a flying honeymoon they say come fly with me let us fly let us fly away once i get you up there where the air be rarefy we will just glide starry eyed once i get you up there i will be hold you so near you may hear all the angel cheer just because we be together weather wise it be such a lovely day you just say the word and i will beat the bird down to acapulco bay it be perfect for a flying honeymoon they say come fly with me let us fly let us fly away pack up let us fly away,/lyric/6053488/Michael+Bubl%C3%A9/Come+Fly+With+Me,"['Vocal', 'Pop/Rock', 'Jazz']",,"['smooth', 'stylish', 'confident', 'lush', 'sophisticated', 'brassy', 'exuberant', 'fun']",Come Fly With Me,https://www.allmusic.com/song/come-fly-with-me-mt0014656004
44,44,Michael Bublé,brassy,Caught in the Act,/album/caught-in-the-act-mw0000703573,"Well, it's a marvelous night for a moondance
With the stars up above in your eyes
A fantabulous night to make romance
'Neath the cover of October skies

And all the leaves on the trees are falling
To the sound of the breezes that blow
And I'm trying to please to the calling
Of your heart-strings that play soft and low

And all the night's magic seems to whisper and hush
And all the soft moonlight seems to shine in your blush

Can I just have one a' more moondance with you, my love
Can I just make some more romance with a-you, my love

Well I want to make love to you tonight
I can't wait till the morning has come
And I know now the time is just right
And straight into my arms you will run

And when you come my heart will be waiting
To make sure you're never alone
There and then all my dreams will come true, dear
There and then I will make you my own

And everytime I touch you, you just tremble inside
And I know how much you want me that you can't hide

Can I just have one a' more moondance with you, my love
Can I just make some more romance with a-you, my love

Well, it's a marvelous night for a moondance
With the stars up above in your eyes
A fantabulous night to make romance
'Neath the cover of October skies

And all the leaves on the trees are falling
To the sound of the breezes that blow
And I'm trying to please to the calling
Of your heart-strings that play soft and low

And all the night's magic seems to whisper and hush
And all the soft moonlight seems to shine in your blush

One more moondance with you in the moonlight
Can't I just have one more dance with you my love",well marvelous night moondance star eye fantabulous night make romance neath cover october sky leaf tree fall sound breeze blow try please calling heart string play soft low night magic seem whisper hush soft moonlight seem shine blush one moondance love make romance love well want make love tonight not wait till morning come know time right straight arm run come heart wait make sure never alone dream come true dear make everytime touch tremble inside know much want not hide one moondance love make romance love well marvelous night moondance star eye fantabulous night make romance neath cover october sky leaf tree fall sound breeze blow try please calling heart string play soft low night magic seem whisper hush soft moonlight seem shine blush one moondance moonlight not one dance love,well it be a marvelous night for a moondance with the star up above in your eye a fantabulous night to make romance neath the cover of october sky and all the leaf on the tree be fall to the sound of the breeze that blow and i be try to please to the calling of your heart string that play soft and low and all the night magic seem to whisper and hush and all the soft moonlight seem to shine in your blush can i just have one a more moondance with you my love can i just make some more romance with a you my love well i want to make love to you tonight i can not wait till the morning have come and i know now the time be just right and straight into my arm you will run and when you come my heart will be wait to make sure you be never alone there and then all my dream will come true dear there and then i will make you my own and everytime i touch you you just tremble inside and i know how much you want me that you can not hide can i just have one a more moondance with you my love can i just make some more romance with a you my love well it be a marvelous night for a moondance with the star up above in your eye a fantabulous night to make romance neath the cover of october sky and all the leaf on the tree be fall to the sound of the breeze that blow and i be try to please to the calling of your heart string that play soft and low and all the night magic seem to whisper and hush and all the soft moonlight seem to shine in your blush one more moondance with you in the moonlight can not i just have one more dance with you my love,/lyric/6053478/Michael+Bubl%C3%A9/Moondance,"['Vocal', 'Pop/Rock', 'Jazz']",,"['smooth', 'stylish', 'dramatic', 'lush', 'sophisticated', 'brassy', 'intimate', 'romantic']",Moondance,https://www.allmusic.com/song/moondance-mt0014669461
45,45,Michael Bublé,brassy,Caught in the Act,/album/caught-in-the-act-mw0000703573,"I can only give you love that lasts forever, 
And a promise to be near each time you call. 
And the only heart I own 
For you and you alone 
That's all, 
That's all... 

I can only give you country walks in springtime 
And a hand to hold when leaves begin to fall;
And a love whose burning light 
Will warm the winter's night 
That's all, 
That's all. 

There are those I am sure who have told you, 
They would give you the world for a toy. 
All I have are these arms to enfold you, 
And a love even time can't destroy. 

If you're wondering what I'm asking in return, dear, 
You'll be glad to know that my demands are small. 
Say it's me that you'll adore, 
For now and evermore 
That's all, 
That's all.",give love last forever promise near time call heart alone give country walk springtime hand hold leaf begin fall love whose burn light warm winter night sure tell would give world toy arm enfold love even time not destroy wonder ask return dear glad know demand small say adore evermore,i can only give you love that last forever and a promise to be near each time you call and the only heart i own for you and you alone that be all that be all i can only give you country walk in springtime and a hand to hold when leaf begin to fall and a love whose burn light will warm the winter night that be all that be all there be those i be sure who have tell you they would give you the world for a toy all i have be these arm to enfold you and a love even time can not destroy if you be wonder what i be ask in return dear you will be glad to know that my demand be small say it be me that you will adore for now and evermore that be all that be all ,/lyric/6053489/Michael+Bubl%C3%A9/That%27s+All,"['Vocal', 'Pop/Rock', 'Jazz']",,"['smooth', 'stylish', 'confident', 'brassy', 'exuberant', 'intimate', 'amiable/good-natured', 'sentimental']",That's All,https://www.allmusic.com/song/thats-all-mt0014657728
46,46,Michael Bublé,brassy,Caught in the Act,/album/caught-in-the-act-mw0000703573,"For once in my life I have someone who needs me
Someone I?ve needed so long
For once unafraid I can go where life leads me and somehow I know I?ll be strong

For once I can touch what my heart used to dream of
Long before I knew
Someone warm like you
Who have my dreams come true

For once in my life I won't let sorrow hurt me
Not like it's hurt me before

For once I have someone I know won't desert me
I?m not alone anymore

For once I can say 
This is mine you can?t take it
As long as I know I have love I can make it
For once in my life I have someone who needs me

For once I can say
This is mine you can?t take it

As long as I know I have love we can make it
For once in my life I have someone who needs me",life someone need someone need long unafraid go life lead somehow know ill strong touch heart use dream long know someone warm like dream come true life not let sorrow hurt not like hurt someone know not desert not alone anymore say mine not take long know love make life someone need say mine not take long know love make life someone need,for once in my life i have someone who need me someone i have need so long for once unafraid i can go where life lead me and somehow i know ill be strong for once i can touch what my heart use to dream of long before i know someone warm like you who have my dream come true for once in my life i will not let sorrow hurt me not like it be hurt me before for once i have someone i know will not desert me i be not alone anymore for once i can say this be mine you can not take it as long as i know i have love i can make it for once in my life i have someone who need me for once i can say this be mine you can not take it as long as i know i have love we can make it for once in my life i have someone who need me,/lyric/6053480/Michael+Bubl%C3%A9/For+Once+in+My+Life,"['Vocal', 'Pop/Rock', 'Jazz']",,"['smooth', 'stylish', 'confident', 'dramatic', 'lush', 'sophisticated', 'theatrical', 'brassy']",For Once in My Life,https://www.allmusic.com/song/for-once-in-my-life-mt0014713531
47,47,Michael Bublé,brassy,Caught in the Act,/album/caught-in-the-act-mw0000703573,"This love of mine goes on and on
Tho' life is empty since you have gone
You're always on my mind, tho' out of sight
It's lonesome through the day
But oh the night

I cry my heart out 
It's bound to break
Since nothing matters, let it break
I ask the sun and the moon
The stars that shine
What's to become of it, this love of mine

I ask the sun and the moon
The stars that shine
What's to become of it
This love of mine
This love of mine",love mine go tho life empty since go always mind tho sight lonesome day oh night cry heart bind break since nothing matter let break ask sun moon star shine become love mine ask sun moon star shine become love mine love mine,this love of mine go on and on tho life be empty since you have go you be always on my mind tho out of sight it be lonesome through the day but oh the night i cry my heart out it be bind to break since nothing matter let it break i ask the sun and the moon the star that shine what be to become of it this love of mine i ask the sun and the moon the star that shine what be to become of it this love of mine this love of mine,/lyric/33228192/Michael+Bubl%C3%A9/This+Love+of+Mine,"['Vocal', 'Pop/Rock', 'Jazz']",,"['smooth', 'stylish', 'confident', 'lush', 'sophisticated', 'brassy', 'intimate', 'romantic']",This Love,https://www.allmusic.com/song/this-love-mt0014679465
48,48,Michael Bublé,brassy,Caught in the Act,/album/caught-in-the-act-mw0000703573,"This thing called love I just can't handle it
This thing called love I must get round to it
I ain't ready
Crazy little thing called love

This thing (this thing)
Called love (called love)
It cries (like a baby)
In a cradle all night
It swings (woo woo)
It jives (woo woo)
It shakes all over like a jelly fish
I kinda like it
Crazy little thing called love

There goes my baby
She knows how to rock 'n' roll
She drives me crazy
She gives me hot and cold fever
Then she leaves me in a cool cool sweat

I gotta be cool, relax, get hip
And get on my track's
Take a back seat, hitch-hike
And take a long ride on my motorbike
Until I'm ready
Crazy little thing called love

I gotta be cool, relax, get hip
And get on my track's
Take a back seat (ah hum), hitch-hike (ah hum)
And take a long ride on my motorbike
Until I'm ready (ready Freddie)
Crazy little thing called love

This thing called love I just can't handle it
This thing called love I must get round to it
I ain't ready
Ooh ooh ooh ooh

Crazy little thing called love",thing call love not handle thing call love must get round not ready crazy little thing call love thing thing call love call love cry like baby cradle night swing woo woo jive woo woo shake like jelly fish kinda like crazy little thing call love go baby know rock n roll drive crazy give hot cold fever leave cool cool sweat get cool relax get hip get track take back seat hitch hike take long ride motorbike ready crazy little thing call love get cool relax get hip get track take back seat ah hum hitch hike ah hum take long ride motorbike ready ready freddie crazy little thing call love thing call love not handle thing call love must get round not ready ooh ooh ooh ooh crazy little thing call love,this thing call love i just can not handle it this thing call love i must get round to it i as not ready crazy little thing call love this thing this thing call love call love it cry like a baby in a cradle all night it swing woo woo it jive woo woo it shake all over like a jelly fish i kinda like it crazy little thing call love there go my baby she know how to rock n roll she drive me crazy she give me hot and cold fever then she leave me in a cool cool sweat i get to be cool relax get hip and get on my track take a back seat hitch hike and take a long ride on my motorbike until i be ready crazy little thing call love i get to be cool relax get hip and get on my track take a back seat ah hum hitch hike ah hum and take a long ride on my motorbike until i be ready ready freddie crazy little thing call love this thing call love i just can not handle it this thing call love i must get round to it i as not ready ooh ooh ooh ooh crazy little thing call love,/lyric/6085869/Michael+Bubl%C3%A9/Crazy+Little+Thing+Called+Love,"['Vocal', 'Pop/Rock', 'Jazz']",,"['stylish', 'confident', 'smooth', 'swaggering', 'theatrical', 'brassy', 'celebratory', 'cheerful']",Crazy Little Thing Called Love,https://www.allmusic.com/song/crazy-little-thing-called-love-mt0035213074
