,Unnamed: 0,album_artist,album_mood,album_title,allmusic_href,lyrics,lyrics(normalized_no_stopwords),lyrics(normalized_with_stopwords),lyrics_href,track_genres,track_length,track_moods,track_title,track_url
26,26,Aerosmith,brassy,Permanent Vacation,/album/permanent-vacation-mw0000192978,"I got a letter from a friend the other morning
He say it's hot down by Montego Bay
I got the point and now I think it's finally dawning
Yeah, yeah, I got to get away
I got to take myself a Permanent Vacation
The sky's the limit, but my plane won't fly
My nose is clean and Lordie don't need no sedation
Yeah, yeah, and that's the reason why
I really need it, really, really need St. Tropez
I want a tan where the sun it never shines
I really need it, really, really need St. Tropez
You best believe it that I got to get away
I got a sister, man she really got a pin head
She think she kinky but she can't get straight
She say she livin', but I kinda think she's brain dead
Just excess baggage on a late night freight
I really need it, really, really need St. Tropez
I want a tan where the sun it never shines
I really need it, really, really need St. Tropez
You best believe it that I got to get away
I gotta take me on a Permanent Vacation
The girl's be cummin' down in Cayman Brack
I gotta hand it to a firm situation
Yeah, yeah, got to cut me some slack
I really need it, really, really need St. Tropez
I want a tan where the sun it never shines
I really need it, really, really need St. Tropez
I really need it, really need it, really really...",get letter friend morning say hot montego bay get point think finally dawn yeah yeah get get away get take permanent vacation skys limit plane not fly nose clean lordie not need no sedation yeah yeah reason really need really really need st tropez want tan sun never shin really need really really need st tropez best believe get get away get sister man really get pin head think kinky not get straight say livin kinda think brain dead excess baggage late night freight really need really really need st tropez want tan sun never shin really need really really need st tropez best believe get get away get take permanent vacation girl cummin cayman brack get hand firm situation yeah yeah get cut slack really need really really need st tropez want tan sun never shin really need really really need st tropez really need really need really really,i get a letter from a friend the other morning he say it be hot down by montego bay i get the point and now i think it be finally dawn yeah yeah i get to get away i get to take myself a permanent vacation the skys the limit but my plane will not fly my nose be clean and lordie do not need no sedation yeah yeah and that be the reason why i really need it really really need st tropez i want a tan where the sun it never shin i really need it really really need st tropez you best believe it that i get to get away i get a sister man she really get a pin head she think she kinky but she can not get straight she say she livin but i kinda think she be brain dead just excess baggage on a late night freight i really need it really really need st tropez i want a tan where the sun it never shin i really need it really really need st tropez you best believe it that i get to get away i get to take me on a permanent vacation the girl be cummin down in cayman brack i get to hand it to a firm situation yeah yeah get to cut me some slack i really need it really really need st tropez i want a tan where the sun it never shin i really need it really really need st tropez i really need it really need it really really ,/lyric/229334/Aerosmith/Permanent+Vacation,['Pop/Rock'],4:49,"['brassy', 'campy', 'cynical/sarcastic', 'energetic', 'exuberant', 'fun', 'humorous', 'irreverent']",Permanent Vacation,https://www.allmusic.com/song/permanent-vacation-mt0036155005
27,27,Aerosmith,brassy,Permanent Vacation,/album/permanent-vacation-mw0000192978,"You telling lies thinking I can't see
You don't cry 'cause you're laughing at me
I'm down (I'm really down)
I'm down (down on the ground)
I'm down (I'm really down)
How can you laugh when you know I'm down
(How can you laugh) when you know I'm down

Man buys ring woman throws it away
Same old thing happens every day
I'm down (I'm really down)
I'm down (down on the ground)
I'm down (I'm really down)
How can you laugh when you know I'm down
(How can you laugh) when you know I'm down

We're all alone and there's nobody else
You still moan: ""Keep your hands to yourself""
I'm down (I'm really down)
I'm down (down on the ground)
I'm down (I'm really down)
How can you laugh when you know I'm down
(How can you laugh) when you know I'm down
Don't you know that I'm down (I'm really down)
Don't you know that I'm down (I'm really down)
Down on the ground (I'm really down)
Don't you know that I'm down (I'm really down)
Down, down, down",tell lie think not see not cry ecause laugh really ground really laugh know laugh know man buy ring woman throw away old thing happen every day really ground really laugh know laugh know alone nobody else still moan keep hand really ground really laugh know laugh know not know really not know really ground really not know really,you tell lie think i can not see you do not cry ecause you be laugh at me i be down i be really down i be down down on the ground i be down i be really down how can you laugh when you know i be down how can you laugh when you know i be down man buy ring woman throw it away same old thing happen every day i be down i be really down i be down down on the ground i be down i be really down how can you laugh when you know i be down how can you laugh when you know i be down we be all alone and there be nobody else you still moan keep your hand to yourself i be down i be really down i be down down on the ground i be down i be really down how can you laugh when you know i be down how can you laugh when you know i be down do not you know that i be down i be really down do not you know that i be down i be really down down on the ground i be really down do not you know that i be down i be really down down down down,/lyric/229335/Aerosmith/I%27m+Down,['Pop/Rock'],2:19,"['brassy', 'campy', 'cynical/sarcastic', 'energetic', 'exuberant', 'fun', 'humorous', 'irreverent']",I'm Down,https://www.allmusic.com/song/im-down-mt0036155006
28,28,Pretenders,brassy,Pretenders II,/album/pretenders-ii-mw0000650649,"I'm the adultress
But i didn't want to be and i'm convenient
And i make good tea
I stand accused
Of the worst crime in history
That's my mystery
I'm the adultress

I go to the park
With a bag of crumbs for the birds
That's where we meet without words
He takes my hand
And stares into the wood
There's nothing to understand
It's understood
I'm the adultress

Look at the fool
Made up to go out
She's desperate and lonely
But she's puttin' it about
Look at the spinster
Comin' down off the shelf
She's in love and she hates herself

Don't try to stop me
Don't get in my way
It's too late
I've made my play
Does misery love company
I'll be in the bar
You'll find me",adultress not want convenient make good tea stand accuse bad crime history mystery adultress go park bag crumb bird meet without word take hand star wood nothing understand understand adultress look fool make go desperate lonely puttin look spinster comin shelf love hat not try stop not get way late make play misery love company bar find,i be the adultress but i do not want to be and i be convenient and i make good tea i stand accuse of the bad crime in history that be my mystery i be the adultress i go to the park with a bag of crumb for the bird that be where we meet without word he take my hand and star into the wood there be nothing to understand it be understand i be the adultress look at the fool make up to go out she be desperate and lonely but she be puttin it about look at the spinster comin down off the shelf she be in love and she hat herself do not try to stop me do not get in my way it be too late i have make my play do misery love company i will be in the bar you will find me,/lyric/9754901/Pretenders/The+Adultress+%5BLive%5D%5B%23%5D,['Pop/Rock'],3:55,"['brash', 'raucous', 'boisterous', 'brassy', 'gutsy', 'confrontational', 'energetic', 'reflective']",The Adultress,https://www.allmusic.com/song/the-adultress-mt0010717876
29,29,Pretenders,brassy,Pretenders II,/album/pretenders-ii-mw0000650649,"You're not supposed to do that 
You know you're not allowed to 
But you seem to get some kind of kick 
Out of doing what you're not allowed to 
You deliberately defy the rules 
'Cause the law's upheld by fools 
Shit on that 
Bad boys get spanked

You can look but don't touch 
But no you can't resist 
Don't you ever think about the consequence 
Guys like you never do 
That's the kind of stuff boys are made out of 
That's the kind of stuff girls are made out of 
Bad boys get spanked 
Bad boys get spanked

You don't listen do you asshole 
Don't be a punk all your life 
Someone's gonna sort you out 
They'll try to make a man out of you 
Say yes sir, say no sir 
Say yes ma'am, say no ma'am 
Shit on that 
Bad boys get spanked 
Bad boys get spanked

Get spanked, get spanked 
Come here, get spanked 
Bad boys get spanked 
Come here, get spanked",not suppose know not allow seem get kind kick not allow deliberately defy rule ecause law uphold fool shit bad boy get spank look not touch no not resist not ever think consequence guy like never kind stuff boy make kind stuff girl make bad boy get spank bad boy get spank not listen asshole not punk life someone go sort try make man say yes sir say no sir say yes madam say no madam shit bad boy get spank bad boy get spank get spanked get spank come get spank bad boy get spank come get spank,you be not suppose to do that you know you be not allow to but you seem to get some kind of kick out of do what you be not allow to you deliberately defy the rule ecause the law uphold by fool shit on that bad boy get spank you can look but do not touch but no you can not resist do not you ever think about the consequence guy like you never do that be the kind of stuff boy be make out of that be the kind of stuff girl be make out of bad boy get spank bad boy get spank you do not listen do you asshole do not be a punk all your life someone go to sort you out they will try to make a man out of you say yes sir say no sir say yes madam say no madam shit on that bad boy get spank bad boy get spank get spanked get spank come here get spank bad boy get spank come here get spank,/lyric/9754908/Pretenders/Bad+Boys+Get+Spanked+%5BLive%5D%5B%23%5D,['Pop/Rock'],4:04,"['brassy', 'confident', 'brash', 'boisterous', 'freewheeling', 'gutsy', 'energetic', 'rambunctious']",Bad Boys Get Spanked,https://www.allmusic.com/song/bad-boys-get-spanked-mt0010695649
30,30,Pretenders,brassy,Pretenders II,/album/pretenders-ii-mw0000650649,"You guys are the pits of the world!

Oh, this is no place for me
Burnin' down the interbelt, from jacuzzi to jacuzzi
It's all right for you man
Gettin' smashed, gettin' suntanned
But i know my place
Where's my suitcase?

Pack it up or throw it away
What i can't carry, bury
Oh you remember me, i remember you
But that was a long, long time ago
When i was passin' through

All my family, all my friends, my lover
I got to find them
My enemies, my new family, my new friends
My future enemies, i got to flush them out

Pack it all up, nothing goes in storage
I'm burnin' every bridge
Burn, baby, burn
I see your dog got shot
Well, hell, never mind
That's show biz, big boy
You've got to be cruel to be kind

Oh, give over and admit it
I've been tearing down the interstate
Like some kind of bleeding cat
It's all right for the boss
His gain's my loss
That gets me down, it really gets me down

So pack it up and cut the crap
When the clock starts talkin', i start walkin'
When you pass in your porsche
Please don't offer me a ride
I may be a skunk
But you're a piece of junk, and furthermore
I don't like your trousers
Your appalling taste in women
And what about your mind
Your insipid record collection
That dumb home video center
The usual pronography
And all you scumbags around the world
You're the pits of the world!
",guy pit world oh no place burnin interbelt jacuzzi jacuzzi right man gettin smash gettin suntanned know place suitcase pack throw away not carry bury oh remember remember long long time ago passin family friend lover get find enemy new family new friend future enemy get flush pack nothing go storage burnin every bridge burn baby burn see dog get shoot well hell never mind show biz big boy get cruel kind oh give admit tear interstate like kind bleed cat right boss gain loss get really get pack cut crap clock start talkin start walkin pass porsche please not offer ride may skunk piece junk furthermore not like trouser appalling taste woman mind insipid record collection dumb home video center usual pronography scumbag around world pit world,you guy be the pit of the world oh this be no place for me burnin down the interbelt from jacuzzi to jacuzzi it be all right for you man gettin smash gettin suntanned but i know my place where be my suitcase pack it up or throw it away what i can not carry bury oh you remember me i remember you but that be a long long time ago when i be passin through all my family all my friend my lover i get to find them my enemy my new family my new friend my future enemy i get to flush them out pack it all up nothing go in storage i be burnin every bridge burn baby burn i see your dog get shoot well hell never mind that be show biz big boy you have get to be cruel to be kind oh give over and admit it i have be tear down the interstate like some kind of bleed cat it be all right for the boss his gain my loss that get me down it really get me down so pack it up and cut the crap when the clock start talkin i start walkin when you pass in your porsche please do not offer me a ride i may be a skunk but you be a piece of junk and furthermore i do not like your trouser your appalling taste in woman and what about your mind your insipid record collection that dumb home video center the usual pronography and all you scumbag around the world you be the pit of the world ,/lyric/9754917/Pretenders/Pack+It+Up+%5BRadio+Mix+-+Outtake%5D%5B%23%5D%5BOuttake%5D,['Pop/Rock'],3:50,"['brassy', 'confident', 'brash', 'boisterous', 'freewheeling', 'gutsy', 'energetic', 'rambunctious']",Pack It Up,https://www.allmusic.com/song/pack-it-up-mt0010757224
31,31,Pretenders,brassy,Pretenders II,/album/pretenders-ii-mw0000650649,"Take, take, take, takin' what you don't need
You'll get, get, gettin' what you don't need
Stand back, take a look and take heed
All the children in god's kingdom bleed
See the networks of concrete and steel
They've no mystery but what they reveal
Tells a story of a future that's void
Of the beauty and the majesty that life on
Earth is meant to be

Talk, talk, talk, talk about the government
And not a word about political favor
Everything touched is my political choice
The life you take is your political voice
The sacred cows come crashing to their knees
Golden harvest reaped without intelligence
There's no chance between the heavens and the seas
In a blood bath don't laugh
Grab your piece of golden calf

Waste not want not pick it up
Waste not want not pick it up
Waste not want not pick it up
Waste not want not

Do unto others as you wish be done to you
There's a million lies 'round everything true
You slaughter when you feast
You disrespect the beast
Make our beds and lie there, take your share

Waste not want not pick it up
Waste not want not pick it up
Waste not want not pick it up
Pick it up and eat it
Waste not want not",take take take takin not need get get gettin not need stand back take look take heed child god kingdom bleed see network concrete steel no mystery reveal tell story future void beauty majesty life earth mean talk talk talk talk government not word political favor everything touch political choice life take political voice sacred cow come crash knee golden harvest reap without intelligence no chance heaven sea blood bath not laugh grab piece golden calf waste not want not pick waste not want not pick waste not want not pick waste not want not unto wish million lie round everything true slaughter feast disrespect beast make bed lie take share waste not want not pick waste not want not pick waste not want not pick pick eat waste not want not,take take take takin what you do not need you will get get gettin what you do not need stand back take a look and take heed all the child in god kingdom bleed see the network of concrete and steel they have no mystery but what they reveal tell a story of a future that be void of the beauty and the majesty that life on earth be mean to be talk talk talk talk about the government and not a word about political favor everything touch be my political choice the life you take be your political voice the sacred cow come crash to their knee golden harvest reap without intelligence there be no chance between the heaven and the sea in a blood bath do not laugh grab your piece of golden calf waste not want not pick it up waste not want not pick it up waste not want not pick it up waste not want not do unto other as you wish be do to you there be a million lie round everything true you slaughter when you feast you disrespect the beast make our bed and lie there take your share waste not want not pick it up waste not want not pick it up waste not want not pick it up pick it up and eat it waste not want not,/lyric/996284/Pretenders/Waste+Not%2C+Want+Not,['Pop/Rock'],3:43,"['brassy', 'confident', 'bravado', 'laid-back/mellow', 'rousing', 'street-smart']","Waste Not, Want Not",https://www.allmusic.com/song/waste-not-want-not-mt0010699900
32,32,Pretenders,brassy,Pretenders II,/album/pretenders-ii-mw0000650649,"Way up in the sky
Over the city, over tokyo
Silver light, summer moon
You'll be over somebody's winter this afternoon
While the dolphins swim in the sea
You're going grey, my baby
Still the war is waging endlessly
Day after day, day after day

Way up in the sky
Over the city and lake erie
You remember the flats, you were there
Out every night mr moonlight

Round and round and round we go
Just like yesterday

Way up in the sky
Over the city where you sleep tonight
The light outside your window blinks
""hotel, hotel, hotel""
Open the blind and dream in a moonbeam

When the war's finally over
We'll meet again
And pick up where we left off",way sky city tokyo silver light summer moon somebodys winter afternoon dolphin swim sea go grey baby still war wag endlessly day day day day way sky city lake erie remember flat every night mr moonlight round round round go like yesterday way sky city sleep tonight light outside window blink hotel hotel hotel open blind dream moonbeam war finally meet pick leave,way up in the sky over the city over tokyo silver light summer moon you will be over somebodys winter this afternoon while the dolphin swim in the sea you be go grey my baby still the war be wag endlessly day after day day after day way up in the sky over the city and lake erie you remember the flat you be there out every night mr moonlight round and round and round we go just like yesterday way up in the sky over the city where you sleep tonight the light outside your window blink hotel hotel hotel open the blind and dream in a moonbeam when the war finally over we will meet again and pick up where we leave off,/lyric/9754912/Pretenders/Day+After+Day+%5BLive%5D%5B%23%5D,['Pop/Rock'],3:45,"['confident', 'freewheeling', 'energetic', 'intimate', 'bravado', 'boisterous', 'brash', 'brassy']",Day After Day,https://www.allmusic.com/song/day-after-day-mt0032035550
33,33,Pretenders,brassy,Pretenders II,/album/pretenders-ii-mw0000650649,"Those jealous dogs, always on the alert 
Tattle tale rights 
They'll take your back and leave your shirt 
Like that jealous bitch 
Always wanting more 
The courts have made her rich 
And the click of high heels down the corridor 
Jealous, jealous, jealous dogs

Those jealous dogs, detectives every one 
Don't be a sucker all your life 
She's gonna have you hung 
Evidence, evidence, evidence 
Suspicion invites treachery 
Oh you really got taken 
Bringing home the bacon 
Jealous, jealous, jealous dogs

Bow wow wow, here come the dogs 
Grrrrrr, here come the dogs 
Don't lay down, here come the dogs 
Stand straight don't slouch 
Get down off the couch

You're gonna wet on the couch 
Get down, get down

Those jealous dogs, they get worse and worse 
Every time you turn around 
They're sniffin' at your purse 
Who do they think we are? 
What do they think we do? 
It's hard to get in the mood 
When you're treated like some kind of dog food 
Jealous, jealous, jealous dogs

Bow wow wow, here come the dogs 
Oh ruff ruff, here come the dogs 
Get down, here come the dogs 
Mind your leg, roll over and beg

Happy birthday 
Merry Christmas",jealous dog always alert tattle tale right take back leave shirt like jealous bitch always want court make rich click high heel corridor jealous jealous jealous dog jealous dog detective every one not sucker life go hang evidence evidence evidence suspicion invite treachery oh really get take bring home bacon jealous jealous jealous dog bow wow wow come dog grrrrrr come dog not lay come dog stand straight not slouch get couch go wet couch get get jealous dog get bad bad every time turn around sniffin purse think think hard get mood treat like kind dog food jealous jealous jealous dog bow wow wow come dog oh ruff ruff come dog get come dog mind leg roll beg happy birthday merry christma,those jealous dog always on the alert tattle tale right they will take your back and leave your shirt like that jealous bitch always want more the court have make her rich and the click of high heel down the corridor jealous jealous jealous dog those jealous dog detective every one do not be a sucker all your life she be go to have you hang evidence evidence evidence suspicion invite treachery oh you really get take bring home the bacon jealous jealous jealous dog bow wow wow here come the dog grrrrrr here come the dog do not lay down here come the dog stand straight do not slouch get down off the couch you be go to wet on the couch get down get down those jealous dog they get bad and bad every time you turn around they be sniffin at your purse who do they think we be what do they think we do it be hard to get in the mood when you be treat like some kind of dog food jealous jealous jealous dog bow wow wow here come the dog oh ruff ruff here come the dog get down here come the dog mind your leg roll over and beg happy birthday merry christma,/lyric/996286/Pretenders/Jealous+Dogs,['Pop/Rock'],5:36,"['confident', 'freewheeling', 'energetic', 'intimate', 'bravado', 'brash', 'brassy', 'gutsy']",Jealous Dogs,https://www.allmusic.com/song/jealous-dogs-mt0010715472
