,Unnamed: 0,album_artist,album_mood,album_title,allmusic_href,lyrics,lyrics(normalized_no_stopwords),lyrics(normalized_with_stopwords),lyrics_href,track_genres,track_length,track_moods,track_title,track_url
17,17,Depeche Mode,cathartic,Sounds of the Universe,/album/sounds-of-the-universe-mw0000809901,"The way you move
Has got me yearning
The way you move
Has left me burning
I know you know what you're doing to me
I know my hands will never be free
I know what it's like to be
In chains

The way you move
Is meant to haunt me
The way you move
To tempt and taunt me
I know you knew on the day you were born
I know somehow I should've been warned
I know I walk every midnight to dawn
In Chains

In chains, I'm in chains
In chains, I'm in chains

You've got me dying for you
Its you that I'm living through
You've got me praying to you
Saying to you anything you want me to
You've got me reaching for you
My souls beseeching me too
You've got me singing to you
Bringing to you anything you ask me to

The way you move
Is mesmerizing
The way you move
Is hypnotizing
I know I crumble when you are around
Start to mumble a bit of a false sound
Straggle, stumble, shackled and bound
In chains

In chains, I'm in chains
In chains, I'm in chains

You've got me dying for you
Its you that I'm living through
You've got me praying to you
Saying to you anything you want me to
You've got me reaching for you
My souls beseeching me too
You've got me singing to you
Bringing to you anything you ask me to

I'm in chains

In chains, I'm in chains
In chains, I'm in chains
In chains, I'm in chains",way move get yearn way move leave burn know know know hand never free know like chain way move mean haunt way move tempt taunt know know day bear know somehow warn know walk every midnight dawn chain chain chain chain chain get die live get pray say anything want get reach soul beseech get sing bring anything ask way move mesmerize way move hypnotize know crumble around start mumble bit false sound straggle stumble shackle bind chain chain chain chain chain get die live get pray say anything want get reach soul beseech get sing bring anything ask chain chain chain chain chain chain chain,the way you move have get me yearn the way you move have leave me burn i know you know what you be do to me i know my hand will never be free i know what it be like to be in chain the way you move be mean to haunt me the way you move to tempt and taunt me i know you know on the day you be bear i know somehow i should have be warn i know i walk every midnight to dawn in chain in chain i be in chain in chain i be in chain you have get me die for you its you that i be live through you have get me pray to you say to you anything you want me to you have get me reach for you my soul beseech me too you have get me sing to you bring to you anything you ask me to the way you move be mesmerize the way you move be hypnotize i know i crumble when you be around start to mumble a bit of a false sound straggle stumble shackle and bind in chain in chain i be in chain in chain i be in chain you have get me die for you its you that i be live through you have get me pray to you say to you anything you want me to you have get me reach for you my soul beseech me too you have get me sing to you bring to you anything you ask me to i be in chain in chain i be in chain in chain i be in chain in chain i be in chain,/lyric/16265374/Depeche+Mode/In+Chains,['Pop/Rock'],6:53,"['brooding', 'dramatic', 'intimate', 'nocturnal', 'bleak', 'cathartic', 'hungry', 'passionate']",In Chains,https://www.allmusic.com/song/in-chains-mt0010042265
18,18,Depeche Mode,cathartic,Sounds of the Universe,/album/sounds-of-the-universe-mw0000809901,"We are here, we can love
We share something
I'm sure that you'll mean the world to me
When you get, what you need
It's no way of knowing
What you get is another hole to feed

Your name was the one that was always chosen
Your words and the kindness that set me free
Words can leave you broken inside
You'll have to decide
I'm hanging onto my pride

We are here, we can love
We share something
I'm sure that you'll mean the world to me
The shame as a hole that has kept us frozen
You open my eyes to the world I could believe

This world has left me broken inside
I'll have to decide
I'm hanging onto my pride

Words can leave you broken inside
You'll have to decide
I'm hanging onto my pride

We are here

This world can leave you broken inside
I'll have to decide
I'm hanging onto my pride

We are here, we can love
We share something
I'm sure that you'll mean the world to me
The shame as a hole that has kept us frozen
You open my eyes to the world I could believe",love share something sure mean world get need no way know get another hole feed name one always choose word kindness set free word leave break inside decide hang onto pride love share something sure mean world shame hole keep us freeze open eye world could believe world leave break inside decide hang onto pride word leave break inside decide hang onto pride world leave break inside decide hang onto pride love share something sure mean world shame hole keep us freeze open eye world could believe,we be here we can love we share something i be sure that you will mean the world to me when you get what you need it be no way of know what you get be another hole to feed your name be the one that be always choose your word and the kindness that set me free word can leave you break inside you will have to decide i be hang onto my pride we be here we can love we share something i be sure that you will mean the world to me the shame as a hole that have keep us freeze you open my eye to the world i could believe this world have leave me break inside i will have to decide i be hang onto my pride word can leave you break inside you will have to decide i be hang onto my pride we be here this world can leave you break inside i will have to decide i be hang onto my pride we be here we can love we share something i be sure that you will mean the world to me the shame as a hole that have keep us freeze you open my eye to the world i could believe,/lyric/16265375/Depeche+Mode/Hole+to+Feed,['Pop/Rock'],3:59,"['dramatic', 'intimate', 'melancholy', 'nocturnal', 'atmospheric', 'bitter', 'cathartic', 'intense']",Hole to Feed,https://www.allmusic.com/song/hole-to-feed-mt0010042266
19,19,Depeche Mode,cathartic,Sounds of the Universe,/album/sounds-of-the-universe-mw0000809901,"I was born with the wrong sign
In the wrong house
With the wrong ascendancy
I took the wrong road
That led to the wrong tendencies
I was in the wrong place at the wrong time
For the wrong reason and the wrong rhyme
On the wrong day of the wrong week
I used the wrong method with the wrong technique

Wrong

Wrong

There's something wrong with me chemically
Something wrong with me inherently
The wrong mix in the wrong genes
I reached the wrong ends by the wrong means
It was the wrong plan
In the wrong hands
With the wrong theory for the wrong man
The wrong lies, on the wrong vibes
The wrong questions with the wrong replies

Wrong

Wrong

I was marching to the wrong drum
With the wrong scum
Pissing out the wrong energy
Using all the wrong lines
And the wrong signs
With the wrong intensity
I was on the wrong page of the wrong book
With the wrong rendition of the wrong hook
Made the wrong move, every wrong night
With the wrong tune played till it sounded right yeah

Wrong

Wrong

Too long

Wrong

I was born with the wrong sign
In the wrong house
With the wrong ascendancy
I took the wrong road
That led to the wrong tendencies
I was in the wrong place at the wrong time
For the wrong reason and the wrong rhyme
On the wrong day of the wrong week
I used the wrong method with the wrong technique

Wrong",bear wrong sign wrong house wrong ascendancy take wrong road lead wrong tendency wrong place wrong time wrong reason wrong rhyme wrong day wrong week use wrong method wrong technique wrong wrong something wrong chemically something wrong inherently wrong mix wrong gene reach wrong end wrong mean wrong plan wrong hand wrong theory wrong man wrong lie wrong vibe wrong question wrong reply wrong wrong march wrong drum wrong scum piss wrong energy use wrong line wrong sign wrong intensity wrong page wrong book wrong rendition wrong hook make wrong move every wrong night wrong tune play till sound right yeah wrong wrong long wrong bear wrong sign wrong house wrong ascendancy take wrong road lead wrong tendency wrong place wrong time wrong reason wrong rhyme wrong day wrong week use wrong method wrong technique wrong,i be bear with the wrong sign in the wrong house with the wrong ascendancy i take the wrong road that lead to the wrong tendency i be in the wrong place at the wrong time for the wrong reason and the wrong rhyme on the wrong day of the wrong week i use the wrong method with the wrong technique wrong wrong there be something wrong with me chemically something wrong with me inherently the wrong mix in the wrong gene i reach the wrong end by the wrong mean it be the wrong plan in the wrong hand with the wrong theory for the wrong man the wrong lie on the wrong vibe the wrong question with the wrong reply wrong wrong i be march to the wrong drum with the wrong scum piss out the wrong energy use all the wrong line and the wrong sign with the wrong intensity i be on the wrong page of the wrong book with the wrong rendition of the wrong hook make the wrong move every wrong night with the wrong tune play till it sound right yeah wrong wrong too long wrong i be bear with the wrong sign in the wrong house with the wrong ascendancy i take the wrong road that lead to the wrong tendency i be in the wrong place at the wrong time for the wrong reason and the wrong rhyme on the wrong day of the wrong week i use the wrong method with the wrong technique wrong,/lyric/19318745/Depeche+Mode/Wrong+%5BTrentem%C3%B8ller+Club+Remix%5D,['Pop/Rock'],3:13,"['dramatic', 'nocturnal', 'angst-ridden', 'bitter', 'bleak', 'cathartic', 'reflective', 'self-conscious']",Wrong,https://www.allmusic.com/song/wrong-mt0010042267
20,20,Depeche Mode,cathartic,Sounds of the Universe,/album/sounds-of-the-universe-mw0000809901,"They're almost falling over you
Why don't they call a truce
What ever they are trying to do
Its of little use
They're drowning you in compliments
Trying to furnish proof
Although they speak with eloquence
There is little truth

[Chorus]
You're bright, you're strong, you know the right from wrong
At least to some degree
You're wise, you're tough, you've heard their lies enough
You smile in sympathy

I'm watching your serenity
The way your so transense
The tidiest absurdities
Your patience never ends
And as the night begins to fade
Your heading for the door
Followed by sad parade
Your on your own once more

[Chorus: x2]",almost fall not call truce ever try little use drown compliment try furnish proof although speak eloquence little truth [ chorus ] bright strong know right wrong least degree wise tough hear lie enough smile sympathy watch serenity way transense tidy absurditi patience never end night begin fade heading door follow sad parade [ chorus x ],they be almost fall over you why do not they call a truce what ever they be try to do its of little use they be drown you in compliment try to furnish proof although they speak with eloquence there be little truth [ chorus ] you be bright you be strong you know the right from wrong at least to some degree you be wise you be tough you have hear their lie enough you smile in sympathy i be watch your serenity the way your so transense the tidy absurditi your patience never end and as the night begin to fade your heading for the door follow by sad parade your on your own once more [ chorus x ],/lyric/16265379/Depeche+Mode/In+Sympathy,['Pop/Rock'],4:54,"['brooding', 'nocturnal', 'bitter', 'bleak', 'cathartic', 'rebellious', 'restrained', 'snide']",In Sympathy,https://www.allmusic.com/song/in-sympathy-mt0010042270
21,21,Depeche Mode,cathartic,Sounds of the Universe,/album/sounds-of-the-universe-mw0000809901,"Peace will come to me
Peace will come to me

I'm leaving bitterness behind
This time I'm cleaning up my mind
There is no space for the regrets
I will remember to forget

Just look at me
I am walking love incarnate
Look at the frequencies of which I vibrate
I'm going to light up the world

Peace will come to me
Peace will come to me

I'm leaving anger in the past
With all the shadows that it cast
There is radar in my heart
I should have trusted from the start

Just look at me
I am a living act of holiness
Giving all the positive virtues that I possess
I'm going to light up the world

Peace will come to me
Just wait and see
Peace will come to me
It's meant to be
Peace will come to me
Just wait and see
Peace will come to me
It's inevitability",peace come peace come leave bitterness behind time clean mind no space regret remember forget look walk love incarnate look frequency vibrate go light world peace come peace come leave anger past shadow cast radar heart trust start look live act holiness give positive virtue possess go light world peace come wait see peace come mean peace come wait see peace come inevitability,peace will come to me peace will come to me i be leave bitterness behind this time i be clean up my mind there be no space for the regret i will remember to forget just look at me i be walk love incarnate look at the frequency of which i vibrate i be go to light up the world peace will come to me peace will come to me i be leave anger in the past with all the shadow that it cast there be radar in my heart i should have trust from the start just look at me i be a live act of holiness give all the positive virtue that i possess i be go to light up the world peace will come to me just wait and see peace will come to me it be mean to be peace will come to me just wait and see peace will come to me it be inevitability,/lyric/16265380/Depeche+Mode/Peace,['Pop/Rock'],4:29,"['brooding', 'dramatic', 'intimate', 'melancholy', 'nocturnal', 'angst-ridden', 'bleak', 'cathartic']",Peace,https://www.allmusic.com/song/peace-mt0010042276
22,22,Depeche Mode,cathartic,Sounds of the Universe,/album/sounds-of-the-universe-mw0000809901,"[Chorus]
Come back Come back to me
I've been waiting here patiently

I've been walking a thin white line
Between love and hate
I could use a lil' company
A lil' kindness to go a long way

Weeks turn into months
Months turn into years
Reaching the same conclusions
Gathering up the fear

[Chorus]

I've been walking a thin white line
Between love and hate
I could use a lil' company
A lil' kindness to go a long way

Weeks turn into months
Months turn into years
Reaching the same conclusions
Gathering up the fear

[Chorus: x3]

Come back Come back to me",[ chorus ] come back come back wait patiently walk thin white line love hate could use lil company lil kindness go long way week turn month month turn year reach conclusion gather fear [ chorus ] walk thin white line love hate could use lil company lil kindness go long way week turn month month turn year reach conclusion gather fear [ chorus x ] come back come back,[ chorus ] come back come back to me i have be wait here patiently i have be walk a thin white line between love and hate i could use a lil company a lil kindness to go a long way week turn into month month turn into year reach the same conclusion gather up the fear [ chorus ] i have be walk a thin white line between love and hate i could use a lil company a lil kindness to go a long way week turn into month month turn into year reach the same conclusion gather up the fear [ chorus x ] come back come back to me,/lyric/16265381/Depeche+Mode/Come+Back,['Pop/Rock'],5:15,"['brooding', 'dramatic', 'intimate', 'melancholy', 'nocturnal', 'bleak', 'cathartic', 'gentle']",Come Back,https://www.allmusic.com/song/come-back-mt0010042275
23,23,Depeche Mode,cathartic,Sounds of the Universe,/album/sounds-of-the-universe-mw0000809901,"The sweetest perfection
To call my own
The slightest correction
Couldn't finely hone
The sweetest infection
Of body and mind
Sweetest injection
Of any kind

I stop and I stare too much
Afraid that I care too much
And I hardly dare to touch
For fear that the spell may be broken

When I need a drug in me
And it brings out the thug in me
Feel something tugging me
Then I want the real thing not tokens

The sweetest perfection...
Things you'd expect to be
Having effect on me
Pass undetectedly
But everyone knows what has got me

Takes me completely
Touches so sweetly
Reaches so deeply
I know that nothing can stop me

Sweetest perfection
An offer was made
An assorted collection
But I wouldn't trade

The sweetest perfection...
Takes me completely
Touches so sweetly
Reaches so deeply
Nothing can stop me",sweet perfection call slight correction could not finely hone sweet infection body mind sweet injection kind stop stare much afraid care much hardly dare touch fear spell may break need drug bring thug feel something tug want real thing not token sweet perfection thing would expect effect pass undetectedly everyone know get take completely touch sweetly reach deeply know nothing stop sweet perfection offer make assorted collection would not trade sweet perfection take completely touch sweetly reach deeply nothing stop,the sweet perfection to call my own the slight correction could not finely hone the sweet infection of body and mind sweet injection of any kind i stop and i stare too much afraid that i care too much and i hardly dare to touch for fear that the spell may be break when i need a drug in me and it bring out the thug in me feel something tug me then i want the real thing not token the sweet perfection thing you would expect to be have effect on me pass undetectedly but everyone know what have get me take me completely touch so sweetly reach so deeply i know that nothing can stop me sweet perfection an offer be make an assorted collection but i would not trade the sweet perfection take me completely touch so sweetly reach so deeply nothing can stop me,/lyric/33309042/Depeche+Mode/Sweetest+Perfection+%5B2006+Digital+Remaster%5D,['Pop/Rock'],4:33,"['brooding', 'dramatic', 'intimate', 'melancholy', 'nocturnal', 'bleak', 'cathartic', 'gentle']",Perfect,https://www.allmusic.com/song/perfect-mt0010042273
24,24,Depeche Mode,cathartic,Sounds of the Universe,/album/sounds-of-the-universe-mw0000809901,"It's one of those conversations
We've we've had them before

The ones that leave you empty
And wanting for more

Your eyes they tell me something
That I understand
Your eyes they hold the truth
And the truth is:

You're miles away [Repeat: x3]

Excuse me for my hesitation
'ave I met you before
Your face seems so familiar
And longing for more

Your eyes they tell me something
That I understand

Your eyes they hold the truth
And a truth is

You're miles away [Repeat: x3]

With all your superstitions
And empty lines
I could be just like you
Withdrawn but alive

Life it has its limitations
We all have our needs
Love could be the only answer
It lies underneath

Your eyes they tell me something
That I understand
Your eyes they hold the truth
And a truth is

You're miles away [Repeat: x3]",one conversation one leave empty want eye tell something understand eye hold truth truth mile away [ repeat x ] excuse hesitation ave meet face seem familiar longing eye tell something understand eye hold truth truth mile away [ repeat x ] superstition empty line could like withdrawn alive life limitation need love could answer lie underneath eye tell something understand eye hold truth truth mile away [ repeat x ],it be one of those conversation we have we have have them before the one that leave you empty and want for more your eye they tell me something that i understand your eye they hold the truth and the truth be you be mile away [ repeat x ] excuse me for my hesitation ave i meet you before your face seem so familiar and longing for more your eye they tell me something that i understand your eye they hold the truth and a truth be you be mile away [ repeat x ] with all your superstition and empty line i could be just like you withdrawn but alive life it have its limitation we all have our need love could be the only answer it lie underneath your eye they tell me something that i understand your eye they hold the truth and a truth be you be mile away [ repeat x ],/lyric/16265384/Depeche+Mode/Miles+Away-The+Truth+Is,['Pop/Rock'],4:14,"['brooding', 'dramatic', 'intimate', 'melancholy', 'nocturnal', 'bleak', 'cathartic', 'restrained']",Miles Away/The Truth Is,https://www.allmusic.com/song/miles-away-the-truth-is-mt0010042272
25,25,Depeche Mode,cathartic,Sounds of the Universe,/album/sounds-of-the-universe-mw0000809901,"They call you Jezebel
Whenever we walk in
You're going straight to hell
For wanton acts of sin, they say
And that I'll have to pay
But I need you just this way

They call you Jezebel
For what you like to wear
You're morally unwell
They say you never care for me
But what the fail to see is that your games are the key

Open their eyes to the beauty
Open their hearts to the fun
Open their minds to the idea that you don't own someone

They call you Jezebel
Whenever men walk by
They say that they can tell
The longing in your eyes is real
And how you really feel
But they can't see your appeal

Jezebel",call jezebel whenever walk go straight hell wanton act sin say pay need way call jezebel like wear morally unwell say never care fail see game key open eye beauty open heart fun open mind idea not someone call jezebel whenever man walk say tell longing eye real really feel not see appeal jezebel,they call you jezebel whenever we walk in you be go straight to hell for wanton act of sin they say and that i will have to pay but i need you just this way they call you jezebel for what you like to wear you be morally unwell they say you never care for me but what the fail to see be that your game be the key open their eye to the beauty open their heart to the fun open their mind to the idea that you do not own someone they call you jezebel whenever man walk by they say that they can tell the longing in your eye be real and how you really feel but they can not see your appeal jezebel,/lyric/16265385/Depeche+Mode/Jezebel,['Pop/Rock'],4:41,"['brooding', 'intimate', 'melancholy', 'nocturnal', 'bleak', 'cathartic', 'gentle', 'plaintive']",Jezebel,https://www.allmusic.com/song/jezebel-mt0010042271
26,26,Depeche Mode,cathartic,Sounds of the Universe,/album/sounds-of-the-universe-mw0000809901,"I could corrupt you
In a heart beat
You think your so special
Think your so sweet
What are you trying don't even tempt me
Soon you'll be crying unwishing you dreamt of be
You'll be calling out my name
When you need someone to blame

I can corrupt you
It would be easy
Watching you suffer
God, it would please me

I wanna touch you with my little finger
I know it will crush you my memory would linger
You'd be crying out in pain
Begging me to play my games

I can corrupt you
It will be ugly
They could sedate you
But what good would drugs be
I wanna touch you with my hands on your hips
It would be too much to
Place my lips on your lips
You'll be calling out my name
Begging me to play my games",could corrupt heart beat think special think sweet try not even tempt soon cry unwish dream call name need someone blame corrupt would easy watch suffer god would please wanna touch little finger know crush memory would linger would cry pain beg play game corrupt ugly could sedate good would drug wanna touch hand hip would much place lip lip call name beg play game,i could corrupt you in a heart beat you think your so special think your so sweet what be you try do not even tempt me soon you will be cry unwish you dream of be you will be call out my name when you need someone to blame i can corrupt you it would be easy watch you suffer god it would please me i wanna touch you with my little finger i know it will crush you my memory would linger you would be cry out in pain beg me to play my game i can corrupt you it will be ugly they could sedate you but what good would drug be i wanna touch you with my hand on your hip it would be too much to place my lip on your lip you will be call out my name beg me to play my game,/lyric/16265386/Depeche+Mode/Corrupt,['Pop/Rock'],8:58,"['brooding', 'dramatic', 'intimate', 'melancholy', 'nocturnal', 'bleak', 'cathartic', 'gentle']",Corrupt,https://www.allmusic.com/song/corrupt-mt0010042277
